,doi,tweets,archive,subject-area,covid,title,authors,abstract,posted
0,10.1101/2021.08.31.458411,34,bioRxiv,Plant Biology,False,An Arabidopsis root phloem pole cell atlas reveals PINEAPPLE genes as transitioners to autotrophy,"[{'name': 'Sofia Otero'}, {'name': 'Iris Sevilem'}, {'name': 'Pawel Roszak'}, {'name': 'Yipeng Lu'}, {'name': 'Valerio Di Vittori'}, {'name': 'Matthieu Bourdon'}, {'name': 'Lothar Kalmbach'}, {'name': 'Bernhard Blob'}, {'name': 'Jung-ok Heo'}, {'name': 'Federico Peruzzo'}, {'name': 'Thomas Laux'}, {'name': 'Alisdair R. Fernie'}, {'name': 'Hugo Tavares'}, {'name': 'Yka Helariutta'}]","<p>Single cell sequencing has recently allowed the generation of exhaustive root cell atlases. However, some cell types are elusive and remain underrepresented. Here, we use a second- generation single cell approach, where we zoom in on the root transcriptome sorting with specific markers to profile the phloem poles at an unprecedented resolution. Our data highlight the similarities among the developmental trajectories and gene regulatory networks communal to protophloem sieve element (PSE) adjacent lineages in relation to PSE enucleation, a key event in phloem biology.</p><p>As a signature for early PSE-adjacent lineages, we have identified a set of DNA-binding with one finger (DOF) transcription factors, the PINEAPPLEs (PAPL), that act downstream of <italic>PHLOEM EARLY DOF</italic> (<italic>PEAR</italic>) genes, and are important to guarantee a proper root nutrition in the transition to autotrophy.</p><p>Our data provide a holistic view of the phloem poles that act as a functional unit in root development.</p>",2021-09-01
1,10.1101/2021.08.31.21262943,29,medRxiv,Public and Global Health,True,Ensemble forecast of COVID-19 in Karnataka for vulnerability assessment and policy interventions,"[{'name': 'Sashikumaar Ganesan'}, {'name': 'Deepak Subramani'}, {'name': 'Thivin Anandh'}, {'name': 'Divij Ghose'}, {'name': 'Giridhara R Babu'}]","<p>We present an ensemble forecast for Wave-3 of COVID-19 in the state of Karnataka, India, using the IISc Population Balance Model for infectious disease spread. The reported data of confirmed, recovered, and deceased cases in Karnataka from 1 July 2020 to 4 July 2021 is utilized to tune the model’s parameters, and an ensemble forecast is done from 5 July 2021 to 30 June 2022. The ensemble is built with 972 members by varying seven critical parameters that quantify the uncertainty in the spread dynamics (antibody waning, viral mutation) and interventions (pharmaceutical, non-pharmaceutical). The probability of Wave-3, the peak date distribution, and the peak caseload distribution are estimated from the ensemble forecast. Our analysis shows that the most significant causal factors are compliance to Covid-appropriate behavior, daily vaccination rate, and the immune escape new variant emergence-time. These causal factors determine when and how severe the Wave-3 of COVID-19 would be in Karnataka. We observe that when compliance to Covid-Appropriate Behavior is good (i.e., lockdown-like compliance), the emergence of new immune-escape variants beyond Sep ‘21 is unlikely to induce a new wave. A new wave is inevitable when compliance to Covid-Appropriate Behavior is only partial. Increasing the daily vaccination rates reduces the peak active caseload at Wave-3. Consequently, the hospitalization, ICU, and Oxygen requirements also decrease. Compared to Wave-2, the ensemble forecast indicates that the number of daily confirmed cases of children (0-17 years) at Wave-3’s peak could be seven times more on average. Our results provide insights to plan science-informed policy interventions and public health response.</p>",2021-09-02
2,10.1101/2021.09.03.458877,27,bioRxiv,Pharmacology and Toxicology,True,Discovery of highly potent pancoronavirus fusion inhibitors that also effectively inhibit COVID-19 variants from the UK and South Africa,"[{'name': 'Francesca Curreli'}, {'name': 'Shahad Ahmed'}, {'name': 'Sofia M. B. Victor'}, {'name': 'Aleksandra Drelich'}, {'name': 'Siva S. Panda'}, {'name': 'Andrea Altieri'}, {'name': 'Alexander Kurkin'}, {'name': 'Chien-Te Tseng'}, {'name': 'Christopher Hillyer'}, {'name': 'Asim Debnath'}]","<p>We report the discovery of a series of benzoic acid-based inhibitors that show highly potent pancoronavirus activity. Some compounds also show complete inhibition of CPE (IC<sub>100</sub>) at 1.25 μM against an authentic SARS-CoV-2 (US_WA-1/2020). Furthermore, the most active inhibitors also potently inhibited variants initially identified in the UK and South Africa. We confirmed that one of the potent inhibitors binds to the prefusion spike protein trimer of SARS-CoV-2 by SPR. Besides, we showed that they inhibit virus-mediated cell-cell fusion. The ADME data show druglike characteristics, and in vivo PK in rats demonstrated excellent half-life (t½) of 11.3 h, mean resident time (MRT) of 14.2 h, and orally bioavailable. Despite the presence of ene-rhodamine moiety, we conclusively demonstrated that these inhibitors target the viral spike protein and are not promiscuous or colloidal aggregators. We expect the lead inhibitors to pave the way for further development to preclinical and clinical candidates.</p>",2021-09-03
3,10.1101/2021.08.30.458146,24,bioRxiv,Developmental Biology,False,The control of transcriptional memory by stable mitotic bookmarking,"[{'name': 'Maëlle Bellec'}, {'name': 'Jérémy Dufourt'}, {'name': 'George Hunt'}, {'name': 'Hélène Lenden-Hasse'}, {'name': 'Antonio Trullo'}, {'name': 'Amal Zine El Aabidine'}, {'name': 'Marie Lamarque'}, {'name': 'Marissa M Gaskill'}, {'name': 'Heloïse Faure-Gautron'}, {'name': 'Mattias Mannervik'}, {'name': 'Melissa M Harrison'}, {'name': 'Jean-Christophe Andrau'}, {'name': 'Cyril Favard'}, {'name': 'Ovidiu Radulescu'}, {'name': 'Mounia Lagha'}]","<p>To maintain cellular identities during development, gene expression profiles must be faithfully propagated through cell generations. The reestablishment of gene expression patterns upon mitotic exit is thought to be mediated, in part, by mitotic bookmarking by transcription factors (TF). However, the mechanisms and functions of TF mitotic bookmarking during early embryogenesis remain poorly understood. In this study, taking advantage of the naturally synchronized mitoses of <italic>Drosophila</italic> early embryos, we provide evidence that the pioneer-like transcription factor GAF acts as stable mitotic bookmarker during zygotic genome activation. We report that GAF remains associated to a large fraction of its interphase targets including at <italic>cis</italic>-regulatory sequences of key developmental genes, with both active and repressive chromatin signatures. GAF mitotic targets are globally accessible during mitosis and are bookmarked via histone acetylation (H4K8ac). By monitoring the kinetics of transcriptional activation in living embryos, we provide evidence that GAF binding establishes competence for rapid activation upon mitotic exit.</p>",2021-08-30
4,10.1101/2021.08.31.458428,9,bioRxiv,Cell Biology,False,Characterisation of a nucleo-adhesome,"[{'name': 'Adam Byron'}, {'name': 'Billie G. C. Griffith'}, {'name': 'Ana Herrero'}, {'name': 'Alexander E. P. Loftus'}, {'name': 'Emma S. Koeleman'}, {'name': 'John C. Dawson'}, {'name': 'Linda Kogerman'}, {'name': 'Niamh McGivern'}, {'name': 'Jayne Culley'}, {'name': 'Graeme R. Grimes'}, {'name': 'Bryan Serrels'}, {'name': 'Alex von Kriegsheim'}, {'name': 'Valerie G. Brunton'}, {'name': 'Margaret C. Frame'}]","<p>In addition to central functions in cell adhesion signalling, integrin-associated proteins have wider roles at sites distal to adhesion receptors. In experimentally defined adhesomes, we noticed that there is clear enrichment of proteins that localise to the nucleus, and conversely, we now report that nuclear proteomes contain a class of adhesome components that localise to the nucleus. We here defined a nucleo-adhesome, providing experimental evidence for a remarkable scale of nuclear localisation of adhesion proteins, establishing a framework for interrogating nuclear adhesion protein functions. In adding to nuclear FAK’s known roles in regulating transcription, we now show that nuclear FAK regulates expression of many adhesion-related proteins that localise to the nucleus and that nuclear FAK binds to the adhesome component and nuclear protein Hic-5. FAK and Hic-C work together in the nucleus, co-regulating a subset of genes transcriptionally. We describe the first nucleo-adhesome using a squamous cancer cell model, and demonstrate the new principle that there are nuclear adhesion protein subcomplexes that cooperate to control transcription.
<fig id=""ufig1"" position=""float"" fig-type=""figure"" orientation=""portrait""><graphic xmlns:xlink=""http://www.w3.org/1999/xlink"" xlink:href=""458428v1_ufig1"" position=""float"" orientation=""portrait"" /></fig></p>",2021-08-31
5,10.1101/2021.08.29.458102,8,bioRxiv,Molecular Biology,False,Exo1-protected DNA nicks direct crossover formation in meiosis,"[{'name': 'Michael Gioia'}, {'name': 'Lisette Payero'}, {'name': 'Gianno Pannafino'}, {'name': 'Jun Jie Chen'}, {'name': 'Sagar Salim'}, {'name': 'Ghanim Fajith'}, {'name': 'Amamah F. Farnaz'}, {'name': 'Sherikat Momoh'}, {'name': 'Michelle Scotland'}, {'name': 'Vandana Raghavan'}, {'name': 'Carol Manhart'}, {'name': 'Akira Shinohara'}, {'name': 'K.T. Nishant'}, {'name': 'Eric Alani'}]","<p>In most sexually reproducing organisms crossing over between chromosome homologs during meiosis is critical for the viability of haploid gametes. Most crossovers that form in meiosis in budding yeast result from the biased resolution of double Holliday Junction (dHJ) intermediates. This dHJ resolution step involves the actions Rad2/XPG family nuclease Exo1 and the Mlh1-Mlh3 mismatch repair endonuclease. At present little is known about how these factors act in meiosis at the molecular level. Here we show that Exo1 promotes meiotic crossing over by protecting DNA nicks from ligation. We found that structural elements in Exo1 required for interactions with DNA, such as bending of DNA during nick/flap recognition, are critical for its role in crossing over. Consistent with these observations, meiotic expression of the Rad2/XPG family member Rad27 partially rescued the crossover defect in <italic>exo1</italic> null mutants, and meiotic overexpression of Cdc9 ligase specifically reduced the crossover levels of <italic>exo1</italic> DNA binding mutants to levels approaching the <italic>exo1</italic> null. In addition, our work identified a role for Exo1 in crossover interference that appears independent of its resection activity. Together, these studies provide experimental evidence for Exo1-protected nicks being critical for the formation of meiotic crossovers and their distribution.</p>",2021-08-30
6,10.1101/2021.09.01.458557,7,bioRxiv,Cell Biology,False,Functional fluorescently-tagged human profilin,"[{'name': 'Morgan L. Pimm'}, {'name': 'Xinbei Liu'}, {'name': 'Farzana Tuli'}, {'name': 'Ashley Lojko'}, {'name': 'Jessica L. Henty-Ridilla'}]","<p>Profilin is an essential regulator of actin and microtubule dynamics and therefore a critical control point for the normal division, motility, and morphology of cells. Most studies of profilin have focused on biochemical investigations using purified protein because high cellular concentrations (121 µM) present challenges for conventional imaging modalities. In addition, past studies that employed direct labeling or conventional fusion protein strategies compromised different facets of profilin function. We engineered a fluorescently-labeled profilin that retains native activities with respect to phosphoinositide lipids, actin monomers, formin-mediated actin assembly, and microtubule polymerization. This fluorescent profilin directly binds to dimers of tubulin (k<sub>D</sub> = 1.7 µM) and the microtubule lattice (k<sub>D</sub> = 10 µM) to stimulate microtubule assembly. In cells, our tagged profilin fully rescues profilin-1<sup>(-/-)</sup> cells from knockout-induced perturbations to cell shape, actin filament architecture, and microtubule arrays. Thus, this labeled profilin-1 is a reliable tool to investigate the dynamic interactions of profilin with actin or microtubules in live cell and in vitro applications.</p>",2021-09-02
7,10.1101/2021.08.30.458230,7,bioRxiv,Neuroscience,False,Disentangling the flow of signals between populations of neurons,"[{'name': 'Evren Gokcen'}, {'name': 'Anna I. Jasper'}, {'name': 'João D. Semedo'}, {'name': 'Amin Zandvakili'}, {'name': 'Adam Kohn'}, {'name': 'Christian K. Machens'}, {'name': 'Byron M. Yu'}]","<p>Technological advances have granted the ability to record from large populations of neurons across multiple brain areas. These recordings may illuminate how communication between areas contributes to brain function, yet a substantial barrier remains: How do we disentangle the concurrent, bidirectional flow of signals between two populations of neurons? We therefore propose here a novel dimensionality reduction framework: Delayed Latents Across Groups (DLAG). DLAG disentangles signals relayed in both directions; identifies how these signals are represented by each population; and characterizes how they evolve over time and trial-to-trial. We demonstrate that DLAG performs well on synthetic datasets similar in scale to current neurophysiological recordings. Then we study simultaneously recorded populations in primate visual areas V1 and V2, where DLAG reveals signatures of concurrent yet selective communication. Our framework lays the foundation for dissecting the intricate flow of signals across populations of neurons, and how this signaling contributes to cortical computation.</p>",2021-09-01
8,10.1101/2021.08.30.458226,7,bioRxiv,Bioinformatics,False,De Novo Prediction of RNA 3D Structures with Deep Learning,"[{'name': 'Julius Ramakers'}, {'name': 'Christopher Frederik Blum'}, {'name': 'Sabrina König'}, {'name': 'Stefan Harmeling'}, {'name': 'Markus Kollmann'}]","<p>We present a Deep Learning approach to predict 3D folding structures of RNAs from their nucleic acid sequence. Our approach combines an autoregressive Deep Generative Model, Monte Carlo Tree Search, and a Score Model to find and rank the most likely folding structures for a given RNA sequence. We confirm the predictive power of our approach by setting new benchmarks for some longer sequences in a simulated blind test of the RNA Puzzles prediction challenge.</p>",2021-09-01
9,10.1101/2021.08.29.21262789,7,medRxiv,Epidemiology,True,Vaccines alone are no silver bullets: a modeling study on the impact of efficient contact tracing on COVID-19 infection and transmission,"[{'name': 'Dhesi Baha Raja'}, {'name': 'Nur Asheila Abdul Taib'}, {'name': 'Alvin Kuo Jing Teo'}, {'name': 'Vivek Jason Jayaraj'}, {'name': 'Choo-Yee Ting'}]","<sec><title>Background</title><p>The computer simulation presented in this study aimed to investigate the effect of contact tracing on COVID-19 transmission and infection in the context of rising vaccination rates.</p></sec><sec><title>Methods</title><p>This study proposed a deterministic SEIRV model with contact tracing and vaccination components. We initialized some parameters using the Malaysian COVID-19 data to inform the model. We defined contact tracing effectiveness as the proportion of contacts of a positive case that was successfully traced and vaccination rate as the proportion of daily doses administered per population in Malaysia. Sensitivity analyses on the untraced and infectious populations were conducted. The study presented in silico findings on multiple scenarios by varying the contact tracing effectiveness and daily vaccination rates.</p></sec><sec><title>Results</title><p>At a vaccination rate of 1.4%, a contact tracing with the effectiveness of 70% could delay the peak of untraced asymptomatic cases by 17 days and reduce the highest number of daily cases by 70% compared with a 30% contact tracing effectiveness. A similar trend was observed for symptomatic cases when a similar experiment setting was used. We also performed sensitivity analyses by using different combinations of contact tracing effectiveness and vaccination rates. In all scenarios, the effect of contact tracing on COVID-19 incidence persisted for both asymptomatic and symptomatic cases.</p></sec><sec><title>Conclusion</title><p>Despite testing only on two public health and social measures (PHSMs), we observed the scenario with low contact tracing and increasing vaccination rates successfully mimicked the current transmission trend in Malaysia. Hence, while vaccines are progressively rolled out, efficient contact tracing must be rapidly implemented concurrently to reach, find, test, isolate, and support the affected populations to bring the pandemic under control.</p></sec>",2021-08-30
10,10.1101/2021.08.31.458373,6,bioRxiv,Cell Biology,False,A Cytosolic Reductase Pathway is Required for Complete N-Glycosylation of an STT3B-Dependent Acceptor Site,"[{'name': 'Marcel van Lith'}, {'name': 'Marie Anne Pringle'}, {'name': 'Bethany Fleming'}, {'name': 'Giorgia Gaeta'}, {'name': 'Jisu Im'}, {'name': 'Reid Gilmore'}, {'name': 'Neil J Bulleid'}]","<p>N-linked glycosylation of proteins entering the secretory pathway is an essential post-translational modification required for protein stability and function. Previously, it has been shown that there is a temporal relationship between protein folding and glycosylation, which influences the occupancy of specific glycosylation sites. Here we use an <italic>in vitro</italic> translation system that reproduces the initial stages of secretory protein translocation, folding and glycosylation under defined redox conditions. We found that the efficiency of glycosylation of hemopexin was dependent upon a robust NADPH-dependent cytosolic reductive pathway, which could also be mimicked by the addition of a membrane impermeable reducing agent. The identified hypoglycosylated acceptor site is adjacent to a cysteine involved in a short range disulfide bond, which has been shown to be dependent on the STT3B-containing oligosaccharyl transferase. We also show that efficient glycosylation at this site is dependent on the STT3A-containing oligosaccharide transferase. Our results provide further insight into the important role of the ER redox conditions in glycosylation site occupancy and demonstrate a link between redox conditions in the cytosol and glycosylation efficiency.</p>",2021-09-01
11,10.1101/2021.08.31.21262937,6,medRxiv,Psychiatry and Clinical Psychology,False,Impairments in goal-directed action and reversal learning in a proportion of individuals with psychosis: evidence for differential phenotypes in early and persistent psychosis,"[{'name': 'Shuichi Suetani'}, {'name': 'Andrea Baker'}, {'name': 'Kelly Garner'}, {'name': 'Peter Cosgrove'}, {'name': 'Matilda Mackay-Sim'}, {'name': 'Dan Siskind'}, {'name': 'Graham K Murray'}, {'name': 'James G Scott'}, {'name': 'James P Kesby'}]","<p>Cognitive impairments in psychosis are one of the strongest predictors of functional decline. Cortico-striatal dysfunction may contribute to both psychosis and cognitive impairment in psychotic illnesses. The decision-making processes underlying goal-directed action and serial reversal learning can be measured and are sensitive to changes reflecting cortico-striatal dysfunction. As such, changes in decision-making performance may assist with predicting functional decline in people with psychosis. We assessed decision-making processes in healthy controls (N=34), and those with early psychosis (N=15) and persistent psychosis (N=45). We subclassified subjects based on intact/impaired goal-directed action. Compared with healthy controls (&lt;20%), a large proportion (58%) of those with persistent psychosis displayed impaired goal-directed action, predicting poor serial reversal learning performance. Computational approaches indicated that those with persistent psychosis were less deterministic in their decision-making. Those with impaired goal-directed action had a decreased capacity to rapidly update their prior beliefs in the face of changing contingencies. In contrast, the early psychosis group included a lower proportion of individuals with impaired goal-directed action (20%) and displayed a different cognitive phenotype from those with persistent psychosis. These findings suggest prominent decision-making deficits, indicative of cortico-striatal dysfunction, are present in a large proportion of people with persistent psychosis while those with early psychosis have relatively intact decision-making processes compared to healthy controls. It is unclear if there is a progressive decline in decision-making processes in some individuals with psychosis or if the presence of decision-making processes in early psychosis is predictive of a persistent trajectory of illness.</p>",2021-09-02
12,10.1101/2021.08.30.458270,5,bioRxiv,Microbiology,False,Global distribution of anaerobic dichloromethane degradation potential,"[{'name': 'Robert W. Murdoch'}, {'name': 'Gao Chen'}, {'name': 'Fadime Kara Murdoch'}, {'name': 'E. Erin Mack'}, {'name': 'Manuel I. Villalobos Solis'}, {'name': 'Robert L. Hettich'}, {'name': 'Frank E. Löffler'}]","<p>Anthropogenic activities and natural processes release dichloromethane (DCM), a toxic chemical with substantial ozone-depleting capacity. Specialized anaerobic bacteria metabolize DCM; however, the genetic basis for this process has remained elusive. Comparative genomics of the three known anaerobic DCM-degrading bacterial species revealed a homologous gene cluster, designated the methylene chloride catabolism (<italic>mec</italic>) gene cassette, comprising eight to ten genes with predicted 79.6 – 99.7% amino acid identity. Functional annotation identified genes encoding a corrinoid-dependent methyltransferase system, and shotgun proteomics applied to two DCM-catabolizing cultures revealed high expression of proteins encoded on the <italic>mec</italic> gene cluster during anaerobic growth with DCM. In a DCM-contaminated groundwater plume, the abundance of <italic>mec</italic> genes strongly correlated with DCM concentrations (R<sup>2</sup> = 0.71 – 0.85) indicating their value as process-specific bioremediation biomarkers. <italic>mec</italic> gene clusters were identified in metagenomes representing peat bogs, the deep subsurface, and marine ecosystems including oxygen minimum zones (OMZs), suggesting DCM turnover in diverse habitats. The broad distribution of anaerobic DCM catabolic potential suggests a relevant control function for emissions to the atmosphere, and a role for DCM as a microbial energy source in critical zone environments. The findings imply that the global DCM flux might be far greater than emission measurements suggest.</p><sec><title>Importance</title><p>Dichloromethane (DCM) is an increasing threat to stratospheric ozone with both anthropogenic and natural emission sources. Anaerobic bacterial metabolism of DCM has not yet been taken into consideration as a factor in the global DCM cycle. The discovery of the <italic>mec</italic> gene cassette associated with anaerobic bacterial DCM metabolism and its widespread distribution in environmental systems highlight a strong attenuation potential for DCM. Knowledge of the <italic>mec</italic> cassette offers new opportunities to delineate DCM sources, enables more robust estimates of DCM fluxes, supports refined DCM emission modeling and simulation of the stratospheric ozone layer, reveals a novel, ubiquitous C<sub>1</sub> carbon metabolic system, and provides prognostic and diagnostic tools supporting bioremediation of groundwater aquifers impacted by DCM.</p></sec>",2021-08-31
13,10.1101/2021.08.30.458233,5,bioRxiv,Genomics,False,Temporal inhibition of chromatin looping and enhancer accessibility during neuronal remodeling,"[{'name': 'Dahong Chen'}, {'name': 'Catherine E. McManus'}, {'name': 'Behram Radmanesh'}, {'name': 'Leah H. Matzat'}, {'name': 'Elissa P. Lei'}]","<p>During development, looping of an enhancer to a promoter is frequently observed in conjunction with temporal and tissue-specific transcriptional activation. The chromatin insulator-associated protein Shep promotes <italic>Drosophila</italic> post-mitotic neuronal remodeling by repressing transcription of master developmental regulators, such as <italic>brain tumor</italic> (<italic>brat</italic>), specifically in maturing neurons. Since insulator proteins can promote looping, we hypothesized that Shep antagonizes <italic>brat</italic> promoter interaction with an as yet unidentified enhancer. Using chromatin conformation capture and reporter assays, we identified two novel enhancer regions that increase in looping frequency with the <italic>brat</italic> promoter specifically in pupal brains after Shep depletion. The <italic>brat</italic> promoters and enhancers function independently of Shep, ruling out direct repression of these elements. Moreover, ATAC-seq in isolated neurons demonstrated that Shep restricts chromatin accessibility of a key <italic>brat</italic> enhancer as well as other enhancers genome-wide in remodeling pupal but not larval neurons. These enhancers are enriched for chromatin targets of Shep and are located at Shep-inhibited genes, suggesting direct Shep inhibition of enhancer accessibility and gene expression during neuronal remodeling. Our results provide evidence for temporal regulation of chromatin looping and enhancer accessibility during neuronal maturation.</p>",2021-09-01
