,doi,tweets,archive,subject-area,covid,title,authors,abstract,posted
120,10.1101/2021.05.13.444095,8,bioRxiv,Systems Biology,False,Leveraging the mass balances of cellular metabolism to infer absolute concentrations from relative abundance metabolomics data,"[{'name': 'Justin Y. Lee'}, {'name': 'Mark P. Styczynski'}]","<sec><title>Motivation</title><p>As the large-scale study of metabolites and a direct readout of a system’s metabolic state, metabolomics has significant appeal as a source of information for many metabolic modelling platforms and other metabolic analysis tools. However, metabolomics data are typically reported in terms of relative abundances, which precluding use with tools where absolute concentrations are necessary. While chemical standards can be used to determine the absolute concentrations of metabolites, they are often time-consuming to run, expensive, or unavailable for many metabolites. A computational framework that can infer absolute concentrations without the use of chemical standards would be highly beneficial to the metabolomics community.</p></sec><sec><title>Results</title><p>We have developed and characterized MetaboPAC, a computational strategy that leverages the mass balances of a system to infer absolute concentrations in metabolomics datasets. MetaboPAC uses a kinetic equations approach and an optimization approach to predict the most likely response factors that describe the relationship between absolute concentrations and their relative abundances. We determined that MetaboPAC performed significantly better than the other approaches assessed on noiseless data when at least 60% of kinetic equations are known <italic>a priori</italic>. Under the most realistic conditions (low sampling frequency, high noise data), MetaboPAC significantly outperformed other methods in the majority of cases when 100% of the kinetic equations were known. For metabolomics datasets extracted from systems that are well-studied and have partially known kinetic structures, MetaboPAC can provide valuable insight about their absolute concentration profiles.</p></sec>",2021-05-16
121,10.1101/2021.05.11.443644,8,bioRxiv,Biophysics,False,PIP2-dependent coupling of voltage sensor and pore domains in Kv7.2,"[{'name': 'Shashank Pant'}, {'name': 'Jiaren Zhang'}, {'name': 'Eung Chang Kim'}, {'name': 'Kin Lam'}, {'name': 'Hee Jung Chung'}, {'name': 'Emad Tajkhorshid'}]","<p>Phosphatidylinositol-4,5-bisphosphate (PIP<sub>2</sub>) is a signaling lipid which regulates voltage-gated K<sub>v</sub>7/<italic>KCNQ</italic> potassium channels. Altered PIP<sub>2</sub> sensitivity of neuronal K<sub>v</sub>7.2 channel is involved in <italic>KCNQ2</italic> epileptic encephalopathy. However, the molecular action of PIP<sub>2</sub> on K<sub>v</sub>7.2 gating remains largely elusive. Here, we use molecular dynamics simulations and electrophysiology to characterize PIP<sub>2</sub> binding sites in a human K<sub>v</sub>7.2 channel. In the closed state, PIP<sub>2</sub> localizes to the periphery of the voltage-sensing domain (VSD). In the open state, PIP<sub>2</sub> binds to 4 distinct interfaces formed by the cytoplasmic ends of the VSD, the gate, intracellular helices A and B and their linkers. PIP<sub>2</sub> binding induces bilayer-interacting conformation of helices A and B and the correlated motion of the VSD and the pore domain, whereas charge-neutralizing mutations block this coupling and reduce PIP<sub>2</sub> sensitivity of K<sub>v</sub>7.2 channels by disrupting PIP<sub>2</sub> binding. These findings reveal the allosteric role of PIP<sub>2</sub> in K<sub>v</sub>7.2 channel activation.</p>",2021-05-11
122,10.1101/2021.05.10.21256880,8,medRxiv,Genetic and Genomic Medicine,False,Characterization of direct and/or indirect genetic associations for multiple traits in longitudinal studies of disease progression,"[{'name': 'Myriam Brossard'}, {'name': 'Andrew D. Paterson'}, {'name': 'Osvaldo Espin-Garcia'}, {'name': 'Radu V. Craiu'}, {'name': 'Shelley B. Bull'}]","<p>When quantitative longitudinal traits are risk factors for disease progression, endogenous, and/or subject to random errors, joint model specification of multiple time-to-event and multiple longitudinal traits can effectively identify direct and/or indirect genetic association of single nucleotide polymorphisms (SNPs) with time-to-event traits. Here, we present a joint model that integrates: <italic>i)</italic> a linear mixed model describing the trajectory of each longitudinal trait as a function of time, SNP effects and subject-specific random effects, and <italic>ii)</italic> a frailty Cox survival model that depends on SNPs, longitudinal trajectory effects, and a subject-specific frailty term accounting for unexplained dependency between time-to-event traits. Inference is based on a two-stage approach with bootstrap joint covariance estimation. We develop a hypothesis testing procedure to identify direct and/or indirect SNP association with each time-to-event trait. Motivated by complex genetic architecture of type 1 diabetes complications (T1DC) observed in the Diabetes Control and Complications Trial (DCCT), we show by realistic simulation study that joint modelling of two time-to-T1DC (retinopathy, nephropathy) and two longitudinal risk factors (HbA1c, systolic blood pressure) reduces bias and improves identification of direct and/or indirect SNP associations, compared to alternative methods ignoring measurement errors in intermediate risk factors. Through analysis of DCCT, we identify two SNPs with indirect associations with multiple time-to-T1DC traits and obtain similar conclusions using alternative formulations of time-dependent HbA1c effects on T1DC. In total, joint analysis of multiple longitudinal and multiple time-to-event traits provides insight into aetiology of complex traits.</p>",2021-05-11
123,10.1101/2021.05.09.443282,8,bioRxiv,Cancer Biology,False,Dual G9A and EZH2 inhibition stimulates an anti-tumour immune response in ovarian high-grade serous carcinoma,"[{'name': 'Pavlina Spiliopoulou'}, {'name': 'Sarah Spear'}, {'name': 'Hasan Mirza'}, {'name': 'Ian Garner'}, {'name': 'Lynn McGarry'}, {'name': 'Fabio Grundland-Freile'}, {'name': 'Zhao Cheng'}, {'name': 'Darren P. Ennis'}, {'name': 'Sophie McNamara'}, {'name': 'Marina Natoli'}, {'name': 'Susan Mason'}, {'name': 'Karen Blyth'}, {'name': 'Peter D. Adams'}, {'name': 'Patricia Roxburgh'}, {'name': 'Matthew J. Fuchter'}, {'name': 'Bob Brown'}, {'name': 'Iain A. McNeish'}]","<p>Ovarian high-grade serous carcinoma (HGSC) prognosis correlates directly with presence of intratumoral lymphocytes. However, cancer immunotherapy has yet to achieve meaningful survival benefit in patients with HGSC. Epigenetic silencing of immunostimulatory genes is implicated in immune evasion in HGSC and re-expression of these genes could promote tumour immune clearance. We discovered that simultaneous inhibition of the histone methyltransferases G9A and EZH2 activates the CXCL10-CXCR3 axis and increases homing of intratumoral effector lymphocytes and natural killer cells whilst suppressing tumour-promoting FoxP3<sup>+</sup> CD4 T cells. The dual G9A/EZH2 inhibitor HKMTI-1-005 induced chromatin changes that resulted in the transcriptional activation of immunostimulatory gene networks, including the re-expression of elements of the ERV-K endogenous retroviral family. Importantly, treatment with HKMTI-1-005 improved the survival of mice bearing <italic>Trp53</italic><sup><italic>-/-</italic></sup>null ID8 ovarian tumours and resulted in tumour burden reduction.</p><p>These results indicate that inhibiting G9A and EZH2 in ovarian cancer alters the immune microenvironment and reduces tumour growth and therefore positions dual inhibition of G9A/EZH2 as a strategy for clinical development.</p><sec><title>Abstract Figure</title><fig id=""ufig1"" position=""float"" fig-type=""figure"" orientation=""portrait""><graphic xmlns:xlink=""http://www.w3.org/1999/xlink"" xlink:href=""443282v1_ufig1"" position=""float"" orientation=""portrait"" /></fig></sec>",2021-05-11
124,10.1101/2021.05.11.443558,8,bioRxiv,Cell Biology,False,Elongation factor ELOF1 drives transcription-coupled repair and prevents genome instability,"[{'name': 'Marit E Geijer'}, {'name': 'Di Zhou'}, {'name': 'Kathiresan Selvam'}, {'name': 'Barbara Steurer'}, {'name': 'Bastiaan Evers'}, {'name': 'Chirantani Mukherjee'}, {'name': 'Simona Cugusi'}, {'name': 'Marvin van Toorn'}, {'name': 'Melanie van der Woude'}, {'name': 'Wenzhi Gong'}, {'name': 'Roel Janssens'}, {'name': 'Anja Raams'}, {'name': 'Joyce HG Lebbink'}, {'name': 'Bart Geverts'}, {'name': 'Dalton A Plummer'}, {'name': 'Karel Bezstarosti'}, {'name': 'Arjan F Theil'}, {'name': 'Richard Mitter'}, {'name': 'Adriaan B Houtsmuller'}, {'name': 'Wim Vermeulen'}, {'name': 'Jeroen AA Demmers'}, {'name': 'Shisheng Li'}, {'name': 'Hannes Lans'}, {'name': 'René Bernards'}, {'name': 'Jesper Q Svejstrup'}, {'name': 'Arnab Ray Chaudhuri'}, {'name': 'John J Wyrick'}, {'name': 'Jurgen A Marteijn'}]","<p>Correct transcription is crucial for life. However, DNA damage severely impedes elongating RNA Polymerase II (Pol II), causing transcription inhibition and transcription-replication conflicts. Cells are equipped with intricate mechanisms to counteract the severe consequence of these transcription-blocking lesions (TBLs). However, the exact mechanism and factors involved remain largely unknown. Here, using a genome-wide CRISPR/cas9 screen, we identified elongation factor ELOF1 as an important new factor in the transcription stress response upon DNA damage. We show that ELOF1 has an evolutionary conserved role in Transcription-Coupled Nucleotide Excision Repair (TC-NER), where it promotes recruitment of the TC-NER factors UVSSA and TFIIH to efficiently repair TBLs and resume transcription. Additionally, ELOF1 modulates transcription to protect cells from transcription-mediated replication stress, thereby preserving genome stability. Thus, ELOF1 protects the transcription machinery from DNA damage by two distinct mechanisms.</p>",2021-05-11
125,10.1101/2021.05.06.21256766,8,medRxiv,Pediatrics,True,SARS-CoV-2 RNA and antibody detection in human milk from a prospective multicenter study in Spain,"[{'name': 'Christine Bäuerl'}, {'name': 'Walter Randazzo'}, {'name': 'Gloria Sánchez'}, {'name': 'Marta Selma-Royo'}, {'name': 'Elia Garcia-Verdevio'}, {'name': 'Laura Martínez-Rodríguez'}, {'name': 'Anna Parra-Llorca'}, {'name': 'Carles Lerin'}, {'name': 'Victoria Fumadó'}, {'name': 'Francesca Crovetto'}, {'name': 'Fátima Crispi'}, {'name': 'Francisco J Pérez-Cano'}, {'name': 'Gerardo Rodríguez'}, {'name': 'Gema Ruíz-Redondo'}, {'name': 'Cristina Campoy'}, {'name': 'Cecilia Martínez-Costa'}, {'name': 'Maria Carmen Collado'}]","<sec><title>Background</title><p>During the COVID-19 pandemic in 2020, breastfeeding in women positive for SARS-CoV-2 was compromised due to contradictory data regarding potential viral transmission. However, growing evidence confirms the relevant role of breast milk in providing passive immunity by generating and transmitting specific antibodies against the virus. Thus, our study aimed to develop and validate a specific protocol to detect SARS-CoV-2 in breast milk matrix as well as to determine the impact of maternal SARS-CoV-2 infection on presence, concentration, and persistence of specific SARS-CoV-2 antibodies.</p></sec><sec><title>Study design/Methods</title><p>A prospective multicenter longitudinal study in Spain was carried out from April to December 2020. A total of 60 mothers with SARS-CoV-2 infection and/or recovered from COVID-19 were included (n=52 PCR-diagnosed and n=8 seropositive). Data from maternal-infant clinical records and symptomatology were collected. A specific protocol was validated to detect SARS-CoV-2 RNA in breast milk, targeting the N1 region of the nucleocapsid gene and the envelope (E) gene. Presence and levels of SARS-CoV-2 specific immunoglobulins (Igs) -IgA, IgG, and IgM-in breast milk samples from COVID-19 patients and from 13 women before the pandemic were also evaluated.</p></sec><sec><title>Results</title><p>All breast milk samples showed negative results for SARS-CoV-2 RNA presence. We observed high intra- and inter-individual variability in the antibody response to the receptor-binding domain (RBD) of the SARS-CoV-2 spike protein for each of the three isotypes IgA, IgM and IgG. Protease domain (MPro) antibodies were also detected in milk. In general, 82.9 % of the milk samples were positive for at least one of the three antibody isotypes, being 52.86 % of those positive for all three Igs. Positivity rate for IgA was relatively stable over time (65.2 – 87.5 %), whereas it raised continuously for IgG (47.8 % the first ten days to 87.5 % from day 41 up to day 206 post-PCR confirmation).</p></sec><sec><title>Conclusions</title><p>Considering the lack of evidence for SARS-CoV-2 transmission through breast milk, our study confirms the safety of breastfeeding practices and highlights the relevance of virus-specific SARS-CoV-2 antibody transfer, that would provide passive immunity to breastfed infants and protect them against COVID-19 disease. This study provides crucial data to support official breastfeeding recommendations based on scientific evidence.</p></sec>",2021-05-13
126,10.1101/2021.05.11.443593,8,bioRxiv,Microbiology,False,A novel dual enrichment strategy provides soil- and digestate-competent N2O-respiring bacteria for mitigating climate forcing in agriculture,"[{'name': 'Kjell Rune Jonassen'}, {'name': 'Ida Ormaasen'}, {'name': 'Clara Duffner'}, {'name': 'Torgeir R Hvidsten'}, {'name': 'Åsa Frostegård'}, {'name': 'Lars R Bakken'}, {'name': 'Silas HW Vick'}]","<p>Manipulating soil metabolism by heavy inoculation with microbes is deemed realistic if waste from anaerobic digestion (digestate) is utilized as substrate and vector, but requires organisms that can grow both in digestate and soil (=generalist). We designed a strategy to enrich and isolate such generalist N<sub>2</sub>O-respiring bacteria (NRB) in soil and digestate, to provide inoculum for reducing N<sub>2</sub>O-emissions from agricultural soil. Sequential anaerobic enrichment cultures were provided with a small dose of O<sub>2</sub> and unlimited N<sub>2</sub>O, alternating between sterilized digestate and soil as substrates. The cultures were monitored for gas kinetics and community composition (16SrDNA), and cluster-analysis identified generalist-OTUs which became dominant, digestate/soil-specialists which did not, and a majority that were diluted out. Several NRBs circumscribed by generalist-OTU’s were isolated, genome sequenced to screen for catabolic capacity, and phenotyped, to assess their capacity as N<sub>2</sub>O-sinks in soil. The two isolates <italic>Cloacibacterium</italic> sp., carrying only N<sub>2</sub>O-reductase (Clade-II) and <italic>Pseudomonas sp</italic>., with full-fledged denitrification-pathway, were both very effective N<sub>2</sub>O-sinks in soil, with <italic>Pseudomonas</italic> sp., showing a long-lasting sink effect, suggesting better survival in soil. This avenue for utilizing waste to bioengineer the soil microbiota holds promise to effectively combat N<sub>2</sub>O-emissions but could also be utilized for enhancing other metabolic functions in soil.</p><sec><title>Graphical abstract</title><fig id=""ufig1"" position=""anchor"" orientation=""portrait"" fig-type=""figure""><graphic xmlns:xlink=""http://www.w3.org/1999/xlink"" xlink:href=""443593v2_ufig1"" position=""float"" orientation=""portrait"" /></fig></sec>",2021-05-11
127,10.1101/2021.05.11.443507,8,bioRxiv,Plant Biology,False,Rapid analysis of strigolactone receptor activity in a Nicotiana benthamiana dwarf14 mutant,"[{'name': 'Alexandra R.F. White'}, {'name': 'Jose A. Mendez'}, {'name': 'Aashima Khosla'}, {'name': 'David C. Nelson'}]","<p>DWARF14 (D14) is an ɑ/β-hydrolase and receptor for the plant hormone strigolactone (SL) in angiosperms. Upon SL perception, D14 works with MORE AXILLARY GROWTH2 (MAX2) to trigger polyubiquitination and degradation of DWARF53(D53)-type proteins in the SUPPRESSOR OF MAX2 1-LIKE (SMXL) family. We used CRISPR-Cas9 to generate knockout alleles of the two homoeologous <italic>D14</italic> genes in the <italic>Nicotiana benthamiana</italic> genome. The <italic>Nbd14a,b</italic> double mutant had several phenotypes that are consistent with the loss of SL perception in other plants, including increased axillary bud outgrowth, reduced height, shortened petioles, and smaller leaves. A ratiometric fluorescent reporter system was used to monitor degradation of SMXL7 from <italic>Arabidopsis thaliana</italic> (AtSMXL7) after transient expression in <italic>N. benthamiana</italic> and treatment with the strigolactone analog GR24. AtSMXL7 was degraded after treatment with GR24<sup>5DS</sup>, which has the stereochemical configuration of SLs, as well as its enantiomer GR24<sup><italic>ent</italic>-5DS</sup> . In <italic>Nbd14a,b</italic> leaves, AtSMXL7 abundance was unaffected by GR24. Transient coexpression of AtD14 with the AtSMXL7 reporter in <italic>Nbd14a,b</italic> restored the degradation response to GR24, but required an active catalytic triad. With this platform, we evaluated the ability of several AtD14 mutants that had not been characterized in plants to target AtSMXL7 for degradation.</p>",2021-05-11
128,10.1101/2021.05.10.21256935,7,medRxiv,Epidemiology,True,Identifying risk factors for COVID-19 severity and mortality in the UK Biobank,"[{'name': 'Iqbal Madakkatel'}, {'name': 'Catherine King'}, {'name': 'Ang Zhou'}, {'name': 'Anwar Mulugeta'}, {'name': 'Amanda Lumsden'}, {'name': 'Mark McDonnell'}, {'name': 'Elina Hyppönen'}]","<p>Severe acute respiratory syndrome coronavirus has infected over 114 million people worldwide as of March 2021, with worldwide mortality rates ranging between 1-10%. We use information on up to 421,111 UK Biobank participants to identify possible predictors for long-term susceptibility to severe COVID-19 infection (<italic>N</italic> =1,088) and mortality (<italic>N</italic> =376). We include 36,168 predictors in our analyses and use a gradient boosting decision tree (GBDT) algorithm and feature attribution based on Shapley values, together with traditional epidemiological approaches to identify possible risk factors. Our analyses show associations between socio-demographic factors (e.g. age, sex, ethnicity, education, material deprivation, accommodation type) and lifestyle indicators (e.g. smoking, physical activity, walking pace, tea intake, and dietary changes) with risk of developing severe COVID-19 symptoms. Blood (cystatin C, C-reactive protein, gamma glutamyl transferase and alkaline phosphatase) and urine (microalbuminuria) biomarkers measured more than 10 years earlier predicted severe COVID-19. We also confirm increased risks for several pre-existing disease outcomes (e.g. lung diseases, type 2 diabetes, hypertension, circulatory diseases, anemia, and mental disorders). Analyses on mortality were possible within a sub-group testing positive for COVID-19 infection (<italic>N</italic> =1,953) with our analyses confirming association between age, smoking status, and prior primary diagnosis of urinary tract infection.</p><sec><title>SUMMARY</title><p>Our hypothesis-free approach combining machine learning with traditional epidemiological methods finds a number of risk factors (sociodemographic, lifestyle, and psychosocial factors, biomarkers, disease outcomes and treatments) associated with developing severe COVID-19 symptoms and COVID-19 mortality.</p></sec>",2021-05-11
129,10.1101/2021.05.10.21256920,7,medRxiv,Psychiatry and Clinical Psychology,True,Comparison of Mental Health Symptoms prior to and during COVID-19: Evidence from a Living Systematic Review and Meta-analysis,"[{'name': 'Ying Sun'}, {'name': 'Yin Wu'}, {'name': 'Olivia Bonardi'}, {'name': 'Ankur Krishnan'}, {'name': 'Chen He'}, {'name': 'Jill T. Boruff'}, {'name': 'Danielle B. Rice'}, {'name': 'Yutong Wang'}, {'name': 'Xiaowen Jiang'}, {'name': 'Kexin Li'}, {'name': 'Sarah Markham'}, {'name': 'Brooke Levis'}, {'name': 'Marleine Azar'}, {'name': 'Ian Thombs-Vite'}, {'name': 'Dipika Neupane'}, {'name': 'Tiffany Dal Santo'}, {'name': 'Amina Tasleem'}, {'name': 'Anneke Yao'}, {'name': 'Branka Agic'}, {'name': 'Christine Fahim'}, {'name': 'Michael S. Martin'}, {'name': 'Sanjeev Sockalingam'}, {'name': 'Gustavo Turecki'}, {'name': 'Andrea Benedetti'}, {'name': 'Brett D. Thombs'}]","<sec><title>Objectives</title><p>The rapid pace, high volume, and limited quality of mental health evidence being generated during COVID-19 poses a barrier to effective decision-making. The objective of the present report is to compare mental health outcomes assessed during COVID-19 to outcomes prior to COVID-19 in the general population and other population groups.</p></sec><sec><title>Design</title><p>Living systematic review.</p></sec><sec><title>Data Sources</title><p>MEDLINE (Ovid), PsycINFO (Ovid), CINAHL (EBSCO), EMBASE (Ovid), Web of Science Core Collection: Citation Indexes, China National Knowledge Infrastructure, Wanfang, medRxiv (preprints), and Open Science Framework Preprints (preprint server aggregator). The initial search was conducted on April 13, 2020 with ongoing weekly updates.</p></sec><sec><title>Eligibility criteria for selecting studies</title><p>For this report, we included studies that compared general mental health, anxiety symptoms, or depression symptoms, assessed January 1, 2020 or later, to the same outcomes collected between January 1, 2018 and December 31, 2019. We required ≥ 90% of participants pre-COVID-19 and during COVID-19 to be the same or the use of statistical methods to address missing data. For population groups with continuous outcomes for at least three studies in an outcome domain, we conducted restricted maximum-likelihood random-effects meta-analyses.</p></sec><sec><title>Results</title><p>As of March 22, 2021, we had identified 36 unique eligible studies with data from 33 cohorts. All reported COVID-19 outcomes between March and June 2020, and 3 studies also reported outcomes between September and November 2020. Estimates of changes in general mental health were close to zero in the general population (standardized mean difference [SMD] = 0.02, 95% CI -0.11 to 0.16, I<sup>2</sup> = 94.6%; 4 studies, N = 19,707) and among older adults (SMD = 0.02, 95% CI -0.11 to 0.16, I<sup>2</sup> = 90.4%; 4 studies, N = 5,520) and university students (SMD = -0.01, 95% CI -0.33 to 0.30, I<sup>2</sup> = 92.0%; 3 studies, N = 3,372). Changes in anxiety symptoms were close to zero and not statistically significant in university students (SMD = 0.00, 95% CI - 0.35 to 0.36, I<sup>2</sup> = 95.4%; 5 studies, N = 1,537); women or females (SMD = 0.02, 95% CI -0.35 to 0.39, I<sup>2</sup> = 92.3%; 3 studies, N = 2,778); and men or males (SMD = 0.07, 95% CI -0.01 to 0.15; I<sup>2</sup> = 0.01%; 3 studies, N = 1,250); anxiety symptoms increased, however, among people with pre-existing medical conditions (SMD = 0.27, 95% CI 0.01 to 0.54, I<sup>2</sup> = 91.0%; 3 studies, N = 2,053). Changes in depression symptoms were close to zero or small and not statistically significant among university students (SMD = 0.19, 95% CI -0.08 to 0.45, I<sup>2</sup> = 91.8%; 5 studies, N = 1,537); people with pre-existing medical conditions (SMD = 0.01, 95% CI -0.15 to 0.17, I<sup>2</sup> = 14.9%; 3 studies, N = 2,006); women or females (SMD = 0.21, 95% CI -0.14 to 0.55, I<sup>2</sup> = 91.2%; 3 studies, N = 2,843); and men or males (SMD = 0.00, 95% CI -0.21 to 0.22; I<sup>2</sup> = 92.3%; 4 studies, N = 3,661). In 3 studies with data from both March to June 2020 and September to November 2020, symptoms were unchanged from pre-COVID-19 at both time points or there were increases at the first assessment that had largely dissipated by the second assessment.</p></sec><sec><title>Conclusions</title><p>Evidence does not suggest a widespread negative effect on mental health symptoms in COVID-19, although it is possible that gaps in data have not allowed identification of changes in some vulnerable groups. Continued updating is needed as evidence accrues.</p></sec><sec><title>Funding</title><p>Canadian Institutes of Health Research (CMS-171703; MS1-173070); McGill Interdisciplinary Initiative in Infection and Immunity Emergency COVID-19 Research Fund (R2-42).</p></sec><sec><title>Registration</title><p>PROSPERO (CRD42020179703); registered on April 17, 2020.</p></sec>",2021-05-11
130,10.1101/2021.05.11.443669,7,bioRxiv,Ecology,False,On the Contribution of Reproductive and Offspring Investment on Fertility: Human and Animal Societies,[{'name': 'Anuraag Bukkuri'}],"<p>Differences in investment into reproduction or offspring rearing are plentiful throughout the world, from the cells inside our bodies to complex sociological interactions among humans. Such differences can lead to profound impacts on species’ fitness, fertility, and reproductive rates, sometimes in startling ways. In this paper, we create a simple game-theoretical model to <italic>qualitatively</italic> investigate the effects of such differential investment. We focus on fertility in human societies and show that more wealthy individuals produce more offspring within a a mating group. However, when assortative mating mechanisms are introduced, this effectively leads to a speciation event, and a higher reproduction rate for poorer individuals is noticed, capturing what we call the “wealthy-to-poor switch”. We discuss extensions and implications of this work to nupital gifts in ecology and to clonal competition in cancer cell lines under the influence of treatment.</p>",2021-05-13
