,doi,tweets,archive,subject-area,covid,title,authors,abstract,posted
26,10.1101/2021.06.30.450542,19,bioRxiv,Microbiology,False,The development of ovine gastric and intestinal organoids for studying ruminant host-pathogen interactions,"[{'name': 'David Smith'}, {'name': 'Daniel R. G. Price'}, {'name': 'Alison Burrells'}, {'name': 'Marc N. Faber'}, {'name': 'Katie A. Hildersley'}, {'name': 'Cosmin Chintoan-Uta'}, {'name': 'Ambre F. Chapuis'}, {'name': 'Mark Stevens'}, {'name': 'Karen Stevenson'}, {'name': 'Stewart T. G. Burgess'}, {'name': 'Elisabeth A. Innes'}, {'name': 'Alasdair J. Nisbet'}, {'name': 'Tom N. McNeilly'}]","<p>Gastrointestinal (GI) infections in sheep have significant implications for animal health, welfare and productivity, as well as being a source of zoonotic pathogens. Interactions between pathogens and epithelial cells at the mucosal surface play a key role in determining the outcome of GI infections; however, the inaccessibility of the GI tract <italic>in vivo</italic> significantly limits the ability to study such interactions in detail. We therefore developed ovine epithelial organoids representing physiologically important gastric and intestinal sites of infection, specifically the abomasum (analogous to the stomach in monogastrics) and ileum. We show that both abomasal and ileal organoids form self-organising three-dimensional structures with a single epithelial layer and a central lumen that are stable in culture over serial passage. We performed RNA-seq analysis on abomasal and ileal tissue from multiple animals and on organoids across multiple passages and show the transcript profile of both abomasal and ileal organoids cultured under identical conditions are reflective of the tissue from which they were derived and that the transcript profile in organoids is stable over at least five serial passages. In addition, we demonstrate that the organoids can be successfully cryopreserved and resuscitated, allowing long-term storage of organoid lines, thereby reducing the number of animals required as a source of tissue. We also report the first published observations of a helminth infecting gastric and intestinal organoids by challenge with the sheep parasitic nematode <italic>Teladorsagia circumcincta</italic>, demonstrating the utility of these organoids for pathogen co-culture experiments. Finally, the polarity in the abomasal and ileal organoids can be inverted to make the apical surface directly accessible to pathogens or their products, here shown by infection of apical-out organoids with the zoonotic enteric bacterial pathogen <italic>Salmonella enterica</italic> serovar Typhimurium. In summary, we report a simple and reliable <italic>in vitro</italic> culture system for generation and maintenance of small ruminant intestinal and gastric organoids. In line with 3Rs principals, use of such organoids will reduce and replace animals in host-pathogen research.</p>",2021-06-30
27,10.1101/2021.07.02.450924,18,bioRxiv,Cell Biology,False,Mitochondrial dysfunction triggers secretion of the immunosuppressive factor α-fetoprotein,"[{'name': 'Kimberly A. Jett'}, {'name': 'Zakery N. Baker'}, {'name': 'Amzad Hossain'}, {'name': 'Aren Boulet'}, {'name': 'Paul A. Cobine'}, {'name': 'Sagnika Ghosh'}, {'name': 'Philip Ng'}, {'name': 'Orhan Yilmaz'}, {'name': 'Kris Barretto'}, {'name': 'John DeCoteau'}, {'name': 'Karen Mochoruk'}, {'name': 'George Ioannou'}, {'name': 'Christopher Savard'}, {'name': 'Sai Yuan'}, {'name': 'Christopher Lowden'}, {'name': 'Byung-Eun Kim'}, {'name': 'Hai-Ying Mary Cheng'}, {'name': 'Brendan J Battersby'}, {'name': 'Vishal M. M. Gohil'}, {'name': 'Scot C Leary'}]","<p>Signaling circuits crucial to systemic physiology are widespread, yet uncovering their molecular underpinnings remains a barrier to understanding the etiology of many metabolic disorders. Here, we identify a copper-linked signaling circuit activated by disruption of mitochondrial function in the murine liver or heart that results in atrophy of the spleen and thymus and causes a peripheral white blood cell deficiency. We demonstrate that the leukopenia is caused by α-fetoprotein, which requires copper and the cell surface receptor CCR5 to promote white blood cell death. We further show that α-fetoprotein expression is upregulated in several cell types upon inhibition of oxidative phosphorylation, including a muscle cell model of Barth syndrome. Collectively, our data argue that α-fetoprotein secreted by bioenergetically stressed tissue suppresses the immune system, an effect which may explain the recurrent infections that are observed in a subset of mitochondrial diseases or in other disorders with mitochondrial involvement.</p>",2021-07-03
28,10.1101/2021.06.29.450391,17,bioRxiv,Evolutionary Biology,False,"Fin Shape, Asymmetry, and Evolutionary Ecomorphology in Triggerfishes and Filefishes (Superfamily: Balistoidea)","[{'name': 'Andrew B. George'}, {'name': 'Mark W. Westneat'}]","<p>Triggerfishes and filefishes exhibit a wide range of fin and body morphologies, inhabit many marine habitats, and feed on a variety of benthic and pelagic organisms. Particular morphologies are predicted to provide functional advantages for swimming behaviors that facilitate life in diverse habitats and feeding guilds. Ecomorphological relationships can, in turn, inform evolutionary patterns of morphological convergence. We quantified morphological diversity of 80 balistoid species using geometric morphometrics and assigned each species a primary habitat and feeding mode. Results revealed strong evidence for evolutionary integration among body and fin shapes as well as widespread convergence of both high and low aspect ratio (AR) dorsal and anal fins, the fins that power steady locomotion in these fishes. Dorsal and anal fins were determined to be moderately to highly asymmetrical in most species. Families exhibited considerable overlap in fin and body shapes, but triggerfishes generally exhibited higher AR and more asymmetrical fins than filefishes. Fin asymmetry was not strongly associated with ecology. Planktivorous and offshore-pelagic species exhibited high AR dorsal and anal fins suitable for high endurance swimming performance, while benthic grazing and structured reef species exhibited convergence on low AR median fins more suitable for facilitating maneuverability.</p>",2021-07-01
29,10.1101/2021.06.29.450426,16,bioRxiv,Immunology,True,Varenicline Prevents SARS-CoV-2 Infection In Vitro and in Rhesus Macaques,"[{'name': 'Jeffrey Nau'}, {'name': 'Priya Luthra'}, {'name': 'Kathleen Lanzer'}, {'name': 'Frank Szaba'}, {'name': 'Tres Cookenham'}, {'name': 'Eric Carlson'}]","<sec><title>Background</title><p>SARS-CoV-2 infections have resulted in a global pandemic, but an antiviral therapy for this novel strain of coronavirus does not currently exist. The objective of our study was to investigate the antiviral potential of the nicotinic acetylcholine receptor (nACHR) agonist varenicline tartrate against SARS-CoV-2.</p></sec><sec><title>Methods</title><p>We assessed antiviral activity using <italic>in vitro</italic> human cell assays and we assessed <italic>in vivo</italic> efficacy in a rhesus macaque model.</p></sec><sec><title>Results</title><p><italic>In vitro</italic> studies found that varenicline tartrate, over a range of concentrations, reduced the infectivity of SARS-CoV-2 wildtype, alpha, and beta variants in Calu-3 cells and Caco-2 cells, with maintenance of cell viability. <italic>In vivo</italic> studies found that varenicline tartrate, administered as a nasal spray to rhesus macaques, reduced SARS-CoV-2 wildtype viral load and inhibited viral replication in the nasal mucosa and upper airway.</p></sec><sec><title>Conclusion</title><p>Although the study reported here was exploratory, we have confirmed that the nAChR agonist varenicline has the potential to interact with and inhibit SARS-CoV-2 infection and replication.</p></sec>",2021-06-30
30,10.1101/2021.06.30.449980,16,bioRxiv,Biochemistry,False,Structural Insights into the Venus flytrap Mechanosensitive Ion Channel Flycatcher1,"[{'name': 'Sebastian Jojoa-Cruz'}, {'name': 'Kei Saotome'}, {'name': 'Che Chun (Alex) Tsui'}, {'name': 'Wen-Hsin Lee'}, {'name': 'Mark S. P. Sansom'}, {'name': 'Swetha E. Murthy'}, {'name': 'Ardem Patapoutian'}, {'name': 'Andrew B. Ward'}]","<p>Flycatcher1 (FLYC1), a MscS homolog, has recently been identified as a candidate mechanosensitive (MS) ion channel involved in Venus flytrap prey recognition. FLYC1 is larger and its sequence diverges from previously studied MscS homologs, suggesting it has unique structural features that contribute to its function. Here, we characterized FLYC1 by cryo-electron microscopy, molecular dynamics simulations, and electrophysiology. Akin to bacterial MscS and plant MSL1 channels, we find that FLYC1 central core includes side portals in the cytoplasmic cage that regulate ion conduction, by identifying critical residues that modulate channel conductance. Topologically unique cytoplasmic flanking regions can adopt ‘up’ or ‘down’ conformations, making the channel asymmetric. Disruption of an up conformation-specific interaction severely delays channel deactivation by 40-fold likely due to stabilization of the channel open state. Our results illustrate novel structural features and likely conformational transitions that regulate mechano-gating of FLYC1.</p>",2021-06-30
31,10.1101/2021.06.29.450324,16,bioRxiv,Bioinformatics,False,PhenoExam: an R package and Web application for the examination of phenotypes linked to genes and gene sets,"[{'name': 'Alejandro Cisterna'}, {'name': 'Aurora González-Vidal'}, {'name': 'Daniel Ruiz'}, {'name': 'Jordi Ortiz'}, {'name': 'Alicia Gómez-Pascual'}, {'name': 'Zhongbo Chen'}, {'name': 'Mike Nalls'}, {'name': 'Faraz Faghri'}, {'name': 'John Hardy'}, {'name': 'Irene Díez'}, {'name': 'Paolo Maietta'}, {'name': 'Sara Álvarez'}, {'name': 'Mina Ryten'}, {'name': 'Juan A. Botía'}]","<p>Gene set based phenotype enrichment analysis (detecting phenotypic terms that emerge as significant in a set of genes) can improve the rate of genetic diagnoses amongst other research purposes. To facilitate diverse phenotype analysis, we developed PhenoExam, a freely available R package for tool developers and a web interface for users, which performs: (1) phenotype and disease enrichment analysis on a gene set; (2) measures statistically significant phenotype similarities between gene sets and (3) detects significant differential phenotypes or disease terms across different databases. PhenoExam achieves these tasks by integrating databases or resources such as the HPO, MGD, CRISPRbrain, CTD, ClinGen, CGI, OrphaNET, UniProt, PsyGeNET, and Genomics England Panel App. PhenoExam accepts both human and mouse genes as input. We developed PhenoExam to assist a variety of users, including clinicians, computational biologists and geneticists. It can be used to support the validation of new gene-to-disease discoveries, and in the detection of differential phenotypes between two gene sets (a phenotype linked to one of the gene set but no to the other) that are useful for differential diagnosis and to improve genetic panels. We validated PhenoExam performance through simulations and its application to real cases. We demonstrate that PhenoExam is effective in distinguishing gene sets or Mendelian diseases with very similar phenotypes through projecting the disease-causing genes into their annotation-based phenotypic spaces. We also tested the tool with early onset Parkinson’s disease and dystonia genes, to show phenotype-level similarities but also potentially interesting differences. More specifically, we used PhenoExam to validate computationally predicted new genes potentially associated with epilepsy. Therefore, PhenoExam effectively discovers links between phenotypic terms across annotation databases through effective integration. The R package is available at <ext-link xmlns:xlink=""http://www.w3.org/1999/xlink"" ext-link-type=""uri"" xlink:href=""https://github.com/alexcis95/PhenoExam"">https://github.com/alexcis95/PhenoExam</ext-link> and the Web tool is accessible at <ext-link xmlns:xlink=""http://www.w3.org/1999/xlink"" ext-link-type=""uri"" xlink:href=""https://snca.atica.um.es/PhenoExamWeb/"">https://snca.atica.um.es/PhenoExamWeb/</ext-link>.</p>",2021-06-30
32,10.1101/2021.06.29.450340,16,bioRxiv,Bioinformatics,False,HMMploidy: inference of ploidy levels from short-read sequencing data,"[{'name': 'Samuele Soraggi'}, {'name': 'Johanna Rhodes'}, {'name': 'Isin Altinkaya'}, {'name': 'Oliver Tarrant'}, {'name': 'François Balloux'}, {'name': 'Matthew C. Fisher'}, {'name': 'Matteo Fumagalli'}]","<p>The inference of ploidy levels from genomic data is important to understand molecular mechanisms underpinning genome evolution. However, current methods based on allele frequency and sequencing depth variation do not have power to infer ploidy levels at low- and mid-depth sequencing data, as they do not account for data uncertainty. Here we introduce <monospace>HMMploidy</monospace>, a novel tool that leverages the information from multiple samples and combines the information from sequencing depth and genotype likelihoods. We demonstrate that <monospace>HMMploidy</monospace> outperforms existing methods in most tested scenarios, especially at low-depth with large sample size. <monospace>HMMploidy</monospace> further allows for local inferences of ploidy change to detect within-chromosome variations. We apply <monospace>HMMploidy</monospace> to sequencing data from the pathogenic fungus <italic>Cryptococcus neoformans</italic> and retrieve pervasive patterns of polyploidy and aneuploidy, even when artificially downsampling the sequencing data. We envisage that <monospace>HMMploidy</monospace> will have wide applicability to low-depth sequencing data from polyploid and aneuploid species.</p>",2021-06-30
33,10.1101/2021.06.30.450627,14,bioRxiv,Molecular Biology,False,A Genetic Screen for Suppressors of Cryptic 5’ Splicing in C. elegans Reveals Roles for KIN17 and PRCC in Maintaining Both 5’ and 3’ Splice Site Identity,"[{'name': 'Jessie M.N.G. Lopez'}, {'name': 'Kenneth Osterhoudt'}, {'name': 'Catiana Holland Cartwright'}, {'name': 'Sol Katzman'}, {'name': 'Alan M. Zahler'}]","<p>Pre-mRNA splicing is an essential step of eukaryotic gene expression carried out by a series of dynamic macromolecular protein/RNA complexes, known collectively and individually as the spliceosome. This series of spliceosomal complexes define, assemble on, and catalyze the removal of introns. Molecular model snapshots of intermediates in the process have been created from cryo-EM data, however, many aspects of the dynamic changes that occur in the spliceosome are not fully understood. <italic>Caenorhabditis elegans</italic> follow the GU-AG rule of splicing, with almost all introns beginning with 5’ GU and ending with 3’ AG. These splice sites are identified early in the splicing cycle, but as the cycle progresses and “custody” of the pre-mRNA splice sites is passed from factor to factor as the catalytic site is built, the mechanism by which splice site identity is maintained or re-established through these dynamic changes is unclear. We performed a genetic screen in <italic>C. elegans</italic> for factors that are capable of changing 5’ splice site choice. We report that KIN17 and PRCC are involved in splice site choice, the first functional splicing role proposed for either of these proteins. Previously identified suppressors of cryptic 5’ splicing promote distal cryptic GU splice sites, however, mutations in KIN17 and PRCC instead promote usage of an unusual proximal 5’ splice site which defines an intron beginning with UU, separated by 1nt from a GU donor. We performed high-throughput mRNA sequencing analysis and found that mutations in PRCC but not KIN17 changed 5’ splice sites genome-wide, promoting usage of nearby non-consensus sites. We further found that mutations in KIN17 and PRCC changed dozens of 3’ splice sites, promoting non-consensus sites upstream of canonical splice sites. Our work has uncovered both fine and coarse mechanisms by which the spliceosome maintains splice site identity during the complex assembly process.</p><sec><title>Author Summary</title><p>Pre-mRNA splicing is an essential step of gene regulation, carried out by an unusual molecular machine, the spliceosome. Unlike other molecular machines, such as ribosomes, that simply assemble and catalyze chemical reactions, “the spliceosome” is a highly-dynamic cycle, carried out by 5 specialized small nuclear RNAs and over 100 proteins, which sequentially join, rearrange, and withdraw from the splicing assembly during each splicing cycle. These assemblies initially choose “splice sites” where the pre-mRNA will be cut, and then undergo multiple rearrangements to finally form the active site which catalyzes the splicing reactions which remove an intron from a pre-mRNA. We are currently in the midst of a “resolution revolution”, with ever-clearer cryo-EM snapshots of stalled complexes allowing researchers to visualize moments in time in the splicing cycle. These models are illuminating, but do not always elucidate mechanistic functioning, therefore our lab takes a complementary approach, using the power of genetics in a multicellular animal to gain functional insights into the spliceosome. Using a <italic>C .elegans</italic> genetic screen, we have found novel functional splicing roles for two proteins, KIN17 and PRCC. Our results suggest that the spliceosome does not just rely on its initial identification of the splice site, but in a later step, re-identifies where to cut. We liken this two-stage identification to using a microscope by first using the coarse focus to find the area of interest, and then using the fine focus to adjust as needed. This work moves us closer to full mechanistic understanding of how the spliceosome chooses where to cut a pre-mRNA message.</p></sec>",2021-06-30
34,10.1101/2021.07.02.450762,14,bioRxiv,Evolutionary Biology,False,Broad-scale variation in human genetic diversity levels is predicted by purifying selection on coding and non-coding elements,"[{'name': 'David Murphy'}, {'name': 'Eyal Elyashiv'}, {'name': 'Guy Amster'}, {'name': 'Guy Sella'}]","<p>Analyses of genetic variation in many taxa have established that neutral genetic diversity is shaped by natural selection at linked sites. Whether the source of selection is primarily the fixation of strongly beneficial alleles (selective sweeps) or purifying selection on deleterious mutations (background selection) remains unknown, however. We address this question in humans by fitting a model of the joint effects of selective sweeps and background selection to autosomal polymorphism data from the 1000 Genomes Project. After controlling for variation in mutation rates along the genome, a model of background selection alone explains ~60% of the variance in diversity levels at the megabase scale. Adding the effects of selective sweeps driven by adaptive substitutions to the model does not improve the fit, and when both modes of selection are considered jointly, selective sweeps are estimated to have had little or no effect on linked neutral diversity. The regions under purifying selection are best predicted by phylogenetic conservation, with ~80% of the deleterious mutations affecting neutral diversity occurring in non-exonic regions. Thus, background selection is the dominant mode of linked selection in humans, with marked effects on diversity levels throughout autosomes.</p>",2021-07-02
35,10.1101/2021.06.30.450504,14,bioRxiv,Developmental Biology,False,Proper migration of lymphatic endothelial cells requires survival and guidance cues from arterial mural cells,"[{'name': 'Di Peng'}, {'name': 'Koji Ando'}, {'name': 'Marleen Gloger'}, {'name': 'Renae Skoczylas'}, {'name': 'Naoki Mochizuki'}, {'name': 'Christer Betsholtz'}, {'name': 'Shigetomo Fukuhara'}, {'name': 'Katarzyna Koltowska'}]","<p>The migration of lymphatic endothelial cells (LECs) is key for the development of the complex and vast lymphatic vascular network that pervades most of the tissues in an organism. In zebrafish, arterial intersegmental vessels together with chemokines have been shown to promote lymphatic cell migration from the horizontal myoseptum (HM). Here we found that LECs departure from HM coincides with the emergence of mural cells around the intersegmental arteries, raising the possibility that arterial mural cells promote LEC migration. Our live imaging and cell ablation experiments revealed that LECs migrate slower and fail to establish the lymphatic vascular network in the absence of arterial mural cells. We determined that mural cells are a source for the C-X-C motif chemokine 12 (Cxcl12a and Cxcl12b) and vascular endothelial growth factor C (Vegfc). We showed that ERK, a downstream component of Vegfc-Vegfr3 singling cascade, is activated in migrating LECs and that both chemokine and growth factor signalling is required for the robust migration. Furthermore, Vegfc-Vegfr3 has a pro-survival role in LECs during the migration. Together, the identification of mural cells a source for signals that guide LEC migration and survival will be important in the future design for rebuilding lymphatic vessels in the disease contexts.</p>",2021-06-30
36,10.1101/2021.06.30.450637,13,bioRxiv,Genetics,False,daf-16/FOXO blocks adult cell fate in Caenorhabditis elegans dauer larvae via lin-41/TRIM71,"[{'name': 'Matthew J. Wirick'}, {'name': 'Allison R. Cale'}, {'name': 'Isaac T. Smith'}, {'name': 'Amelia F. Alessi'}, {'name': 'Margaret R. Starostik'}, {'name': 'Liberta Cuko'}, {'name': 'Kyal Lalk'}, {'name': 'Mikayla N. Schmidt'}, {'name': 'Benjamin S. Olson'}, {'name': 'Payton M. Salomon'}, {'name': 'Alexis Santos'}, {'name': 'Axel Schmitter-Sánchez'}, {'name': 'Himani Galagali'}, {'name': 'Kevin J. Ranke'}, {'name': 'Payton A. Wolbert'}, {'name': 'Macy L. Knoblock'}, {'name': 'John K. Kim'}, {'name': 'Xantha Karp'}]","<p>Many tissue-specific stem cells maintain the ability to produce multiple cell types during long periods of non-division, or quiescence. FOXO transcription factors promote quiescence and stem cell maintenance, but the mechanisms by which FOXO proteins promote multipotency during quiescence are still emerging. The single FOXO ortholog in <italic>C. elegans, daf-16</italic>, promotes entry into a quiescent and stress-resistant larval stage called dauer in response to adverse environmental cues. During dauer, stem and progenitor cells maintain or re-establish multipotency to allow normal development to resume after dauer. We find that during dauer, <italic>daf-16</italic>/FOXO prevents epidermal stem cells (seam cells) from prematurely adopting differentiated, adult characteristics. In particular, dauer larvae that lack <italic>daf-16</italic> misexpress collagens that are normally adult-enriched. Using <italic>col-19p::gfp</italic> as an adult cell fate marker, we find that all major <italic>daf-16</italic> isoforms contribute to opposing <italic>col-19p::gfp</italic> expression during dauer. By contrast, <italic>daf-16(0)</italic> larvae that undergo non-dauer development do not misexpress <italic>col-19p::gfp</italic>. Adult cell fate and the timing of <italic>col-19p::gfp</italic> expression are regulated by the heterochronic gene network, including <italic>lin-41</italic> and <italic>lin-29. lin-41</italic> encodes an RNA-binding protein orthologous to LIN41/TRIM71 in mammals, and <italic>lin-29</italic> encodes a conserved zinc finger transcription factor. In non-dauer development <italic>lin-41</italic> opposes adult cell fate by inhibiting the translation of <italic>lin-29</italic>, which directly activates <italic>col-19</italic> transcription and promotes adult cell fate. We find that during dauer, <italic>lin-41</italic> blocks <italic>col-19p::gfp</italic> expression, but surprisingly, <italic>lin-29</italic> is not required in this context. Additionally, <italic>daf-16</italic> promotes the expression of <italic>lin-41</italic> in dauer larvae. The <italic>col-19p::gfp</italic> misexpression phenotype observed in dauer larvae with reduced <italic>daf-16</italic> requires the downregulation of <italic>lin-41</italic>, but does not require <italic>lin-29</italic>. Taken together, this work demonstrates a novel role for <italic>daf-16</italic>/FOXO as a heterochronic gene that promotes expression of <italic>lin-41/</italic>TRIM71 to contribute to multipotent cell fate in a quiescent stem cell model.</p>",2021-07-01
