,doi,tweets,archive,subject-area,covid,title,authors,abstract,posted
0,10.1101/2021.05.06.21256755,353,medRxiv,Epidemiology,True,Clinical coding of long COVID in English primary care: a federated analysis of 58 million patient records in situ using OpenSAFELY,"[{'name': ' '}, {'name': 'Alex J Walker'}, {'name': 'Brian MacKenna'}, {'name': 'Peter Inglesby'}, {'name': 'Christopher T Rentsch'}, {'name': 'Helen J Curtis'}, {'name': 'Caroline E Morton'}, {'name': 'Jessica Morley'}, {'name': 'Amir Mehrkar'}, {'name': 'Seb Bacon'}, {'name': 'George Hickman'}, {'name': 'Chris Bates'}, {'name': 'Richard Croker'}, {'name': 'David Evans'}, {'name': 'Tom Ward'}, {'name': 'Jonathan Cockburn'}, {'name': 'Simon Davy'}, {'name': 'Krishnan Bhaskaran'}, {'name': 'Anna Schultze'}, {'name': 'Elizabeth J Williamson'}, {'name': 'William J Hulme'}, {'name': 'Helen I McDonald'}, {'name': 'Laurie Tomlinson'}, {'name': 'Rohini Mathur'}, {'name': 'Rosalind M Eggo'}, {'name': 'Kevin Wing'}, {'name': 'Angel YS Wong'}, {'name': 'Harriet Forbes'}, {'name': 'John Tazare'}, {'name': 'John Parry'}, {'name': 'Frank Hester'}, {'name': 'Sam Harper'}, {'name': 'Shaun O’Hanlon'}, {'name': 'Alex Eavis'}, {'name': 'Richard Jarvis'}, {'name': 'Dima Avramov'}, {'name': 'Paul Griffiths'}, {'name': 'Aaron Fowles'}, {'name': 'Nasreen Parkes'}, {'name': 'Ian J Douglas'}, {'name': 'Stephen JW Evans'}, {'name': 'Liam Smeeth'}, {'name': 'Ben Goldacre'}]","<sec><title>Background</title><p>Long COVID is a term to describe new or persistent symptoms at least four weeks after onset of acute COVID-19. Clinical codes to describe this phenomenon were released in November 2020 in the UK, but it is not known how these codes have been used in practice.</p></sec><sec><title>Methods</title><p>Working on behalf of NHS England, we used OpenSAFELY data encompassing 96% of the English population. We measured the proportion of people with a recorded code for long COVID, overall and by demographic factors, electronic health record software system, and week. We also measured variation in recording amongst practices.</p></sec><sec><title>Results</title><p>Long COVID was recorded for 23,273 people. Coding was unevenly distributed amongst practices, with 26.7% of practices having not used the codes at all. Regional variation was high, ranging between 20.3 per 100,000 people for East of England (95% confidence interval 19.3-21.4) and 55.6 in London (95% CI 54.1-57.1). The rate was higher amongst women (52.1, 95% CI 51.3-52.9) compared to men (28.1, 95% CI 27.5-28.7), and higher amongst practices using EMIS software (53.7, 95% CI 52.9-54.4) compared to TPP software (20.9, 95% CI 20.3-21.4).</p></sec><sec><title>Conclusions</title><p>Long COVID coding in primary care is low compared with early reports of long COVID prevalence. This may reflect under-coding, sub-optimal communication of clinical terms, under-diagnosis, a true low prevalence of long COVID diagnosed by clinicians, or a combination of factors. We recommend increased awareness of diagnostic codes, to facilitate research and planning of services; and surveys of clinicians’ experiences, to complement ongoing patient surveys.</p></sec>",2021-05-13
1,10.1101/2021.05.11.21256578,306,medRxiv,Infectious Diseases (except HIV/AIDS),True,"Live virus neutralisation testing in convalescent patients and subjects vaccinated against 19A, 20B, 20I/501Y.V1 and 20H/501Y.V2 isolates of SARS-CoV-2","[{'name': 'Claudia Gonzalez'}, {'name': 'Carla Saade'}, {'name': 'Antonin Bal'}, {'name': 'Martine Valette'}, {'name': 'Kahina Saker'}, {'name': 'Bruno Lina'}, {'name': 'Laurence Josset'}, {'name': 'Mary-Anne Trabaud'}, {'name': 'Guillaume Thiery'}, {'name': 'Elisabeth Botelho-Nevers'}, {'name': 'Stéphane Paul'}, {'name': 'Paul Verhoeven'}, {'name': 'Thomas Bourlet'}, {'name': 'Sylvie Pillet'}, {'name': 'Florence Morfin'}, {'name': 'Sophie Trouillet-Assant'}, {'name': 'Bruno Pozzetto'}]","<sec><title>Background</title><p>SARS-CoV-2 mutations appeared recently and can lead to conformational changes in the spike protein and probably induce modifications in antigenicity. In this study, we wanted to assess the neutralizing capacity of antibodies to prevent cell infection, using a live virus neutralisation test.</p></sec><sec><title>Methods</title><p>Sera samples were collected from different populations: two-dose vaccinated COVID-19-naïve healthcare workers (HCWs; Pfizer-BioNTech BNT161b2), 6-months post mild COVID-19 HCWs, and critical COVID-19 patients. We tested various clades such as 19A (initial one), 20B (B.1.1.241 lineage), 20I/501Y.V1 (B.1.1.7 lineage), and 20H/501Y.V2 (B.1.351 lineage).</p></sec><sec><title>Results</title><p>No significant difference was observed between the 20B and 19A isolates for HCWs with mild COVID-19 and critical patients. However, a significant decrease in neutralisation ability was found for 20I/501Y.V1 in comparison with 19A isolate for critical patients and HCWs 6-months post infection. Concerning 20H/501Y.V2, all populations had a significant reduction in neutralising antibody titres in comparison with the 19A isolate. Interestingly, a significant difference in neutralisation capacity was observed for vaccinated HCWs between the two variants whereas it was not significant for the convalescent groups.</p></sec><sec><title>Conclusion</title><p>Neutralisation capacity was slightly reduced for critical patients and HCWs 6-months post infection. No neutralisation escape could be feared concerning the two variants of concern in both populations. The reduced neutralising response observed towards the 20H/501Y.V2 in comparison with the 19A and 20I/501Y.V1 isolates in fully immunized subjects with the BNT162b2 vaccine is a striking finding of the study.</p></sec>",2021-05-11
2,10.1101/2021.05.12.21257080,273,medRxiv,Genetic and Genomic Medicine,True,A year of genomic surveillance reveals how the SARS-CoV-2 pandemic unfolded in Africa,"[{'name': 'Eduan Wilkinson'}, {'name': 'Marta Giovanetti'}, {'name': 'Houriiyah Tegally'}, {'name': 'James E. San'}, {'name': 'Richard Lessels'}, {'name': 'Diego Cuadros'}, {'name': 'Darren P. Martin'}, {'name': 'Abdel-Rahman N. Zekri'}, {'name': 'Abdoul K. Sangare'}, {'name': 'Abdoul-Salam Ouedraogo'}, {'name': 'Abdul K. Sesay'}, {'name': 'Adnène Hammami'}, {'name': 'Adrienne A. Amuri'}, {'name': 'Ahmad Sayed'}, {'name': 'Ahmed Rebai'}, {'name': 'Aida Elargoubi'}, {'name': 'Alexander J. Trotter'}, {'name': 'Alpha K. Keita'}, {'name': 'Amadou A. Sall'}, {'name': 'Amadou Kone'}, {'name': 'Amal Souissi'}, {'name': 'Ana V. Gutierrez'}, {'name': 'Andrew J. Page'}, {'name': 'Arash Iranzadeh'}, {'name': 'Arnold Lambisia'}, {'name': 'Augustina Sylverken'}, {'name': 'Azeddine Ibrahimi'}, {'name': 'Beatrice Dhaala'}, {'name': 'Bourema Kouriba'}, {'name': 'Bronwyn Kleinhans'}, {'name': 'Cara Brook'}, {'name': 'Carolyn Williamson'}, {'name': 'Catherine B. Pratt'}, {'name': 'Chantal G. Akoua-Koffi'}, {'name': 'Charles N. Agoti'}, {'name': 'Collins M. Morang’a'}, {'name': 'D. James Nokes'}, {'name': 'Daniel J. Bridges'}, {'name': 'Daniel L. Bugembe'}, {'name': 'David Baker'}, {'name': 'Deelan Doolabh'}, {'name': 'Deogratius Ssemwanga'}, {'name': 'Derek Tshabuila'}, {'name': 'Diarra Bassirou'}, {'name': 'Dominic S.Y. Amuzu'}, {'name': 'Dominique Goedhals'}, {'name': 'Dorcas Maruapula'}, {'name': 'Ebenezer Foster-Nyarko'}, {'name': 'Eddy K. Lusamaki'}, {'name': 'Edgar Simulundu'}, {'name': 'Edidah Moraa'}, {'name': 'Edith N. Ngabana'}, {'name': 'Elmostafa El Fahime'}, {'name': 'Emerald Jacob'}, {'name': 'Emmanuel Lokilo'}, {'name': 'Enatha Mukantwari'}, {'name': 'Essia Belarbi'}, {'name': 'Etienne Simon-Loriere'}, {'name': 'Etilé A. Anoh'}, {'name': 'Fabian Leendertz'}, {'name': 'Faida Ajili'}, {'name': 'Fares Wasfi'}, {'name': 'Faustinos T. Takawira'}, {'name': 'Fawzi Derrar'}, {'name': 'Feriel Bouzid'}, {'name': 'Francisca M. Muyembe'}, {'name': 'Frank Tanser'}, {'name': 'Gabriel K. Mbunsu'}, {'name': 'Gaetan Thilliez'}, {'name': 'Gemma Kay'}, {'name': 'George Githinji'}, {'name': 'Gert van Zyl'}, {'name': 'Gordon A. Awandare'}, {'name': 'Grit Schubert'}, {'name': 'Gugu P. Maphalala'}, {'name': 'Hafaliana C. Ranaivoson'}, {'name': 'Hajar Lemriss'}, {'name': 'Haruka Abe'}, {'name': 'Hela H. Karray'}, {'name': 'Hellen Nansumba'}, {'name': 'Hesham A. Elgahzaly'}, {'name': 'Hlanai Gumbo'}, {'name': 'Ibtihel Smeti'}, {'name': 'Ikhlas B. Ayed'}, {'name': 'Ilhem Boutiba-Ben Boubaker'}, {'name': 'Imed Gaaloul'}, {'name': 'Inbal Gazy'}, {'name': 'Isaac Ssewanyana'}, {'name': 'Jean B. Lekana-Douk'}, {'name': 'Jean-Claude C. Makangara'}, {'name': 'Jean-Jacques M. Tamfum'}, {'name': 'Jean-Michel Heraud'}, {'name': 'Jeffrey G. Shaffer'}, {'name': 'Jennifer Giandhari'}, {'name': 'Jingjing Li'}, {'name': 'Jiro Yasuda'}, {'name': 'Joana Q. Mends'}, {'name': 'Jocelyn Kiconco'}, {'name': 'John Morobe'}, {'name': 'John N. Nkengasong'}, {'name': 'John O. Gyapong'}, {'name': 'John T. Kayiwa'}, {'name': 'Johnathan A. Edwards'}, {'name': 'Jones Gyamfi'}, {'name': 'Jouali Farah'}, {'name': 'Joyce M. Ngoi'}, {'name': 'Joyce Namulondo'}, {'name': 'Julia C. Andeko'}, {'name': 'Julius J. Lutwama'}, {'name': 'Justin O’Grady'}, {'name': 'Kefentse A. Tumedi'}, {'name': 'Khadija M. Said'}, {'name': 'Kim Hae-Young'}, {'name': 'Kwabena O. Duedu'}, {'name': 'Lahcen Belyamani'}, {'name': 'Lavanya Singh'}, {'name': 'Leonardo de O. Martins'}, {'name': 'Madisa Mine'}, {'name': 'Magalutcheemee Ramuth'}, {'name': 'Maha Mastouri'}, {'name': 'Mahjoub Aouni'}, {'name': 'Mahmoud el Hefnawi'}, {'name': 'Maitshwarelo I. Matsheka'}, {'name': 'Malebogo Kebabonye'}, {'name': 'Manel Turki'}, {'name': 'Martin M. Nyaga'}, {'name': 'Mathabo Mareka'}, {'name': 'Matoke Damaris'}, {'name': 'Matthew Cotten'}, {'name': 'Maureen W. Mburu'}, {'name': 'Maximillian Mpina'}, {'name': 'Michael Owusu'}, {'name': 'Michael R. Wiley'}, {'name': 'Mohamed A. Ali'}, {'name': 'Mohamed Abouelhoda'}, {'name': 'Mohamed G. Seadawy'}, {'name': 'Mohamed K. Khalifa'}, {'name': 'Mooko Sekhele'}, {'name': 'Mouna Ouadghiri'}, {'name': 'Mulenga Mwenda'}, {'name': 'Mushal Allam'}, {'name': 'My V.T. Phan'}, {'name': 'Nabil Abid'}, {'name': 'Nadia Touil'}, {'name': 'Najla Kharrat'}, {'name': 'Nalia Ismael'}, {'name': 'Nedio Mabunda'}, {'name': 'Nei-yuan Hsiao'}, {'name': 'Nelson B. Silochi'}, {'name': 'Ngonda Saasa'}, {'name': 'Nicola Mulder'}, {'name': 'Patrice Combe'}, {'name': 'Patrick Semanda'}, {'name': 'Paul E. Oluniyi'}, {'name': 'Paulo Arnaldo'}, {'name': 'Peter K. Quashie'}, {'name': 'Philip A. Bester'}, {'name': 'Philippe Dussart'}, {'name': 'Placide K. Mbala'}, {'name': 'Pontiano Kaleebu'}, {'name': 'Reuben Ayivor-Djanie'}, {'name': 'Richard Njouom'}, {'name': 'Richard O. Phillips'}, {'name': 'Richmond Gorman'}, {'name': 'Robert A. Kingsley'}, {'name': 'Rosina A.A. Carr'}, {'name': 'Saâd El Kabbaj'}, {'name': 'Saba Gargouri'}, {'name': 'Saber Masmoudi'}, {'name': 'Samar Kassim'}, {'name': 'Sameh Trabelsi'}, {'name': 'Sami Kammoun'}, {'name': 'Sanaâ Lemriss'}, {'name': 'Sara H. Agwa'}, {'name': 'Sébastien Calvignac-Spencer'}, {'name': 'Seydou Doumbia'}, {'name': 'Sheila M. Mandanda'}, {'name': 'Sherihane Aryeetey'}, {'name': 'Shymaa S. Ahmed'}, {'name': 'Sikhulile Moyo'}, {'name': 'Simani Gaseitsiwe'}, {'name': 'Sonia Lekana-Douki'}, {'name': 'Sophie Prosolek'}, {'name': 'Soumeya Ouangraoua'}, {'name': 'Steve A. Mundeke'}, {'name': 'Steven Rudder'}, {'name': 'Sumir Panji'}, {'name': 'Sureshnee Pillay'}, {'name': 'Susan Engelbrecht'}, {'name': 'Susan Nabadda'}, {'name': 'Sylvie Behillil'}, {'name': 'Sylvie L. Budiaki'}, {'name': 'Sylvie van der Werf'}, {'name': 'Tapfumanei Mashe'}, {'name': 'Tarik Aanniz'}, {'name': 'Thabo Mohale'}, {'name': 'Thanh Le-Viet'}, {'name': 'Tobias Schindler'}, {'name': 'Ugochukwu J. Anyaneji'}, {'name': 'Upasana Ramphal'}, {'name': 'Vagner Fonseca'}, {'name': 'Vincent Enouf'}, {'name': 'Vivianne Gorova'}, {'name': 'Wael H. Roshdy'}, {'name': 'William K. Ampofo'}, {'name': 'Wolfgang Preiser'}, {'name': 'Wonderful T. Choga'}, {'name': 'Yaw Bediako'}, {'name': 'Yenew K Tebeje'}, {'name': 'Yeshnee Naidoo'}, {'name': 'Zaydah R. de Laurent'}, {'name': 'Sofonias K. Tessema'}, {'name': 'Tulio de Oliveira'}]","<p>The progression of the SARS-CoV-2 pandemic in Africa has so far been heterogeneous and the full impact is not yet well understood. Here, we describe the genomic epidemiology using a dataset of 8746 genomes from 33 African countries and two overseas territories. We show that the epidemics in most countries were initiated by importations, predominantly from Europe, which diminished following the early introduction of international travel restrictions. As the pandemic progressed, ongoing transmission in many countries and increasing mobility led to the emergence and spread within the continent of many variants of concern and interest, such as B.1.351, B.1.525, A.23.1 and C.1.1. Although distorted by low sampling numbers and blind-spots, the findings highlight that Africa must not be left behind in the global pandemic response, otherwise it could become a breeding ground for new variants.</p>",2021-05-13
3,10.1101/2021.05.11.21257037,252,medRxiv,Infectious Diseases (except HIV/AIDS),True,Mental health of Adolescents in the Pandemic: Long-COVID19 or Long-Pandemic Syndrome?,"[{'name': 'Judith Blankenburg'}, {'name': 'Magdalena K. Wekenborg'}, {'name': 'Jörg Reichert'}, {'name': 'Carolin Kirsten'}, {'name': 'Elisabeth Kahre'}, {'name': 'Luise Haag'}, {'name': 'Leonie Schumm'}, {'name': 'Paula Czyborra'}, {'name': 'Reinhard Berner'}, {'name': 'Jakob P. Armann'}]","<sec><title>Backround</title><p>Post-COVID19 complications such as pediatric inflammatory multisystem syndrome (PIMS) and Long-COVID19 move increasingly into focus, potentially causing more harm in this age group than the acute infection. To better understand the symptoms of long-COVID19 in adolescents and to distinguish infection-associated symptoms from pandemic-associated symptoms, we conducted a Long-COVID19 survey, comparing responses from seropositive and seronegative adolescents. To our knowledge, data of Long-COVID19 surveys with seronegative control groups have not been published yet.</p></sec><sec><title>Methods</title><p>Since May 2020 students grade 8-12 in fourteen secondary schools in Eastern Saxony were enrolled in the SchoolCovid19 study. Seroprevalence was assessed via serial SARS-CoV-2 antibody testing in all participants. Furthermore, during the March/April 2021 study visit all participants were asked to complete a 12 question Long-COVID19 survey regarding the occurrence and frequency of difficulties concentrating, memory loss, listlessness, headache, abdominal pain, myalgia/ arthralgia, fatigue, insomnia and mood (sadness, anger, happiness and tenseness).</p></sec><sec><title>Findings</title><p>1560 students with a median age of 15 years participated in this study. 1365 (88%) were seronegative, 188 (12%) were seropositive. Each symptom was present in at least 35% of the students within the last seven days before the survey. However, there was no statistical difference comparing the reported symptoms between seropositive students and seronegative students. Whether the infection was known or unknown to the participant did not influence the prevalence of symptoms.</p></sec><sec><title>Interpretation</title><p>The lack of differences comparing the reported symptoms between seropositive and seronegative students suggests that Long-COVID19 might be less common than previously thought and emphasizing the impact of pandemic-associated symptoms regarding the well-being and mental health of young adolescents.</p></sec><sec><title>Funding</title><p>This study was supported by a grant by the Federal State of Saxony. M.K.W. was supported by the Else Kröner-Fresenius Center for Digital Health (EKFZ), TU Dresden, Germany.</p></sec>",2021-05-11
4,10.1101/2021.05.11.443151,203,bioRxiv,Neuroscience,False,Evaluating brain parcellations using the distance controlled boundary coefficient,"[{'name': 'Da Zhi'}, {'name': 'Maedbh King'}, {'name': 'Jörn Diedrichsen'}]","<p>An important goal of human brain mapping is to define a set of distinct regions that can be linked to unique functions. Numerous brain parcellations have been proposed, using cytoarchitectonic data, structural or functional Magnetic Resonance Imaging (fMRI). The intrinsic smoothness of the brain data, however, poses a problem for current methods seeking to compare different parcellations to each other. For example, criteria that simply compare within-parcel to between-parcel similarity provide even random parcellations with a high value. Furthermore, the evaluation is biased by the spatial scale of the parcellation. To address this problem, we propose the Distance Controlled Boundary Coefficient (DCBC), an unbiased criterion to evaluate discrete parcellations. We employ this new criterion to evaluate whether existing parcellations of the human neocortex can predict functional boundaries on a rich multi-domain task battery. We find that common anatomical parcellations do not perform better than chance, suggesting that task-based functional boundaries do not align well with sulcal landmarks. Parcellations based on resting-state fMRI data perform well; in some cases, as well as a parcellation defined on the evaluation data itself. Finally, multi-modal parcellations that combine functional and anatomical criteria perform substantially worse than those based on functional data alone, indicating that functionally homogeneous regions often span major anatomical landmarks. Overall, the DCBC advances the field of functional brain mapping by providing an unbiased metric that compares the predictive ability of different brain parcellations to define functionally and anatomically homogeneous brain regions.</p>",2021-05-11
5,10.1101/2021.05.08.21256866,163,medRxiv,Infectious Diseases (except HIV/AIDS),True,Antibody Responses After a Single Dose of ChAdOx1 nCoV-19 Vaccine in Healthcare Workers Previously Infected with SARS-CoV-2,"[{'name': 'Sebastian Havervall'}, {'name': 'Ulrika Marking'}, {'name': 'Nina Greilert-Norin'}, {'name': 'Henry Ng'}, {'name': 'Ann-Christin Salomonsson'}, {'name': 'Cecilia Hellström'}, {'name': 'Elisa Pin'}, {'name': 'Kim Blom'}, {'name': 'Sara Mangsbo'}, {'name': 'Mia Phillipson'}, {'name': 'Jonas Klingström'}, {'name': 'Mikael Åberg'}, {'name': 'Sophia Hober'}, {'name': 'Peter Nilsson'}, {'name': 'Charlotte Thålin'}]","<sec><title>Background</title><p>Recent reports demonstrate robust serological responses to a single dose of messenger RNA (mRNA) vaccines in individuals previously infected with SARS-CoV-2. Data on immune responses following a single-dose adenovirus-vectored vaccine expressing the SARS-CoV-2 spike protein (ChAdOx1 nCoV-19) in individuals with previous SARS-CoV-2 infection are however limited, and current guidelines recommend a two-dose regime regardless of preexisting immunity.</p></sec><sec><title>Methods</title><p>We compared spike-specific IgG and pseudo-neutralizing spike-ACE2 blocking antibodies against SARS-CoV-2 wild type and variants B.1.1.7, B.1.351, and P1 following two doses of the mRNA vaccine BNT162b2 and a single dose of the adenovector vaccine ChAdOx1 nCoV-19 in 232 healthcare workers with and without previous COVID-19.</p></sec><sec><title>Findings</title><p>The post-vaccine levels of spike-specific IgG and neutralizing antibodies against the SARS-CoV-2 wild type and all three variants of concern were similar or higher in participants receiving a single dose of ChAdOx1 nCoV-19 vaccine post SARS-CoV-2 infection (both &lt; 11 months post infection (n=37) and ≥ 11 months infection (n=46)) compared to participants who received two doses of BNT162b2 vaccine (n=149).</p></sec><sec><title>Interpretation</title><p>Our data support that a single dose ChAdOx1 nCoV-19 vaccine serves as an effective immune booster after priming with natural SARS-CoV-2 infection up to at least 11 months post infection.</p></sec>",2021-05-11
6,10.1101/2021.05.14.444076,119,bioRxiv,Immunology,True,The Spike Proteins of SARS-CoV-2 B.1.617 and B.1.618 Variants Identified in India Provide Partial Resistance to Vaccine-elicited and Therapeutic Monoclonal Antibodies.,"[{'name': 'Takuya Tada'}, {'name': 'Hao Zhou'}, {'name': 'Belinda M Dcosta'}, {'name': 'Marie I Samanovic'}, {'name': 'Mark J Mulligan'}, {'name': 'Nathaniel R Landau'}]","<p>Highly transmissible SARS-CoV-2 variants recently identified in India designated B.1.617 and B.1.618 have mutations within the spike protein that may contribute to their increased transmissibility and that could potentially result in re-infection or resistance to vaccine-elicited antibody. B.1.617 encodes a spike protein with mutations L452R, E484Q, D614G and P681R while the B.1.618 spike has mutations Δ145-146, E484K and D614G. We generated lentiviruses pseudotyped by the variant proteins and determined their resistance to neutralization by convalescent sera, vaccine-elicited antibodies and therapeutic monoclonal antibodies. Viruses with B.1.617 and B.1.618 spike were neutralized with a 2-5-fold decrease in titer by convalescent sera and vaccine-elicited antibodies. The E484Q and E484K versions were neutralized with a 2-4-fold decrease in titer. Virus with the B.1.617 spike protein was neutralized with a 4.7-fold decrease in titer by the Regeneron monoclonal antibody cocktail as a result of the L452R mutation. The modest neutralization resistance of the variant spike proteins to vaccine elicited antibody suggests that current vaccines will remain protective against the B.1.617 and B.1.618 variants.</p>",2021-05-16
7,10.1101/2021.05.13.443778,115,bioRxiv,Microbiology,False,STING mediates immune responses in a unicellular choanoflagellate,"[{'name': 'Arielle Woznica'}, {'name': 'Ashwani Kumar'}, {'name': 'Carolyn R. Sturge'}, {'name': 'Chao Xing'}, {'name': 'Nicole King'}, {'name': 'Julie K. Pfeiffer'}]","<p>Animals have evolved unique repertoires of innate immune genes and pathways that provide their first line of defense against pathogens. To reconstruct the ancestry of animal innate immunity, we have developed the choanoflagellate <italic>Monosiga brevicollis</italic>, one of the closest living relatives of animals, as a model for studying mechanisms underlying pathogen recognition and immune response. We found that <italic>M. brevicollis</italic> is killed by exposure to <italic>Pseudomonas aeruginosa</italic> bacteria and selectively avoids ingesting them. Moreover, <italic>M. brevicollis</italic> expresses STING, which, in animals, activates innate immune pathways in response to cyclic dinucleotides during pathogen sensing. <italic>M. brevicollis</italic> STING increases the susceptibility of <italic>M. brevicollis</italic> to <italic>P. aeruginosa</italic>-induced cell death and is required for responding to the cyclic dinucleotide 2’3’ cGAMP. Furthermore, similar to animals, autophagic signaling in <italic>M. brevicollis</italic> is induced by 2’3’ cGAMP in a STING-dependent manner. This study provides evidence for a pre-animal role for STING in antibacterial immunity and establishes <italic>M. brevicollis</italic> as a model system for the study of immune responses.</p>",2021-05-14
