,doi,tweets,archive,subject-area,covid,title,authors,abstract,posted
126,10.1101/2021.10.29.466423,5,bioRxiv,Genetics,False,Modeling the efficacy of CRISPR gene drive for schistosomiasis control,"[{'name': 'Richard E Grewelle'}, {'name': 'Javier Perez-Saez'}, {'name': 'Josh Tycko'}, {'name': 'Erica KO Namigai'}, {'name': 'Chloe G Rickards'}, {'name': 'Giulio A De Leo'}]","<p>CRISPR gene drives could revolutionize the control of infectious diseases by accelerating the spread of engineered traits that limit parasite transmission in wild populations.  While much effort has been spent developing gene drives in mosquitoes, gene drive technology in molluscs has received little attention despite the role of freshwater snails as obligate, intermediate hosts of parasitic flukes causing schistosomiasis -- a disease of poverty affecting more than 200 million people worldwide.  A successful drive in snails must overcome self-fertilization, which prevents a drive's spread. Simultaneous hermaphroditism is a feature of snails -- distinct from gene drive model organisms -- and is not yet incorporated in gene drive models of disease control.  Here we developed a novel population genetic model accounting for snails' sexual and asexual reproduction, susceptibility to parasite infection regulated by multiple alleles, fitness differences between genotypes, and a range of drive characteristics.  We then integrated this model with an epidemiological model of schistosomiasis transmission and snail population dynamics.  Simulations showed that gene drive establishment can be hindered by a variety of biological and ecological factors, including selfing.  However, our model suggests that, under a range of conditions, gene drive mediated immunity in snails could maintain rapid disease reduction achieved by annual chemotherapy treatment of the human population, leading to long-term elimination.  These results indicate that gene drives, in coordination with existing public health measures, may become a useful tool to reduce schistosomiasis burden in selected transmission settings with effective CRISPR construct design and close evaluation of the genetic and ecological landscape.</p>",2021-10-29
127,10.1101/2021.10.21.21265321,5,medRxiv,Public and Global Health,False,Accuracy of computer-aided chest X-ray screening in the Kenya National Tuberculosis Prevalence Survey,"[{'name': 'Brenda Mungai'}, {'name': ""Jane Ong'ang'o""}, {'name': 'Chu Chang Ku'}, {'name': 'Marc YR Henrion'}, {'name': 'Ben Morton'}, {'name': 'Elizabeth Joekes'}, {'name': 'Richard Kiplimo'}, {'name': 'Dickson Kirathe'}, {'name': 'Enos Masini'}, {'name': 'Joseph Sitienei'}, {'name': 'Veronica Manduku'}, {'name': 'Beatrice Mugi'}, {'name': 'Stephen Bertel Squire'}, {'name': 'Peter MacPherson'}, {'name': ' '}]","<p>Background: Community–based screening for tuberculosis (TB) could improve detection but is resource intensive. We set out to evaluate the accuracy of computer–aided TB screening using digital chest X-ray (CXR) to determine if this approach met target product profiles (TPP) for community–based screening.

Methods: CXR images from participants in the 2016 Kenya National TB Prevalence Survey were evaluated using CAD4TBv6 (Delft Imaging), giving a probabilistic score for pulmonary TB ranging from 0 (low probability) to 99 (high probability). We constructed a Bayesian latent class model to estimate the accuracy of CAD4TBv6 screening compared to bacteriologically–confirmed TB across CAD4TBv6 threshold cut–offs, incorporating data on Clinical Officer CXR interpretation, participant demographics (age, sex, TB symptoms, previous TB history), and sputum results. We compared model–estimated sensitivity and specificity of CAD4TBv6 to optimum and minimum TPPs.

Results: Of 63,050 prevalence survey participants, 61,848 (98%) had analysable CXR images, and 8,966 (14.5%) underwent sputum bacteriological testing; 298 had bacteriologically–confirmed pulmonary TB. Median CAD4TBv6 scores for participants with bacteriologically–confirmed TB were significantly higher (72, IQR: 58–82.75) compared to participants with bacteriologically–negative sputum results (49, IQR: 44–57, p&lt;0.0001). CAD4TBv6 met the optimum TPP; with the threshold set to achieve a mean sensitivity of 95% (optimum TPP), specificity was 83.3%, (95% credible interval [CrI]: 83.0%–83.7%, CAD4TBv6 threshold: 55). There was considerable variation in accuracy by participant characteristics, with older individuals and those with previous TB having lowest specificity. 

Conclusions: CAD4TBv6 met the optimal TPP for TB community screening. To optimise screening accuracy and efficiency of confirmatory sputum testing, we recommend that an adaptive approach to threshold setting is adopted based on participant characteristics.
 </p>",2021-10-30
128,10.1101/2021.10.28.466326,5,bioRxiv,Plant Biology,False,"Efficient, selectable marker free gene targeting in soybean using novel Ochrobactrum haywardense-mediated delivery","[{'name': 'Sandeep Kumar'}, {'name': 'Zhan-Bin Lui'}, {'name': 'Nathalie Sanyour-Doyel'}, {'name': 'Brian Landerts'}, {'name': 'Andrew Worden'}, {'name': 'Ajith Anand'}, {'name': 'Hyeon-Je Cho'}, {'name': 'Jyothi Bolar'}, {'name': 'Charlotte Harris'}, {'name': 'Lingxia Huang'}, {'name': 'Aiqiu Xing'}, {'name': 'Alexandra Richardson'}]","<p>We report robust selectable marker-free gene targeting (GT) system in soybean, one of the most economically important crops. A novel efficient Ochrobactrum haywardense-mediated embryonic axis transformation method was used for the delivery of CRISPR-Cas9 components and donor template to regenerate T0 plants in 6-8 weeks after transformation. This approach generated up to 3.4% targeted insertion of the donor sequence into the target locus in T0 plants, with ~ 90% mutation rate observed at the genomic target site. The GT was demonstrated in two genomic sites using two different donor DNA templates without a need of a selectable marker within the template. High-resolution Southern by Sequencing (SbS) analysis identified T1 plants with precise targeted insertion and without unintended plasmid DNA. Unlike previous low-frequency GT reports in soybean that involved particle bombardment-mediated delivery and extensive selection, the method described here is fast, efficient, reproducible, does not require selectable marker within the donor DNA, and generates non-chimeric plants with heritable GT.</p>",2021-10-29
129,10.1101/2021.10.27.466172,4,bioRxiv,Neuroscience,False,Dynamic Subcortical Modulators of Human Default Mode Network Function,"[{'name': 'Ben J Harrison'}, {'name': 'Christopher G Davey'}, {'name': 'Hannah S Savage'}, {'name': 'Alec J Jamieson'}, {'name': 'Christine A Leonards'}, {'name': 'Bradford A Moffat'}, {'name': 'Rebecca K Glarin'}, {'name': 'Trevor Steward'}]","<p>The brain's 'default mode network' (DMN) enables flexible switching between internally and externally focused cognition. Precisely how this modulation occurs is not well understood, although may involve key subcortical mechanisms, including hypothesized influences from the basal forebrain (BF) and mediodorsal thalamus (MD). Here, we used ultra-high field (7T) functional magnetic resonance imaging to examine the involvement of the BF and MD across states of task-induced DMN activity modulation. Specifically, we mapped DMN activity suppression ('deactivation') when participants transitioned between rest and externally focused task performance, as well as DMN activity engagement ('activation') when task performance was internally (i.e., self) focused. Consistent with recent rodent studies, the BF showed overall activity suppression with DMN cortical regions when comparing the rest to external task conditions. Further analyses, including dynamic causal modelling, confirmed that the BF drove changes in DMN cortical activity during these rest-to-task transitions. The MD, by comparison, was specifically engaged during internally focused cognition and demonstrated a broad excitatory influence on DMN cortical activation. These results provide the first direct evidence in humans of distinct basal forebrain and thalamic circuit influences on the control of DMN function and suggest novel mechanistic avenues for ongoing translational research.</p>",2021-10-29
130,10.1101/2021.10.28.21265578,4,medRxiv,Primary Care Research,True,"Impact of the COVID-19 pandemic on routine immunization coverage in children under 2 years old in Ontario, Canada: A retrospective cohort study","[{'name': 'Catherine Ji'}, {'name': 'Pierre-Philippe Piche-Renaud'}, {'name': 'Jemisha Apajee'}, {'name': 'Ellen Stephenson'}, {'name': 'Milena Forte'}, {'name': 'Jeremy N Friedman'}, {'name': 'Michelle Science'}, {'name': 'Stanley Zlotkin'}, {'name': 'Shaun K Morris'}, {'name': 'Karen Tu'}]","<p>Background: The COVID-19 pandemic has caused a disruption in childhood immunization coverage around the world. This study aimed to determine the change in immunization coverage for children under 2 years old in Ontario, Canada, comparing time periods pre-pandemic to during the pandemic.
Methods: We conducted an observational retrospective open cohort study, using primary care electronic medical record data from the University of Toronto Practice-Based Research Network (UTOPIAN) database, from January 2019 to December 2020. Children under 2 years old who had at least 2 visits recorded in UTOPIAN were included. We measured up-to-date (UTD) immunization coverage rates, overall and by type of vaccine (DTaP-IPV-Hib, Pneu-C-13, Rot, Men-C-C, MMR, Var), and on-time immunization coverage rates by age milestone (2, 4, 6, 12, 15 and 18 months). We compared average coverage rates over 3 periods of time: January 2019-March 2020 (T1); March-July 2020 (T2); and August-December 2020 (T3).
Results: 12,313 children were included. Overall UTD coverage for all children was 71.0% in T1, dropped by 5.7% (95% CI: -6.2, -5.1) in T2, slightly increased in T3 but remained lower than in T1. MMR vaccine UTD coverage slightly decreased in T2 and T3 by approximately 2%. The largest decreases were seen at ages 15-month and 18-month old, with drops in on-time coverage of 14.7% (95% CI: -18.7, -10.6) and 16.4% (95% CI: -20.0, -12.8) respectively during T2. When stratified by sociodemographic characteristics, no specific subgroup of children was found to have been differentially impacted by the pandemic.
Conclusion: Childhood immunization coverage rates for children under 2 years in Ontario decreased significantly during the early period of the COVID-19 pandemic and only partially recovered during the rest of 2020. Public health and educational interventions for providers and parents are needed to ensure adequate catch-up of delayed/missed immunizations to prevent potential outbreaks of vaccine-preventable diseases.</p>",2021-10-29
131,10.1101/2021.10.28.21265604,4,medRxiv,Public and Global Health,True,Transferability of Psychological Interventions from Disaster-Exposed Employees to Healthcare Workers Working during the COVID-19 Pandemic,"[{'name': 'Sean Treacy'}, {'name': 'Shane O Donnell'}, {'name': 'Blanaid Gavin'}, {'name': 'Tamara Schloemer'}, {'name': 'Etain Quigley'}, {'name': 'Dimitrios Adamis'}, {'name': 'Fiona Mc Nicholas'}, {'name': 'John Hayden'}]","<p>Background: The COVID-19 Pandemic had a significant negative impact on the mental health of healthcare workers. Evidence-based interventions that could be used to mitigate this impact are lacking in the literature. This review aims to evaluate psychological interventions used for employees following previous disasters and assess the transferability of these interventions to a healthcare setting during the COVID-19 pandemic. 
Methods: Intervention information from a previously published systematic review of the literature published up to 2015 was extracted, and an additional search of studies published from 2015-2020 was conducted.  Studies were assessed for transferability using a checklist derived from the PIET-T process model. 
Results: Interventions from eighteen studies were assessed for transferability (including three studies identified in an updated literature search). Interventions established as most transferable included resilience training, meditation/mindfulness interventions, and cognitive behavioural therapy. Psychological debriefing was transferable but as it is contrary to current recommendations is not deemed appropriate for adoption. 
Implications: Several existing interventions have the potential to be utilised within the COVID-19 context/pandemic. More research needs to be undertaken in this area to assess these interventions upon transfer.</p>",2021-10-29
132,10.1101/2021.10.28.21265608,4,medRxiv,Nursing,True,Social discrimination and stigma on the community of health professionals during the Covid-19 pandemic. An ethnographic approach,"[{'name': 'Alexandros Argyriadis'}, {'name': 'Athina Patelarou'}, {'name': 'Vasiliki Kitsona'}, {'name': 'Alexandra Trivli'}, {'name': 'Evridiki Patelarou'}, {'name': 'Agathi Argyriadi'}]","<p>Severe Acute Respiratory Syndrome Coronavirus Type 2 (SARS-CoV-2) that caused the pandemic since March 2020, has affected among others, health professionals who work in covid-19 units by facing social discrimination. The aim of this study was to record the experiences of health professionals working in the first line of treatment of the pandemic, to analyse the effects of the pandemic on the interpersonal relationships of health professionals, and to ask about the stigma they faced during their work with people with covid-19.
This is a qualitative study with an ethnographic approach based on 160 semi-structured interviews with health professionals living and working in the Epirus Region, Greece. For the data collection we used semi-structured interviews, discussions and participatory observation.  Specifically, the interviews were conducted on health professionals and more specifically doctors, nurses, rescuers, physiotherapists and administrative staff, working in covid-19 units at the University General Hospital of Ioannina (Reference hospital for Ioannina, in Epirus), which assists in the treatment of patients with covid-19, and in the branch of the rescue department of Ioannina. 
The data were analysed in four thematic units based on their common characteristics: a) emotions and experiences of health professionals, b) interpersonal relations of health professionals, c) social exclusion and discrimination, and d) health professionals as patients. The results showed that the main emotions that health professionals experienced when they were moved to covid-19 clinics were fear, anxiety, distress, anger and insecurity. These feelings worsened when their family environment treated them with fear and hesitancy. Their social environment tended to avoid them, leading to a state of self-isolation. To conclude, health professionals faced discriminating behaviors and stigma both from their families and social environment, and from other health professionals. The government struggled to handle the situation in keeping a balance between both the security and well-being of health professionals as it was not prepared for a pandemic like this.</p>",2021-10-29
133,10.1101/2021.10.26.465985,4,bioRxiv,Biophysics,False,Ligand-induced unfolding mechanism of an RNA G-quadruplex,"[{'name': 'Susanta Haldar'}, {'name': 'Yashu Zhang'}, {'name': 'Ying Xia'}, {'name': 'Barira Islam'}, {'name': 'Sisi Liu'}, {'name': 'Francesco L Gervasio'}, {'name': 'Adrian J. Mulholland'}, {'name': 'Zoë A. E. Waller'}, {'name': 'Dengguo Wei'}, {'name': 'Shozeb Haider'}]","<p>The cationic porphyrin, TMPyP4, is a well-established DNA G-quadruplex (G4) binding ligand that can stabilize different topologies via multiple binding modes. However, TMPyP4 has completely opposite destabilizing and unwinding effect on RNA G4 structures. The structural mechanisms that mediate RNA G4 unfolding remains unknown. Here, we report on the TMPyP4-induced RNA G4 unfolding mechanism studied by well-tempered metadynamics (WT-MetaD) with supporting biophysical experiments. The simulations predict a two-state mechanism of TMPyP4 interaction via a groove-bound and a top-face bound conformation. The dynamics of TMPyP4 stacking on the top tetrad disrupts Hoogsteen H-bonds between guanine bases resulting in the consecutive TMPyP4 intercalation from top-to-bottom G-tetrads. The results reveal a striking correlation between computational and experimental approaches and validate WT-MetaD simulations as a powerful tool for studying RNA G4-ligand interactions.</p>",2021-10-26
134,10.1101/2021.10.26.465862,4,bioRxiv,Plant Biology,False,Transcriptome Dynamics of Floral Organs Approaching Blooming in the Flowering Cherry (Cerasus × yedoensis) Cultivar ‘Somei-Yoshino’,"[{'name': 'Kenta Shirasawa'}, {'name': 'Tomoya Esumi'}, {'name': 'Akihiro Itai'}, {'name': 'Sachiko Isobe'}]","<p>To gain insights into the genetic mechanisms underlying blooming and petal movement in flowering cherry (<italic>Cerasus</italic> × <italic>yedoensis</italic>), we performed time-course RNA-seq analysis of the floral buds and open-flowers of the most popular flowering cherry cultivar, ‘Somei-Yoshino’. Independent biological duplicate samples of floral buds and open-flowers were collected from ‘Somei-Yoshino’ trees grown at three different locations in Japan. RNA-seq reads obtained from floral bud and open-flower samples collected in the current study (in 2019) and in a previous study (in 2017) were aligned against the genome sequence of ‘Somei-Yoshino’ to quantify gene transcript levels. Clustering analysis of RNA-seq reads revealed dynamic changes in the transcriptome, with genes in seven modules predominantly expressed at specific time points, ranging from 5 weeks before flowering to 2 weeks after flowering. Based on the identified gene modules and Gene Ontology (GO) terms enriched at different floral stages, we speculate that the genetic mechanisms underlying petal movement and flower opening in cherry involve the processes of development, cell wall organization, reproduction, and metabolism, which are executed by genes encoding transcription factors, phytohormones, transporters, and polysaccharide metabolic enzymes. Furthermore, we propose a method for cherry bloom forecasting, based on gene expression levels at different time points before flowering as RNA markers.</p>",2021-10-28
135,10.1101/2021.10.26.465915,4,bioRxiv,Immunology,False,Hematopoietic stem and progenitor cells improve survival from sepsis by boosting immunomodulatory cells,"[{'name': 'Daniel E. Morales-Mantilla'}, {'name': 'Bailee Kain'}, {'name': 'Duy Le'}, {'name': 'Anthony Flores'}, {'name': 'Silke Paust'}, {'name': 'Katherine King'}]","<p>Sepsis accounts for 1 in 5 deaths worldwide, and new therapeutic strategies to reduce sepsis- related mortality are urgently needed. Since hematopoietic stem and progenitor cells (HSPCs) are responsible for producing blood and immune cells, including in response to immunological stress, we explored their potential for treating sepsis. In a mouse model of Group A <italic>Streptococcus</italic> (GAS)-induced sepsis, severe immunological stress was associated with significant depletion of bone marrow HSPCs and mortality within approximately 5-7 days. We hypothesized that the inflammatory environment of GAS infection drives rapid HSPC differentiation and depletion that can be rescued by infusion of donor HSPCs. Indeed, infusion of 10,000 naïve HSPCs into GAS-infected mice resulted in rapid myelopoiesis and a 50-60% increase in overall survival. Surprisingly, mice receiving donor HSPCs displayed a similar pathogen load compared to untreated mice. Flow cytometric analysis revealed a significantly increased number of myeloid-derived suppressor cells in HSPC-infused mice, which correlated with reduced inflammatory cytokine levels and restored HSPC levels. These findings suggest that HSPCs play an essential immunomodulatory role that may translate into new therapeutic strategies for sepsis.</p>",2021-10-28
136,10.1101/2021.10.28.21265610,4,medRxiv,Pediatrics,True,"COVID-19 Patients Symptoms: Gastrointestinal Presentations, Comorbidities and Outcome in a Canadian Hospital setting","[{'name': 'Hassan Brim'}, {'name': 'Michal Moshkovich'}, {'name': 'Nikhil Pai'}, {'name': 'Melanie Figueiredo'}, {'name': 'Emily Hartung'}, {'name': 'Antonio Pizuorno'}, {'name': 'Lee Hill'}, {'name': 'Jelena Popov'}, {'name': 'Eyitope Olaide Awoyemi'}, {'name': 'Waliul I Khan'}, {'name': 'Reza Oskrochi'}, {'name': 'Hassan Ashktorab'}]","<p>Background: The Coronavirus disease 2019 (COVID-19) pandemic has had a significant global impact and Canada has seen significant morbidity and mortality nationwide. While public health interventions and provincially regulated health insurance coverage have been credited with minimizing transmission rates in Canada relative to neighboring countries, disease presentation has been presumed to be the same. 
Aim: We sought to determine factors associated with differences in gastrointestinal outcomes in COVID-19 patients at a Canadian hospital.
Methods: We collected data from 192 hospital records of COVID-19 patients across seven Hamilton Health Sciences hospitals, a network of academic health centers located in Hamilton, Ontario serving one of the largest metropolitan areas in Canada. Statistical and correlative analysis of symptoms, comorbidities, and mortality were performed.
Results: There were 192 patients. The mean age was 57.6 years (SD=21.0). For patients who died (n=27, 14%), mean age was 79.2 years old (SD=10.6) versus 54 years for survivors (SD=20.1). There was a higher mortality among patients with older age (p=0.000), long hospital stay (p=0.004), male patients (p=0.032), and patients in nursing homes (p=0.000). Patients with dyspnea (p=0.028) and hypertension (p=0.004) were more likely to have a poor outcome.  Laboratory test values that were significant in determining outcomes were an elevated INR (p=0.007) and elevated creatinine (p=0.000). Cough and hypertension were the most common symptom and comorbidity, respectively. Diarrhea was the most prevalent (14.5%) gastrointestinal symptom. Impaired liver function was related to negative outcome (LR 5.6; p=0.018). 
Conclusion: In a Canadian cohort, elevated liver enzymes, prolonged INR and elevated creatinine were associated with poor prognosis. Hypertension was also linked to a higher likelihood of negative outcome.</p>",2021-10-29
137,10.1101/2021.10.28.466382,4,bioRxiv,Microbiology,False,Impact of antibiotic perturbation on intestinal viral communities in mice,"[{'name': 'Jacqueline Moltzau Anderson'}, {'name': 'Tim Lachnit'}, {'name': 'Simone Lipinski'}, {'name': 'Maren Falk-Paulsen'}, {'name': 'Philip Rosenstiel'}]","<p>Viruses and bacteriophages have a strong impact on intestinal barrier function and the composition and functional properties of commensal bacterial communities. To improve our understanding of the role of the enteric intestinal virome, we longitudinally characterized the virome in fecal samples from wild-type (WT) C57BL/6J and knock-out (KO) NOD2 mice in response to an antibiotic perturbation. Sequencing of viral-like-particles (VLPs) demonstrated both a high diversity and high inter-individual variation of the murine gut virome composed of eukaryotic viruses and bacteriophages. Antibiotics also had a significant impact on the gut murine virome causing a delayed resilience independent of genotype. However, compositional shifts in the virome and bacteriome were highly correlated, indicating a possible role of the virome in inflammatory bowel disease. Bacteriophage species may be playing an important role in either upregulating or downregulating the bacterial community, and restoring a healthy virome may therefore be a central goal of microbiota-targeted therapies.</p>",2021-10-29
138,10.1101/2021.10.28.466339,4,bioRxiv,Biophysics,False,Emergent phases of ecological diversity and dynamics mapped in microcosms,"[{'name': 'Jiliang Hu'}, {'name': 'Daniel R. Amor'}, {'name': 'Matthieu Barbier'}, {'name': 'Guy Bunin'}, {'name': 'Jeff Gore'}]","<p>Natural ecological communities display striking features, such as high biodiversity and a wide range of dynamics, that have been difficult to explain in a unified framework. Using experimental bacterial microcosms, we perform the first direct test of recent complex systems theory predicting that simple aggregate parameters dictate emergent behaviors of the community. As either the number of species or the strength of species interactions is increased, we show that microbial ecosystems transition between distinct qualitative dynamical phases in the predicted order, from a stable equilibrium where all species coexist, to partial coexistence, to emergence of persistent fluctuations in species abundance. Under the same conditions, high biodiversity and fluctuations allow and require each other. Our results demonstrate predictable emergent diversity and dynamics in ecological communities.</p>",2021-10-29
