,doi,tweets,archive,subject-area,covid,title,authors,abstract,posted
24,10.1101/2021.06.17.21258666,6,medRxiv,Epidemiology,True,Predicting COVID-19 incidence in French hospitals using human contact network analytics,"[{'name': 'Christian Selinger'}, {'name': 'Marc Choisy'}, {'name': 'Samuel Alizon'}]","<p>Coronavirus disease (COVID-19) was detected in Wuhan, China in 2019 and spread worldwide within few weeks. The COVID-19 epidemic started to gain traction in France in March 2020. Sub-national hospital admissions and deaths were then recorded daily and served as the main policy indicators. Concurrently, mobile phone positioning data have been curated to determine the frequency of users being colocalized within a given distance. Contrarily to individual tracking data, these can provide a proxy of human contact networks between subnational administrative units. Motivated by numerous studies correlating human mobility data and disease incidence, we developed predictive time series models of hospital incidence between July 2020 and April 2021. Adding human contact network analytics such as clustering coefficients, contact network strength, null links or curvature as regressors, we found that predictions can be improved substantially (more than 50%) both at the national and sub-national for up to two weeks. Our sub-national analysis also revealed the importance of spatial structure, as incidence in colocalized administrative units improved predictions. This original application of network analytics from co-localisation data to epidemic spread opens new perspectives for epidemics forecasting and public health.</p><sec><title>Highlights</title><list list-type=""bullet""><list-item><p>We use novel human contact network analytics based on colocation data of mobile app users to follow the dynamics of disease incidence and interventions of COVID-19 in France.</p></list-item><list-item><p>Time series predictions of hospital incidence are greatly improved by adding these analytics as regressors.</p></list-item><list-item><p>Sub-national analysis highlights both spatial correlations of incidence and network analytics to obtain high-precision predictions.</p></list-item></list></sec>",2021-06-23
25,10.1101/2021.06.14.21258886,6,medRxiv,Epidemiology,True,"The majority of the variation in COVID-19 rates between nations is explained by median age, obesity rate, and island status","[{'name': 'Joseph B. Fraiman'}, {'name': 'Ethan Ludwin-Peery'}, {'name': 'Sarah Ludwin-Peery'}]","<p>Since the World Health Organization declared SARS-CoV-2 to be a global pandemic on March 11, 2020, nearly every nation on earth has reported infections. Incidence and prevalence of COVID-19 case rates have demonstrated extreme geospatial and temporal variability across the globe. The outbreaks in some countries are extreme and devastating, while other countries face outbreaks that are relatively minor. The causes of these differences between nations remain poorly understood, and identifying the factors that underlie this variation is critical to understand the dynamics of this disease in order to better respond to this and future pandemics.</p><p>Here, we examine four factors that we anticipated would explain much of the variation in COVID-19 rates between nations: median age, obesity rate, island status, and strength of border closure measures. Clinical evidence suggests that age and obesity increase both the likelihood of infection and transmission in individual patients, which make them plausible demographic factors. The third factor, whether or not each country is an island nation, was selected because the geographical isolation of islands is expected to influence COVID-19 transmission. The fourth factor of border closure was selected because of its anticipated interaction with island nation status.</p><p>Together, these four variables are able to explain a majority of the international variance in COVID-19 case rates. Using a dataset of 190 countries, simple modeling based on these four factors and their interactions explains more than 70% of the total variance between countries. With additional covariates, more complex modeling and higher-order interactions explains more than 80% of the variance. These novel findings offer a solution to explain the unusual global variation of COVID-19 that has remained largely elusive throughout the pandemic.</p>",2021-06-22
26,10.1101/2021.06.23.449573,6,bioRxiv,Biochemistry,False,Computational and experimental assessment of backbone templates for computational protein design,"[{'name': 'Frederikke Isa Marin'}, {'name': 'Kristoffer Enøe Johansson'}, {'name': 'Charlotte O’Shea'}, {'name': 'Kresten Lindorff-Larsen'}, {'name': 'Jakob Rahr Winther'}]","<p>Computational protein design has taken big strides over the recent years, however, the tools available are still not at a state where a sequence can be designed to fold into a given protein structure at will and with high probability. We have here applied a recent release of Rosetta Design to redesign a set of structurally very similar proteins belonging to the Thioredoxin fold. We determined design success using a combination of a genetic screening tool to assay folding/stability in <italic>E. coli</italic> and selecting the best hits from this for further biochemical characterization. We have previously used this set of template proteins for redesign and found that success was highly dependent on template structure, a trait which was also found in this study. Nevertheless, state of the art design software is now able to predict the best template, most likely due to the introduction of the <italic>cart_bonded</italic> energy term. The template that led to the greatest fraction of successful designs was the same (a Thioredoxin from spinach) as that identified in our previous study. Our previously described redesign of Thioredoxin, which also used the spinach protein as template, however also performed well. In the present study, both these templates yielded proteins with compact folded structures, and enforces the conclusion that any design project must carefully consider different design templates. Fortunately, selecting designs using the <italic>cart_bonded</italic> energy term appears to correctly identify such templates.</p>",2021-06-23
27,10.1101/2021.06.23.449535,6,bioRxiv,Bioinformatics,True,Integrative COVID-19 Biological Network Inference with Probabilistic Core Decomposition,"[{'name': 'Yang Guo'}, {'name': 'Fatemeh Esfahani'}, {'name': 'Xiaojian Shao'}, {'name': 'Venkatesh Srinivasan'}, {'name': 'Alex Thomo'}, {'name': 'Li Xing'}, {'name': 'Xuekui Zhang'}]","<p>The SARS-CoV-2 coronavirus is responsible for millions of deaths around the world. To help contribute to the understanding of crucial knowledge and to further generate new hypotheses relevant to SARS-CoV-2 and human protein interactions, we make use of the information abundant Biomine probabilistic database and extend the experimentally identified SARS-CoV-2-human protein-protein interaction (PPI) network <italic>in silico</italic>. We generate an extended network by integrating information from the Biomine database and the PPI network. To generate novel hypotheses, we focus on the high-connectivity sub-communities that overlap most with the PPI network in the extended network. Therefore, we propose a new data analysis pipeline that can efficiently compute core decomposition on the extended network and identify dense subgraphs. We then evaluate the identified dense subgraph and the generated hypotheses in three contexts: literature validation for uncovered virus targeting genes and proteins, gene function enrichment analysis on subgraphs, and literature support on drug repurposing for identified tissues and diseases related to COVID-19. The majority types of the generated hypotheses are proteins with their encoding genes and we rank them by sorting their connections to known PPI network nodes. In addition, we compile a comprehensive list of novel genes, and proteins potentially related to COVID-19, as well as novel diseases which might be comorbidities. Together with the generated hypotheses, our results provide novel knowledge relevant to COVID-19 for further validation.</p>",2021-06-24
28,10.1101/2021.06.24.449590,6,bioRxiv,Developmental Biology,False,Fetal-like reversion in the regenerating intestine is regulated by mesenchymal Asporin,"[{'name': 'Sharif Iqbal'}, {'name': 'Simon Andersson'}, {'name': 'Ernesta Nestaite'}, {'name': 'Nalle Pentinmikko'}, {'name': 'Ashish Kumar'}, {'name': 'Daniel Borshagovski'}, {'name': 'Anna Webb'}, {'name': 'Tuure Saarinen'}, {'name': 'Anne Juuti'}, {'name': 'Alessandro Ori'}, {'name': 'Markku Varjosalo'}, {'name': 'Kirsi H. Pietiläinen'}, {'name': 'Kim B Jensen'}, {'name': 'Menno Oudhoff'}, {'name': 'Pekka Katajisto'}]","<p>Epithelial tissues undergo fetal-like cellular reprogramming to regenerate after damage1,2. Although the mesenchyme and the extracellular matrix (ECM) play critical roles in tissue homeostasis and regeneration2-5, their role in repurposing developmental programs in epithelium is unknown. To model epithelial regeneration, we culture intestinal epithelium on decellularized small intestinal scaffold (iECM), and identify Asporin (Aspn), an ECM bound proteoglycan, as a critical mediator of cellular reprogramming. Aspn is produced by the mesenchyme, and we show that its effect on epithelial Tgfβ-signalling via CD44 is critical for fetal-like conversion. Furthermore, we demonstrate that Aspn is transiently increased upon chemotherapy-induced damage and pivotal for a timely induction of the fetal-like state and tissue regeneration. In summary, we establish a platform for modelling epithelial injury responses ex vivo, and show that the mesenchymal Aspn-producing niche controls tissue repair by regulating epithelial fetal-like reprogramming.</p>",2021-06-25
29,10.1101/2021.06.21.448937,6,bioRxiv,Immunology,False,Inflammation induces pro-NETotic neutrophils via TNFR2 signaling,"[{'name': 'Friederike Neuenfeldt'}, {'name': 'Jan Christoph Schumacher'}, {'name': 'Ricardo Grieshaber-Bouyer'}, {'name': 'Jüri Habicht'}, {'name': 'Jutta Schröder-Braunstein'}, {'name': 'Annika Gauss'}, {'name': 'Beate Niesler'}, {'name': 'Niko Heineken'}, {'name': 'Alexander Dalpke'}, {'name': 'Matthias M. Gaida'}, {'name': 'Thomas Giese'}, {'name': 'Stefan Meuer'}, {'name': 'Yvonne Samstag'}, {'name': 'Guido Wabnitz'}]","<p>Cytokines released during chronic inflammatory diseases induce pro-inflammatory properties in polymorphonuclear neutrophils (PMN). Here we show that <italic>in vitro</italic> cytokine treatment leads to the development of a subgroup of human PMN expressing CCR5, termed CCR5<sup>+</sup> cytokine-induced PMN (CCR5<sup>+</sup> cPMN). Auto/paracrine TNF signaling increases intracellular neutrophil elastase (ELANE) abundance and induces NETosis in CCR5<sup>+</sup> cPMN. Triggering of CCR5 amplifies NETosis. Membranous TNF (mTNF) outside-in signaling induces the formation of reactive oxygen species, a known activator of NETosis. <italic>In vivo</italic>, we find an increased number of CCR5<sup>+</sup> cPMN in the peripheral blood and inflamed lamina propria of patients with ulcerative colitis (UC) but not Crohn’s disease (CD). Notably, failure of anti-TNF therapy is associated with higher frequencies of CCR5<sup>+</sup> cPMN. In conclusion, we identify a phenotype of pro-NETotic, CCR5 positive PMN present in inflamed tissue <italic>in vivo</italic> and inducible <italic>in vitro</italic>. These cells may reflect an important component of tissue damage during chronic inflammation and could be of diagnostic value.</p>",2021-06-22
30,10.1101/2021.06.22.448967,5,bioRxiv,Genomics,False,Rapid Genomic Characterization and Global Surveillance of Klebsiella Using Pathogenwatch,"[{'name': 'Silvia Argimón'}, {'name': 'Sophia David'}, {'name': 'Anthony Underwood'}, {'name': 'Monica Abrudan'}, {'name': 'Nicole E. Wheeler'}, {'name': 'Mihir Kekre'}, {'name': 'Khalil Abudahab'}, {'name': 'Corin A. Yeats'}, {'name': 'Richard Goater'}, {'name': 'Ben Taylor'}, {'name': 'Harry Harste'}, {'name': 'Dawn Muddyman'}, {'name': 'Edward J. Feil'}, {'name': 'Sylvain Brisse'}, {'name': 'Kathryn Holt'}, {'name': 'Pilar Donado-Godoy'}, {'name': 'KL Ravikumar'}, {'name': 'Iruka N. Okeke'}, {'name': 'Celia Carlos'}, {'name': 'David M. Aanensen'}]","<sec><title>Background</title><p><italic>Klebsiella</italic> species, including the notable pathogen <italic>K. pneumoniae</italic>, are increasingly associated with antimicrobial resistance (AMR). Genome-based surveillance can inform interventions aimed at controlling AMR. However, its widespread implementation requires tools to streamline bioinformatic analyses and public health reporting.</p></sec><sec><title>Methods</title><p>We developed the web application Pathogenwatch, which implements analytics tailored to <italic>Klebsiella</italic> species for integration and visualization of genomic and epidemiological data. We populated Pathogenwatch with 16,537 public <italic>Klebsiella</italic> genomes to enable contextualization of user genomes. We demonstrated its features with 1,636 genomes from four low- and middle-income countries (LMICs) participating in the NIHR Global Health Research Unit (GHRU) on AMR.</p></sec><sec><title>Results</title><p>Using Pathogenwatch, we found that GHRU genomes were dominated by a small number of epidemic drug-resistant clones of <italic>K. pneumoniae</italic>. However, differences in their distribution were observed (e.g. ST258/512 dominated in Colombia, ST231 in India, ST307 in Nigeria, ST147 in the Philippines). Phylogenetic analyses including public genomes for contextualization enabled retrospective monitoring of their spread. In particular, we identified hospital outbreaks, detected introductions from abroad, and uncovered clonal expansions associated with resistance and virulence genes. Assessment of loci encoding O-antigens and capsule in <italic>K. pneumoniae</italic>, which represent possible vaccine candidates, showed that three O-types (O1-O3) represented 88.9% of all genomes, whereas capsule types were much more diverse.</p></sec><sec><title>Conclusions</title><p>Pathogenwatch provides a free, accessible platform for real-time analysis of <italic>Klebsiella</italic> genomes to aid surveillance at local, national and global levels. We have improved representation of genomes from GHRU participant countries, further facilitating ongoing surveillance.</p></sec><sec><title>40-word summary</title><p>Pathogenwatch is a free web-application for analysis of <italic>Klebsiella</italic> genomes to aid surveillance at local, national and global levels. We improved the representation of genomes from middle-income countries through the Global Health Research Unit on AMR, further facilitating ongoing surveillance.</p></sec><sec><title>FUNDING</title><p>This work was supported by Official Development Assistance (ODA) funding from the National Institute of Health Research [grant number 16_136_111].</p><p>This research was commissioned by the National Institute of Health Research using Official Development Assistance (ODA) funding. The views expressed in this publication are those of the authors and not necessarily those of the NHS, the National Institute for Health Research or the Department of Health.</p></sec><sec><title>CONFLICT OF INTEREST</title><p>The authors: No reported conflicts of interest. All authors have submitted the ICMJE Form for Disclosure of Potential Conflicts of Interest.</p></sec>",2021-06-22
31,10.1101/2021.06.22.449474,5,bioRxiv,Cell Biology,False,"PI(4,5)P2 controls slit diaphragm formation and endocytosis in Drosophila nephrocytes","[{'name': 'Maximilian Gass'}, {'name': 'Sarah Borkowsky'}, {'name': 'Marie-Luise Lotz'}, {'name': 'Rita Schröter'}, {'name': 'Pavel Nedvetsky'}, {'name': 'Stefan Luschnig'}, {'name': 'Astrid Rohlmann'}, {'name': 'Markus Missler'}, {'name': 'Michael P. Krahn'}]","<p><italic>Drosophila</italic> nephrocytes are an emerging model system for mammalian podocytes and podocyte-associated diseases. Like podocytes, nephrocytes exhibit characteristics of epithelial cells, but the role of phospholipids in polarization of these cells is yet unclear. In epithelia phosphatidylinositol(4,5)bisphosphate (PI(4,5)P2) and phosphatidylinositol(3,4,5)-trisphosphate (PI(3,4,5)P3) are asymmetrically distributed in the plasma membrane and determine apical-basal polarity. Here we demonstrate that both phospholipids are present in the plasma membrane of nephrocytes, but only PI(4,5)P2 accumulates at slit diaphragms. Knockdown of Skittles, a phosphatidylinositol(4)phosphate 5-kinase, which produces PI(4,5)P2, abolished slit diaphragm formation and led to strongly reduced endocytosis. Notably, reduction in PI(3,4,5)P3 by overexpression of PTEN or expression of a dominant-negative phosphatidylinositol-3-Kinase did not affect nephrocyte function, whereas enhanced formation of PI(3,4,5)P3 by constitutively active phosphatidylinositol-3-Kinase resulted in strong slit diaphragm and endocytosis defects by ectopic activation of the Akt/mTOR pathway. Thus, PI(4,5)P2 but not PI(3,4,5)P3 is essential for slit diaphragm formation and nephrocyte function. However, PI(3,4,5)P3 has to be tightly controlled to ensure nephrocyte development.</p>",2021-06-22
32,10.1101/2021.06.23.449596,5,bioRxiv,Immunology,False,P2Y6 receptor signaling in natural killer cells impairs insulin sensitivity in obesity,"[{'name': 'Anna Sieben'}, {'name': 'Anne Christine Hausen'}, {'name': 'Paul Klemm'}, {'name': 'Alexander Jais'}, {'name': 'Christian Heilinger'}, {'name': 'Jens Alber'}, {'name': 'Kat Folz-Donahue'}, {'name': 'Lena Schumacher'}, {'name': 'Janine Altmüller'}, {'name': 'Marek Franitza'}, {'name': 'Patrick Giavalisco'}, {'name': 'Yvonne Hinze'}, {'name': 'Susanne Brodesser'}, {'name': 'Christian Kukat'}, {'name': 'Sebastian Theurich'}, {'name': 'Jens C. Brüning'}]","<p>Natural killer (NK) cells contribute to the development of obesity-associated insulin resistance and have previously been shown to up-regulate the expression of the P2Y purinoreceptor 6 (P2Y6R) upon high fat diet (HFD)-induced obesity. Here, we reveal that NK cell-specific inactivation of the P2Y6R gene improves insulin sensitivity in obese mice and reduces the expression of chemokines in adipose tissue infiltrating NK-cells. Obese mice lacking P2Y6R specifically in NK cells exhibited a reduction in adipose tissue inflammation, exhibited improved insulin-stimulated suppression of lipolysis in adipose tissue and a reduction in hepatic glucose production, leading to an overall improvement of systemic insulin sensitivity. In contrast, myeloid lineage specific P2Y6R inactivation does not affect energy or glucose homeostasis in obesity. Collectively, we show that P2Y6R signaling in NK cells contributes to the development of obesity-associated insulin resistance and thus might be a future target for the treatment of obesity-associated insulin resistance and type 2 diabetes.</p>",2021-06-24
33,10.1101/2021.06.17.21258371,5,medRxiv,Infectious Diseases (except HIV/AIDS),True,ADESSO detects SARS-CoV-2 and its variants: extensive clinical validation of an optimised CRISPR-Cas13-based COVID-19 test,"[{'name': 'Beatrice Casati'}, {'name': 'J.P. Verdi'}, {'name': 'A. Hempelmann'}, {'name': 'Maximilian Kittel'}, {'name': 'Andrea Gutierrez Klaebisch'}, {'name': 'Sybille Welker'}, {'name': 'Sonal Asthana'}, {'name': 'Pavle Boskovic'}, {'name': 'Ka Hou Man'}, {'name': 'Bernhard Radlwimmer'}, {'name': 'C. Erec Stebbins'}, {'name': 'Thomas Miethke'}, {'name': 'F. Nina Papavasiliou'}, {'name': 'Riccardo Pecori'}]","<p>With the coronavirus disease 19 (COVID-19) pandemic now deep into its second year, widespread testing for the detection of the causative severe acute respiratory syndrome coronavirus 2 (SARS-CoV-2) is fundamental. The gold standard reverse transcription quantitative PCR (RT-qPCR) cannot keep up with the high demand alone, therefore alternative diagnostic tests are needed. Here we present ADESSO (Accurate Detection of Evolving SARS-CoV-2 through SHERLOCK Optimisation), an optimised version of the CRISPR-based SHERLOCK (Specific High-sensitivity Enzymatic Reporter unLOCKing) assay. After an extensive validation on 983 clinical samples, we demonstrated that ADESSO has a sensitivity of 96% and a specificity of 100% on extracted RNA, comparable to RT-qPCR. Its performance on unextracted samples still allows the detection of the more infectious 75% of the COVID-19 positive population, making it suitable for point-of-care (POC) testing. Interestingly, our in parallel comparison of 390 matching swab and gargle samples showed consistently lower viral loads in gargle specimens. We also validated ADESSO for the detection of the B.1.1.7 variant and demonstrated that ADESSO is adaptable to any variant of concern in less than one week, a critical feature now that worrisome SARS-CoV-2 variants are spreading all around the world.</p>",2021-06-22
34,10.1101/2021.06.24.449551,5,bioRxiv,Plant Biology,False,PpRPK2 modulates auxin homeostasis and transport to specify stem cell identity and plant shape in the moss Physcomitrella,"[{'name': 'Zoe Nemec Venza'}, {'name': 'Connor Madden'}, {'name': 'Amy Stewart'}, {'name': 'Wei Liu'}, {'name': 'Ondrej Novak'}, {'name': 'Ales Penik'}, {'name': 'Andrew C Cuming'}, {'name': 'Yasuko Kamisugi'}, {'name': 'C Jill Harrison'}]","<p>Plant shape is determined by the activity of stem cells in the growing tips, and evolutionary changes in shape are linked to changes in stem cell function. The CLAVATA pathway is a key regulator of stem cell function in the multicellular shoot tips of Arabidopsis, acting via the WUSCHEL transcription factor to modulate hormone homeostasis. Broad scale evolutionary comparisons have shown that CLAVATA is a conserved regulator of land plant stem cell function, but CLAVATA acts independently of WUSCHEL-like (WOX) proteins in bryophytes, raising questions about the evolution of stem cell function and the role of the CLAVATA pathway. Here we show that the moss (Physcomitrella) CLAVATA pathway affects stem cell activity and overall plant shape by modulating hormone homeostasis. CLAVATA pathway components are expressed in the tip cells of filamentous tissues, regulating cell identity, filament branching patterns and plant spread. The PpRPK2 receptor-like kinase plays the major role and is expressed more strongly than other receptor-encoding genes. Pprpk2 mutants have abnormal responses to cytokinin, and auxin transport inhibition and show reduced PIN auxin transporter expression. We propose a model whereby PpRPK2 modulates PIN activity to determine stem cell identity and overall plant form in Physcomitrella. Our data indicate that CLAVATA-mediated auxin homeostasis is a fundamental property of plant stem cell function likely exhibited by the last shared common ancestor of land plants.</p>",2021-06-25
