,doi,tweets,archive,subject-area,covid,title,authors,abstract,posted
89,10.1101/2021.10.27.465224,7,bioRxiv,Cell Biology,True,An iTSC-derived placental model of SARS-CoV-2 infection unveils ACE2-dependent susceptibility in syncytiotrophoblasts,"[{'name': 'Joseph Chen'}, {'name': 'Jessica A Neil'}, {'name': 'Jia Ping Tan'}, {'name': 'Raj Rudraraju'}, {'name': 'Monika Mohenska'}, {'name': 'Yu BY Sun'}, {'name': 'Guizhi Sun'}, {'name': 'Yichen Zhou'}, {'name': 'Ying Li'}, {'name': 'Damien Drew'}, {'name': 'Phill Pymm'}, {'name': 'Wai-Hong Tham'}, {'name': 'Fernando J Rossello'}, {'name': 'Guiying Nie'}, {'name': 'Xiaodong Liu'}, {'name': 'Kanta Subbarao'}, {'name': 'Jose Maria Polo'}]","<p>Severe acute respiratory syndrome coronavirus 2 (SARS-CoV-2) infection causing coronavirus disease 2019 (COVID-19) has caused a global health crisis. The primary  site of infection is in the respiratory tract but the virus has been associated with a variety of complications involving the gastrointestinal and cardiovascular systems. Since the virus affects a variety of tissue types, there has been interest in understanding SARS-CoV-2 infection in early development and the placenta. The expression of ACE2 or TMPRSS2, both genes  critical for viral entry, is present in placental-specific cell types such as extravillous trophoblasts (EVTs) and, especially, syncytiotrophoblasts (STs). The potential of SARS-CoV-2 to infect these placental cells and its effect on placental development and function is still unclear. Furthermore, it is crucial to understand the possible mechanism of vertical transmission of SARS-CoV-2 through the placenta. Here, we developed an in vitro model of SARS-CoV-2 infection of placental cell types using induced trophoblast stem cells (iTSCs). This model allowed us to show that STs but not EVTs are infected. Importantly, infected STs lack the expression of key differentiation genes, lack typically observed differentiated morphology and produce significantly lower human chorionic gonadotropin (HCG) compared to non-infected controls. We also show that an anti-ACE2 antibody prevents SARS-CoV-2 infection and restores normal ST differentiation and function. We highlight the establishment of a platform to study SARS-CoV-2 infection in early placental cell types, which will  facilitate investigation of antiviral therapy to protect the placenta during early pregnancy and development.</p>",2021-10-29
90,10.1101/2021.10.28.21265588,7,medRxiv,Infectious Diseases (except HIV/AIDS),True,Designing an evidence-based Bayesian network for estimating the risk versus benefits of AstraZeneca COVID-19 vaccine,"[{'name': 'Helen J Mayfield'}, {'name': 'Colleen L Lau'}, {'name': 'Jane E Sinclair'}, {'name': 'Samuel J Brown'}, {'name': 'Andrew Baird'}, {'name': 'John Litt'}, {'name': 'Aapeli Vuorinen'}, {'name': 'Kirsty R Short'}, {'name': 'Michael Waller'}, {'name': 'Kerrie Mengersen'}]","<p>Uncertainty surrounding the risk of developing and dying from Thrombosis and Thromobocytopenia Syndrome (TTS) associated with the AstraZeneca (AZ) COVID-19 vaccine may contribute to vaccine hesitancy. A model is urgently needed to combine and effectively communicate the existing evidence on the risks versus benefits of the AZ vaccine. We developed a Bayesian network to consolidate the existing evidence on risks and benefits of the AZ vaccine, and parameterised the model using data from a range of empirical studies, government reports, and expert advisory groups. Expert judgement was used to interpret the available evidence and determine the structure of the model, relevant variables, data to be included, and how these data were used to inform the model. 
The model can be used as a decision support tool to generate scenarios based on age, sex, virus variant and community transmission rates, making it a useful for individuals, clinicians, and researchers to assess the chances of different health outcomes. Model outputs include the risk of dying from TTS following the AZ COVID-19 vaccine, the risk of dying from COVID-19 or COVID-19-associated atypical severe blood clots under different scenarios. Although the model is focused on Australia, it can be easily adaptable to international settings by re-parameterising it with local data. This paper provides detailed description of the model-building methodology, which can used to expand the scope of the model to include other COVID-19 vaccines, booster doses, comorbidities and other health outcomes (e.g., long COVID) to ensure the model remains relevant in the face of constantly changing discussion on risks versus benefits of COVID-19 vaccination.</p>",2021-10-29
91,10.1101/2021.10.29.466388,6,bioRxiv,Cell Biology,False,Orb-dependent polyadenylation contributes to PLP expression and centrosome scaffold assembly,"[{'name': 'Junnan Fang'}, {'name': 'Dorothy Lerit'}]","<p>As the microtubule-organizing centers (MTOCs) of most cells, centrosomes engineer the bipolar mitotic spindle required for error-free mitosis. <italic>Drosophila</italic> Pericentrin (PCNT)-like protein (PLP) is a key centrosome component that directs formation of a pericentriolar material (PCM) scaffold required for PCM organization and MTOC function. Here, we investigate the post-transcriptional regulation of <italic>plp</italic> mRNA. We identify conserved binding sites for cytoplasmic polyadenylation element binding (CPEB) proteins within the <italic>plp</italic> 3′-untranslated region and examine the role of the CPEB ortholog, oo18 RNA-binding protein (Orb), in <italic>plp</italic> mRNA regulation. Our data show Orb biochemically interacts with <italic>plp</italic> mRNA and promotes PLP protein expression. Loss of <italic>orb</italic>, but not <italic>orb2</italic>, diminishes PLP levels in embryonic extracts. Consequently, PLP localization to centrosomes and function in PCM scaffolding is compromised in orb mutant embryos, resulting in genome instability and embryonic lethality. Moreover, we find PLP over-expression can restore centrosome scaffolding and rescue the cell division defects caused by orb depletion. Our data suggest Orb modulates PLP expression at the level of <italic>plp</italic> mRNA polyadenylation and showcases the post-transcriptional regulation of core, conserved centrosomal mRNAs as critical for centrosome function.</p>",2021-10-29
92,10.1101/2021.10.26.465946,6,bioRxiv,Bioinformatics,True,Multi-label topic classification for COVID-19 literature annotation using an ensemble model based on PubMedBERT,"[{'name': 'Shubo Tian'}, {'name': 'Jinfeng Zhang'}]","<p>The BioCreative VII Track 5 calls for participants to tackle the multi-label classification task for automated topic annotation of COVID-19 literature. In our participation, we evaluated several deep learning models built on PubMedBERT, a pre-trained language model, with different strategies addressing the challenges of the task. Specifically, multi-instance learning was used to deal with the large variation in the lengths of the articles, and focal loss function was used to address the imbalance in the distribution of different topics. We found that the ensemble model performed the best among all the models we have tested. Test results of our submissions showed that our approach was able to achieve satisfactory performance with an F1 score of 0.9247, which is significantly better than the baseline model (F1 score: 0.8678) and the mean of all the submissions (F1 score: 0.8931).</p>",2021-10-29
93,10.1101/2021.10.25.465726,6,bioRxiv,Genetics,False,Population structure in the MHC region,"[{'name': 'André Silva Maróstica'}, {'name': 'Kelly Nunes'}, {'name': 'Erick C. Castelli'}, {'name': 'Nayane S. B. Silva'}, {'name': 'Bruce S. Weir'}, {'name': 'Jérôme Goudet'}, {'name': 'Diogo Meyer'}]","<p>In his 1972 “The apportionment of human diversity”, Lewontin showed that, when averaged over loci, genetic diversity is predominantly attributable to differences among individuals within populations. However, selection on specific genes and genomic regions can alter the apportionment of diversity. We examine genetic diversity at the HLA loci, located within the MHC region. HLA genes code for proteins that are critical to adaptive immunity and are well-documented targets of balancing selection. The SNPs within HLA genes show strong signatures of balancing selection on large timescales and are broadly shared among populations, with low F<sub>ST</sub> values. However, when we analyze haplotypes defined by these SNPs (i.e., which define “HLA alleles”), we find marked differences in frequencies between geographic regions. These differences are not reflected in the F<sub>ST</sub> values because of the extreme polymorphism at HLA loci, illustrating challenges in interpreting F<sub>ST</sub>. Differences in the frequency of HLA alleles among geographic regions are relevant to bone-marrow transplantation, which requires genetic identity at HLA loci between patient and donor. We explore the case of Brazil’s bone-marrow registry, where a deficit of enrolled volunteers with African ancestry reduces the chance of finding donors for individuals with an MHC region of African ancestry.</p>",2021-10-26
94,10.1101/2021.10.28.21265544,6,medRxiv,Infectious Diseases (except HIV/AIDS),True,In vitro characterisation and clinical evaluation of the diagnostic accuracy of a new antigen test for SARS-CoV-2 detection.,"[{'name': 'J.J. Montoya'}, {'name': 'J.M. Rubio'}, {'name': 'Y. Ouahid'}, {'name': 'A. Lopez-Lopez'}, {'name': 'A. Madejon'}, {'name': 'A.I. Gil-Garcia'}, {'name': 'R.J. Hannam'}, {'name': 'H.R.E. Butler'}, {'name': 'P. Castan'}]","<p>Background and aims: Quick, user-friendly and sensitive diagnostic tools are the key to controlling the spread of the SARS-CoV-2 pandemic in the new epidemiologic landscape. The aim of this work is to characterise a new Covid-19 antigen test that uses an innovative chromatographic Affimer-based technology designed for the qualitative detection of SARS-CoV-2 antigen. As rapid technology to detect Covid-19, the test was extensively characterised in vitro. Once the analytical parameters of performance were set, the test system was challenged in a test field study. The aim of this study was to evaluate its diagnostic accuracy, as compared by the gold standard RT-PCR and other existing lateral flow tests. The study was approved by MiRNAX corporate review board to ensure i) that the test complied with all the ethical requirements, ii) that the rights of participants were protected, and iii) that donors were fully informed about the likelihood that they would not personally benefit from the research. The tests were completed under the frame of Project SENSORNAS RTC-20176501 in collaboration with MiRNAX Biosens Ltd. and Hospital Carlos III and are currently under submission and review from the Ethics Committee of Universidad Autonoma de Madrid.
Keywords: respiratory disease COVID-19; SARS-CoV-2; ELISA; RT-PCR; antigen lateral flow test.</p>",2021-10-29
95,10.1101/2021.10.29.465965,6,bioRxiv,Microbiology,False,Impact of a 7-day homogeneous diet on interpersonal variation in human gut microbiomes and metabolomes,"[{'name': 'Leah Guthrie'}, {'name': 'Sean Spencer'}, {'name': 'Dalia Perelman'}, {'name': 'Will Van Treuren'}, {'name': 'Shuo Han'}, {'name': 'Feiqiao Brian Yu'}, {'name': 'Erica Sonnenburg'}, {'name': 'Michael A Fischbach'}, {'name': 'Timothy W. Meyer'}, {'name': 'Justin Sonnenburg'}]","<p>Metabolism of dietary compounds by the gut microbiota generates a vast array of microbiome-dependent metabolites (MDMs), which are highly variable between individuals. The uremic MDMs (uMDMs) phenylacetylglutamine (PAG), p-cresol sulfate (PCS) and indoxyl sulfate (IS) accumulate during renal failure and are associated with poor outcomes. Targeted dietary interventions may reduce toxic MDMs generation; however, it is unclear if interindividual differences in diet or gut microbiome dominantly contribute to MDM variance. Here we use a 7-day homogeneous average American diet to standardize dietary precursor availability in 21 healthy individuals. Notably, the coefficient of variation in three uMDMs of interest, PAG, PCS, and IS (primary outcome), did not significantly decrease. The majority of circulating MDMs maintained variation despite identical diets. These results highlight the highly personalized profile of MDMs and limited contribution of short-term dietary heterogeneity, suggesting that dietary modification may need to be paired with microbial therapies to control MDM profiles.</p>",2021-10-29
96,10.1101/2021.10.28.21265596,6,medRxiv,Public and Global Health,True,A Novel Indicator for COVID-19 Pandemic Assessment and Comparison,[{'name': 'Kanchan Mukherjee'}],"<p>Introduction
In an increasingly globalized world, no country can remain immune to the effect of the COVID-19 pandemic. The pandemic has exposed the need for effective public health surveillance in the interest of global health security. However, current indicators are limited in doing a comparative intercountry assessment and comparison because of variation in testing rates and reporting standards. Hence, this study attempts at addressing this gap.

Methods 
The study proposes incremental change in cases per testing rate (ICTR) as an indicator for doing cross country comparison of the pandemic progress. The equation for calculating this indicator is explained in this study. This is followed by measuring its strength of association and predictive power for determining change in SARS-CoV-2 cases in five countries (USA, UK, India, Pakistan and Bangladesh).

Results and discussion
ICTR was found to have a significantly higher strength of association and predictive power (than the existing indicator- test positivity rate) for determining change in cases over different time periods. Using ICTR, cross country comparison was done for the five countries for15 months to draw deeper insights into the progress of the pandemic. 

Conclusions
The study finds ICTR to be a suitable indicator for inter country comparison and intra country monitoring of the pandemic, which would be useful for global COVID-19 surveillance. 

Key words: Incremental analysis, SARS-CoV-2, low-middle income country, high income country, testing rate, test positivity rate, surveillance.</p>",2021-10-29
97,10.1101/2021.10.26.465908,6,bioRxiv,Microbiology,False,HIV-1 envelope glycoproteins proteolytic cleavage protects infected cells from ADCC mediated by plasma from infected individuals,"[{'name': 'Jérémie Prévost'}, {'name': 'Halima Medjahed'}, {'name': 'Dani Vézina'}, {'name': 'Hung-Ching Chen'}, {'name': 'Beatrice H Hahn'}, {'name': 'Amos B. Smith'}, {'name': 'Andrés Finzi'}]","<p>The HIV-1 envelope glycoprotein (Env) is synthesized in the endoplasmic reticulum as a trimeric gp160 precursor, which requires proteolytic cleavage by a cellular furin protease to mediate virus-cell fusion. Env is conformationally flexible, but controls its transition from the unbound “closed” conformation (State 1) to downstream CD4-bound conformations (States 2/3), which are required for fusion. In particular, HIV-1 has evolved several mechanisms that reduce the premature “opening” of Env which exposes highly conserved epitopes recognized by non-neutralizing antibodies (nnAbs) capable of mediating antibody-dependent cellular cytotoxicity (ADCC). Env cleavage decreases its conformational transitions favoring the adoption of the “closed” conformation. Here we altered the gp160 furin cleavage site to impair Env cleavage and to examine its impact on ADCC responses mediated by plasma from HIV-1-infected individuals. We found that infected primary CD4+ T cells expressing uncleaved, but not wildtype, Env are efficiently recognized by nnAbs and become highly susceptible to ADCC responses mediated by plasma from HIV-1-infected individuals. Thus, HIV-1 limits the exposure of uncleaved Env at the surface of HIV-1-infected cells at least in part to escape ADCC responses.</p>",2021-10-26
98,10.1101/2021.10.26.466002,6,bioRxiv,Genomics,True,Whole-genome sequencing of Vero E6 (C1008) and comparative analysis of four Vero cell sublines,"[{'name': 'Kazuhiro Konishi'}, {'name': 'Toshiyuki Yamaji'}, {'name': 'Chisato Sakuma'}, {'name': 'Fumio Kasai'}, {'name': 'Toshinori Endo'}, {'name': 'Arihiro Kohara'}, {'name': 'Kentaro Hanada'}, {'name': 'Naoki Osada'}]","<p>The Vero cell line is an immortalized cell line established from kidney epithelial cells of the African green monkey. A variety of sublines have been established from the original cell line, which display different characteristics. In this study, we determined the whole-genome sequence of Vero E6 (C1008) and performed comparative analysis among Vero JCRB 0111, Vero CCL-81, Vero 76 and Vero E6. Analysis of the copy number changes and loss of heterozygosity revealed that all sublines share a large deletion and loss of heterozygosity on chromosome 12, which harbors type I interferon and CDKN2 gene clusters. We identified a substantial number of genetic differences among the sublines including single nucleotide variants, indels, and copy number variations. The spectrum of single nucleotide variants indicated a close genetic relationship between Vero JCRB0111 and Vero CCL-81, and between Vero 76 and Vero E6, and a considerable genetic gap between the former two and the latter two lines. In contrast, we confirmed the pattern of genomic integration sites of simian endogenous retroviral sequences, which was consistent among the sublines. We identified subline-specific/enriched loss of function and missense variants, which potentially contribute to the differences in response to viral infection among the Vero sublines. In particular, we focused on Vero E6-specific/enriched variants and identified four genes (IL1RAP, TRIM25, RB1CC1, and ATG2A) that contained missense variants specific or enriched in Vero E6. In addition, we found that V739I variants of ACE2, which functions as the receptor for SARS-CoV-2, were heterozygous in Vero JCRB0111, Vero CCL-81, and Vero 76; however, Vero E6 contained the allele with isoleucine, resulting from the loss of one of the X chromosomes.</p>",2021-10-29
99,10.1101/2021.10.27.465996,6,bioRxiv,Immunology,True,Camel nanobodies broadly neutralize SARS-CoV-2 variants,"[{'name': 'Jessica Hong'}, {'name': 'Hyung Joon Kwon'}, {'name': 'Raul Cachau'}, {'name': 'Catherine Z Chen'}, {'name': 'Kevin John Butay'}, {'name': 'Zhijian Duan'}, {'name': 'Dan Li'}, {'name': 'Hua Ren'}, {'name': 'Tianyuzhou Liang'}, {'name': 'Jianghai Zhu'}, {'name': 'Venkata P Dandey'}, {'name': 'Negin P. Martin'}, {'name': 'Dominic Esposito'}, {'name': 'Uriel Ortega-Rodriguez'}, {'name': 'Miao Xu'}, {'name': 'Mario J. Borgnia'}, {'name': 'Hang Xie'}, {'name': 'Mitchell Ho'}]","<p>With the emergence of SARS-CoV-2 variants, there is urgent need to develop broadly neutralizing antibodies. Here, we isolate two VHH nanobodies (7A3 and 8A2) from dromedary camels by phage display, which have high affinity for the receptor-binding domain (RBD) and broad neutralization activities against SARS-CoV-2 and its emerging variants. Cryo-EM complex structures reveal that 8A2 binds the RBD in its up mode and 7A3 inhibits receptor binding by uniquely targeting a highly conserved and deeply buried site in the spike regardless of the RBD conformational state. 7A3 at a dose of ≥5 mg/kg efficiently protects K18-hACE2 transgenic mice from the lethal challenge of B.1.351 or B.1.617.2, suggesting that the nanobody has promising therapeutic potentials to curb the COVID-19 surge with emerging SARS-CoV-2 variants.</p>",2021-10-29
100,10.1101/2021.10.27.466067,6,bioRxiv,Pharmacology and Toxicology,True,Novel pectin from crude polysaccharide of Syzygium aromaticum against SARS-CoV-2 activities by targeting 3CLpro,"[{'name': 'Can Jin'}, {'name': 'Bo Feng'}, {'name': 'Rong juan Pei'}, {'name': 'Ya qi Ding'}, {'name': 'Mei xia Li'}, {'name': 'Xia Chen'}, {'name': 'Zhen yun Du'}, {'name': 'Yang xiao Ding'}, {'name': 'Chun fan Huang'}, {'name': 'Bo Zhang'}, {'name': 'Xin wen Chen'}, {'name': 'Yi Zang'}, {'name': 'Jia Li'}, {'name': 'Kan Ding'}]","<p>To date, COVID-19 is still a severe threat to public health, hence specific effective therapeutic drugs development against SARS-CoV-2 is urgent needed. 3CLpro and PLpro and RdRp are the enzymes required for the SARS-CoV-2 RNA synthesis. Therefore, binding to the enzyme may interfere the enzyme function. Before, we found that sulfated polysaccharide binding to 3CLpro might block the virus replication. Hence, we hypothesize that negative charged pectin glycan may also impede the virus replication. Here we show that 922 crude polysaccharide from Syzygium aromaticum may near completely block SARS-CoV-2 replication. The inhibition rate was 99.9% (EC50 : 0.90 muM). Interestingly, 922 can associates with 3CLpro, PLpro and RdRp. We further show that the homogeneous glycan 922211 from 922 may specifically attenuate 3CL protease activity. The IC50s of 922 and 922211 against 3CLpro are 4.73 plusmn 1.05 muM and 0.18 plusmn 0.01 muM, respectively. Monosaccharide composition analysis reveals that 922211 with molecular weight of 78.7 kDa is composed of rhamnose, galacturonic acid, galactose and arabinose in the molar ratio of 8.21 : 37.81 : 3.58 : 4.49. The structure characterization demonstrated that 922211 is a homogalacturonan linked to RG-I pectin polysaccharide. The linear homogalacturonan part in the backbone may be partly methyl esterified while RG-I type part bearing 1, 4-linked alpha-GalpA, 1, 4-linked alpha-GalpAOMe and 1, 2, 4-linked alpha-Rhap. There are four branches attached to C-1 or C4 position of Rhamnose glycosyl residues on the backbone. The branches are composed of 1, 3-linked beta-Galp, terminal (T)-linked beta-Galp, 1, 5-linked alpha-Araf, T-linked alpha-Araf, 4-linked alpha-GalpA and/or 4-linked beta-GalpA. The above results suggest that 922 and 922211 might be a potential novel leading compound for anti-SARS-CoV-2 new drug development.</p>",2021-10-29
101,10.1101/2021.10.27.466118,6,bioRxiv,Ecology,False,How far to build it before they come? Analyzing the use of the Field of Dreams hypothesis to bull kelp restoration,"[{'name': 'Jorge Arroyo-Esquivel'}, {'name': 'Marissa L. Baskett'}, {'name': 'Meredith McPherson'}, {'name': 'Alan Hastings'}]","<p>In restoration ecology, the Field of Dreams Hypothesis posits that restoration efforts that create a suitable environment could lead to eventual recovery of the remaining aspects of the ecosystem through natural processes. Natural processes following partial restoration has lead to ecosystem recovery in both terrestrial and aquatic systems. However, understanding the efficacy of a “field of dreams” approach requires comparison of different approaches to partial restoration in terms of spatial, temporal, and ecological scale to what would happen with more comprehensive restoration efforts. We explore the relative effect of partial restoration and ongoing recovery on restoration efficacy with a dynamical model based on temperate rocky reefs in Northern California. We analyze our model for both the ability and rate of bull kelp forest recovery under different restoration strategies. We compare the efficacy of a partial restoration approach with a more comprehensive restoration effort by exploring how kelp recovery likelihood and rate change with varying intensities of urchin removal and kelp outplanting over different time periods and spatial scales. We find that, for the case of bull kelp forests, setting more favorable initial conditions for kelp recovery through implementing both urchin harvesting and kelp outplanting at the start of the restoration project has a bigger impact on the kelp recovery rate than applying restoration efforts through a longer period of time. Therefore partial restoration efforts, in terms of spatial and temporal scale, can be significantly more effective when applied across multiple ecological scales in terms of both the capacity and rate of achieving the target outcomes.</p><sec><title>Open Research Statement</title><p>The data used in this work is presented in McPherson et al. (2021). The code used to run the simulations can be found in <ext-link xmlns:xlink=""http://www.w3.org/1999/xlink"" ext-link-type=""uri"" xlink:href=""https://github.com/jarroyoe/kelp-restoration-modeling"">https://github.com/jarroyoe/kelp-restoration-modeling</ext-link></p></sec>",2021-10-28
102,10.1101/2021.10.26.466019,6,bioRxiv,Biophysics,True,Analyzing SARS CoV-2 Patient Data Using Quantum Supervised Machine Learning,[{'name': 'Zara Yu'}],"<p>The novel coronavirus disease 2019 (COVID-19) has created a serious threat to global health. We developed a new quantum machine learning (QML) assisted diagnostic method that can provide an accurate diagnosis to aid decision processes of medical providers. One of the key elements in our method was to implement the quantum variational method to efficiently classify data, taking crucial multiple correlations among the features into account. We established and fine-tuned this quantum classifier by using a group of data drawn from publicly available COVID-19 cases. We have shown that QML is capable of processing patient information efficiently and accurately for the diagnosis of COVID-19.</p>",2021-10-29
