,doi,tweets,archive,subject-area,covid,title,authors,abstract,posted
47,10.1101/2021.06.29.450337,9,bioRxiv,Genetics,False,A quantitative trait variant in Gabra2 underlies increased methamphetamine stimulant sensitivity,"[{'name': 'Lisa R. Goldberg'}, {'name': 'Emily J. Yao'}, {'name': 'Julia C. Kelliher'}, {'name': 'Eric R. Reed'}, {'name': 'Jiayi Wu Cox'}, {'name': 'Cory Parks'}, {'name': 'Stacey L. Kirkpatrick'}, {'name': 'Jacob A. Beierle'}, {'name': 'Melanie M. Chen'}, {'name': 'William E. Johnson'}, {'name': 'Gregg E. Homanics'}, {'name': 'Robert W. Williams'}, {'name': 'Camron D. Bryant'}, {'name': 'Megan K. Mulligan'}]","<p>Psychostimulant (methamphetamine, cocaine) use disorders have a genetic component that remains mostly unknown. Here, we conducted genome-wide quantitative trait locus (QTL) analysis of methamphetamine stimulant sensitivity. To facilitate gene identification, we employed a Reduced Complexity Cross between closely related C57BL/6 mouse substrains and examined maximum speed and distance traveled over 30 min following methamphetamine (2 mg/kg, i.p.). For maximum methamphetamine-induced speed following the second and third administration, we identified a single genome-wide significant QTL on chromosome 11 that peaked near the <italic>Cyfip2</italic> locus [LOD = 3.5, 4.2; peak = 21 cM (36 Mb)]. For methamphetamine-induced distance traveled, we identified a single genome-wide significant QTL on chromosome 5 that peaked near a functional intronic indel in <italic>Gabra2</italic> that codes for the alpha-2 subunit of the GABA-A receptor [LOD = 5.2; peak = 35 cM (67 Mb)]. Striatal <italic>cis</italic>-expression QTL mapping corroborated <italic>Gabra2</italic> as a functional candidate gene underlying methamphetamine-induced distance traveled. CRISPR/Cas9-mediated correction of the mutant intronic deletion on the C57BL/6J background to the wild-type C57BL/6NJ allele was sufficient to reduce methamphetamine-induced locomotor activity toward the wild-type C57BL/6NJ-like level, thus validating the quantitative trait variant (QTV). These studies demonstrate the power and efficiency of Reduced Complexity Crosses in identifying causal genes and variants underlying complex traits. Functionally restoring <italic>Gabra2</italic> expression decreased methamphetamine stimulant sensitivity and supports preclinical and human genetic studies implicating the GABA-A receptor in psychostimulant addiction-relevant traits. Importantly, our findings have major implications for investigators studying psychostimulants in the C57BL/6J strain - the gold standard strain in biomedical research.</p>",2021-06-30
48,10.1101/2021.06.30.450566,9,bioRxiv,Microbiology,False,Short homology-directed repair using optimized Cas9 in the pathogen Cryptococcus neoformans  enables rapid gene deletion and tagging,"[{'name': 'Manning Y. Huang'}, {'name': 'Meenakshi B. Joshi'}, {'name': 'Michael J Boucher'}, {'name': 'Sujin Lee'}, {'name': 'Liza C. Loza'}, {'name': 'Elizabeth A. Gaylord'}, {'name': 'Tamara L Doering'}, {'name': 'Hiten D. Madhani'}]","<p><italic>Cryptococcus neoformans</italic>, the most common cause of fungal meningitis, is a basidiomycete haploid budding yeast with a complete sexual cycle. Genome modification by homologous recombination is feasible using biolistic transformation and long homology arms, but the method is arduous and unreliable. Recently, multiple groups have reported the use of CRISPR-Cas9 as an alternative to biolistics, but long homology arms are still necessary, limiting the utility of this method. Since the <italic>S. pyogenes</italic> Cas9 derivatives used in prior studies were not optimized for expression in <italic>C. neoformans</italic>, we designed, synthesized, and tested a fully <italic>C. neoformans</italic>-optimized Cas9. We found that a Cas9 harboring only common <italic>C. neoformans</italic> codons and a consensus <italic>C. neoformans</italic> intron together with a <italic>TEF1</italic> promoter and terminator and a nuclear localization signal (<italic>C. neoformans</italic>-optimized <italic>CAS9</italic> or '<italic>CnoCAS9</italic>') reliably enabled genome editing in the widely-used KN99α <italic>C. neoformans</italic> strain. Furthermore, editing was accomplished using donors harboring short (50 bp) homology arms attached to marker DNAs produced with synthetic oligonucleotides and PCR amplification. We also demonstrated that prior stable integration of <italic>CnoCAS9</italic> further enhances both transformation and homologous recombination efficiency; importantly, this manipulation does not impact virulence in animals. We also implemented a universal tagging module harboring a codon-optimized fluorescent protein (mNeonGreen) and a tandem Calmodulin Binding Peptide-2X FLAG Tag that allows for both localization and purification studies of proteins for which the corresponding genes are modified by short homology-directed recombination. These tools enable short-homology genome engineering in <italic>C. neoformans</italic>.</p>",2021-06-30
49,10.1101/2021.07.01.450689,9,bioRxiv,Ecology,False,"Combining taxonomic, phylogenetic and functional diversity reveals new global priority areas for tetrapod conservation","[{'name': 'Enrico Tordoni'}, {'name': 'Aurèle Toussaint'}, {'name': 'Meelis Pärtel'}, {'name': 'David Nogues-Bravo'}, {'name': 'Carlos Perez Carmona'}]","<p>We are in the midst of a sixth mass extinction but little is known about the global patterns of biodiversity when accounting for taxonomic, phylogenetic and functional information. Here, we present the first integrated analysis of global variation in taxonomic, functional diversity and phylogenetic diversity of more than 17,000 tetrapod species (terrestrial mammals, amphibians, reptiles and birds). We used a new metric (z-Diversity) able to synthetize taxonomic, functional and phylogenetic information across different sets of species to provide a comprehensive estimation of biodiversity. Our analyses reveal that hotspots of tetrapod diversity are clustered in specific regions of the world such as central Africa and the Indian peninsula, and that climate stability and energy availability have an overarching importance in explaining tetrapod spatial patterns. Future research might take advantage of these methods to perform an informed prioritization of protected areas.</p>",2021-07-02
50,10.1101/2021.06.27.450062,9,bioRxiv,Plant Biology,False,Herbivore feeding behavior validates optimal defense theory for specialized metabolites within plants,"[{'name': 'Pascal Hunziker'}, {'name': 'Sophie Konstanze Lambertz'}, {'name': 'Konrad Weber'}, {'name': 'Christoph Crocoll'}, {'name': 'Barbara Ann Halkier'}, {'name': 'Alexander Schulz'}]","<p>Numerous plants protect themselves from attackers using specialized metabolites. The biosynthesis of these deterrent, often toxic metabolites is costly, as their synthesis diverts energy and resources on account of growth and development. How plants diversify investments into growth and defense is explained by the optimal defense theory. The central prediction of the optimal defense theory is that plants maximize growth and defense by concentrating specialized metabolites in tissues that are decisive for fitness. To date, supporting physiological evidence merely relies on the correlation between plant metabolite distribution and animal feeding preference. Here, we use glucosinolates as a model to examine the effect of changes in chemical defense distribution on actual feeding behavior. Taking advantage of the uniform glucosinolate distribution in transporter mutants, we show that high glucosinolate accumulation in tissues important to fitness protects them by guiding larvae of a generalist herbivore to feed on other tissues. Moreover, we show that mature leaves of <italic>Arabidopsis thaliana</italic> supply young leaves with glucosinolates to optimize defense against herbivores. Our study provides physiological evidence for the central hypothesis of the optimal defense theory and sheds light on the importance of integrating glucosinolate biosynthesis and transport for optimizing plant defense.</p>",2021-06-28
51,10.1101/2021.06.30.450574,8,bioRxiv,Neuroscience,False,Rapid synaptic plasticity contributes to a learned conjunctive code of position and choice-related information in the hippocampus,"[{'name': 'Xinyu Zhao'}, {'name': 'Ching-Lung Hsu'}, {'name': 'Nelson Spruston'}]","<p>To successfully perform goal-directed navigation, animals must know where they are and what they are doing—e.g., looking for water, bringing food back to the nest, or escaping from a predator. Hippocampal neurons code for these critical variables conjunctively, but little is known about how this where/what code is formed or flexibly routed to other brain regions. To address these questions, we performed intracellular whole-cell recordings in mouse CA1 during a cued, two-choice virtual navigation task. We demonstrate that plateau potentials in CA1 pyramidal neurons rapidly strengthen synaptic inputs carrying conjunctive information about position and choice. Plasticity-induced response fields were modulated by cues only in animals previously trained to collect rewards based on these cues. Thus, we reveal that gradual learning is required for the formation of a conjunctive population code, upstream of CA1, while plateau-potential-induced synaptic plasticity in CA1 enables flexible routing of the code to downstream brain regions.</p>",2021-06-30
52,10.1101/2021.06.30.450544,8,bioRxiv,Microbiology,False,The MpsB protein contributes to both the toxicity and immune evasion capacity of Staphylococcus aureus,"[{'name': 'Edward J.A. Douglas'}, {'name': 'Seána Duggan'}, {'name': 'Tarcisio Brignoli'}, {'name': 'Ruth C. Massey'}]","<p>Understanding the role specific bacterial factors play in the development of severe disease in humans is critical if new approaches to tackle such infections are to be developed. In this study we focus on genes we have found to be associated with patient outcome following bacteraemia caused by the major human pathogen <italic>Staphylococcus aureus</italic>. By examining the contribution these genes make to the ability of the bacteria to survive exposure to the antibacterial factors found in serum, we identify three novel serum resistance associated genes, <italic>mdeA, mpsB</italic> and <italic>yycH</italic>. Detailed analysis of an MpsB mutant supports its previous association with the slow growing SCV phenotype of <italic>S. aureus</italic>, and we demonstrate that the effect this mutation has on membrane potential prevents the activation of the Agr quorum sensing system, and as a consequence the mutant bacteria do not produce cytolytic toxins. Given the importance of both toxin production and immune evasion to the ability of <italic>S. aureus</italic> to cause disease, we believe these findings explain the role of the <italic>mpsB</italic> gene as a mortality-associate locus during human disease.</p>",2021-06-30
53,10.1101/2021.06.28.450088,7,bioRxiv,Cancer Biology,False,A novel small molecule that induces cytotoxicity in lung cancer cells inhibits disulfide reductases GSR and TXNRD1,"[{'name': 'Fraser D. Johnson'}, {'name': 'John Ferrarone'}, {'name': 'Alvin Liu'}, {'name': 'Christina Brandstädter'}, {'name': 'Ravi Munuganti'}, {'name': 'Dylan Farnsworth'}, {'name': 'Daniel Lu'}, {'name': 'Jennifer Luu'}, {'name': 'Tianna Sihota'}, {'name': 'Sophie Jansen'}, {'name': 'Amy Nagelberg'}, {'name': 'Rocky Shi'}, {'name': 'Giovanni C. Forcina'}, {'name': 'Xu Zhang'}, {'name': 'Grace S. W. Cheng'}, {'name': 'Sandra E. Spencer Miko'}, {'name': 'Georgia de Rappard-Yuswack'}, {'name': 'Poul H. Sorensen'}, {'name': 'Scott J. Dixon'}, {'name': 'Udayan Guha'}, {'name': 'Katja Becker'}, {'name': 'Hakim Djaballah'}, {'name': 'Romel Somwar'}, {'name': 'Harold Varmus'}, {'name': 'Gregg B. Morin'}, {'name': 'William W. Lockwood'}]","<p>High-throughput phenotype-based screening of large libraries of novel compounds without known targets can identify small molecules that elicit a desired cellular response, but additional approaches are required to find and characterize their targets and mechanisms of action. Here we show that a compound termed lung cancer screen 3 (LCS3), previously selected for its ability to impair the growth of human lung adenocarcinoma (LUAD) cell lines, but not normal lung cells, induces oxidative stress and activates the NRF2 signaling pathway by generating reactive oxygen species (ROS) in sensitive LUAD cell lines. To identify the target that mediates this effect, we applied thermal proteome profiling (TPP) and uncovered the disulfide reductases GSR and TXNRD1 as LCS3 targets. Through enzymatic assays using purified protein, we confirmed that LCS3 inhibits disulfide reductase activity through a reversible, uncompetitive mechanism. Further, we demonstrate that LCS3-sensitive LUAD cells are correspondingly sensitive to the synergistic inhibition of glutathione and thioredoxin pathways. Lastly, a genome-wide CRISPR knockout screen identified the loss of NQO1 as a mechanism of LCS3 resistance. This work highlights the ability of TPP to uncover targets of small molecules identified by high-throughput screens and demonstrates the potential utility of inhibiting disulfide reductases as a therapeutic strategy for LUAD.</p>",2021-06-28
54,10.1101/2021.06.30.450493,7,bioRxiv,Bioinformatics,False,Improved estimation of cell type-specific gene expression through deconvolution of bulk tissues with matrix completion,"[{'name': 'Weixu Wang'}, {'name': 'Jun Yao'}, {'name': 'Yi Wang'}, {'name': 'Chao Zhang'}, {'name': 'Wei Tao'}, {'name': 'Jiahua Zou'}, {'name': 'Ting Ni'}]","<p>Cell type-specific gene expression (CSE) brings novel biological insights into both physiological and pathological processes compared with bulk tissue gene expression. Although fluorescence-activated cell sorting (FACS) and single-cell RNA sequencing (scRNA-seq) are two widely used techniques to detect gene expression in a cell type-specific manner, the constraints of cost and labor force make it impractical as a routine on large patient cohorts. Here, we present ENIGMA, an algorithm that deconvolutes bulk RNA-seq into cell type-specific expression matrices and cell type fraction matrices without the need of physical sorting or sequencing of single cells. ENIGMA used cell type signature matrix generated from either FACS RNA-seq or scRNA-seq as reference, and applied matrix completion technique to achieve fast and accurate deconvolution. We demonstrated the superior performance of ENIGMA to previously published algorithms (TCA, bMIND and CIBERSORTx) while requiring much less running time on both simulated and realistic datasets. To prove its value in biological discovery, we applied ENIGMA to bulk RNA-seq from arthritis patients and revealed a pseudo-differentiation trajectory that could reflect monocyte to macrophage transition. We also applied ENIGMA to bulk RNA-seq data of pancreatic islet tissue from type 2 diabetes (T2D) patients and discovered a beta cell-specific gene co-expression module related to senescence and apoptosis that possibly contributed to the pathogenesis of T2D. Together, ENIGMA provides a new framework to improve the CSE estimation by integrating FACS RNA-seq and scRNA-seq with tissue bulk RNA-seq data, and will extend our understandings about cell heterogeneity on population level with no need for experimental tissue disaggregation.</p>",2021-07-01
55,10.1101/2021.07.01.450681,7,bioRxiv,Bioinformatics,False,"Knowledge-based antibody repertoire simulation, a novel allele detection tool evaluation and application","[{'name': 'Xiujia Yang'}, {'name': 'Yan Zhu'}, {'name': 'Huikun Zeng'}, {'name': 'Sen Chen'}, {'name': 'Junjie Guan'}, {'name': 'Qi-Long Wang'}, {'name': 'Chunhong Lan'}, {'name': 'Deqiang Sun'}, {'name': 'Xueqing Yu'}, {'name': 'Zhenhai Zhang'}]","<p>Detailed knowledge of the diverse immunoglobulin germline genes is critical for the study of humoral immunity. Hundreds of alleles have been discovered by analyzing antibody repertoire sequencing (Rep-seq or Ig-seq) data via multiple novel allele detection tools (NADTs). However, the performance of these NADTs through antibody sequences with intrinsic somatic hypermutations (SHMs) is unclear. Here, we developed a tool to simulate repertoires by integrating the full spectrum features of an antibody repertoire such as germline gene usage, junctional modification, position-specific SHM and clonal expansion based on 2152 high-quality datasets. We then systematically evaluated these NADTs using both simulated and genuine Ig-seq datasets. Finally, we applied these NADTs to 687 Ig-seq datasets and identified 43 novel alleles using defined criteria. Twenty-five alleles were validated through findings of other sources. In addition to the novel alleles detected, our simulation tool, the results of our comparison, and the streamline of this process may benefit further humoral immunity studies via Ig-seq.</p>",2021-07-02
56,10.1101/2021.06.29.450466,7,bioRxiv,Evolutionary Biology,False,Protracted speciation under the state-dependent speciation and extinction approach,"[{'name': 'Xia Hua'}, {'name': 'Tyara Herdha'}, {'name': 'Conrad Burden'}]","<p>How long does speciation take? What are the speciation processes that generated a species group? The answers to these important questions in evolutionary biology lie in the genetic difference not only among species, but also among lineages within each species. With the advance of genome sequencing in non-model organisms and the statistical tools to improve accuracy in inferring evolutionary histories among recently diverged lineages, we now have the lineage-level trees to answer these questions. However, we do not yet have an analytical tool for inferring speciation processes from these trees. What is needed is a model of speciation processes that generates both the trees and species identities of extant lineages. The model should allow calculation of the probability that certain lineages belong to certain species and have an evolutionary history consistent with the tree. Here we propose such a model and test the model performance on both simulated data and real data. We show that maximum likelihood estimates of the model are highly accurate and give estimates from real data that generate patterns consistent with observations. We discuss how to extend the model to account for different rates and types of speciation processes across lineages in a species group. By linking evolutionary processes on lineage level to species level, the model provides a new phylogenetic approach to study not just when speciation happened, but how speciation happened.</p>",2021-07-01
57,10.1101/2021.06.29.450285,6,bioRxiv,Immunology,False,"Clonally expanded virus-specific CD8 T cells acquire diverse transcriptional phenotypes during acute, chronic, and latent infections","[{'name': 'Raphael Kuhn'}, {'name': 'Ioana Sandu'}, {'name': 'Andreas Agrafiotis'}, {'name': 'Kai-Lin Huang'}, {'name': 'Daniel Neumeier'}, {'name': 'Doron Merkler'}, {'name': 'Annette Oxenius'}, {'name': 'Sai T. Reddy'}, {'name': 'Alexander Yermanos'}]","<p>CD8+ T cells play a crucial role in the control and resolution of viral infections and can adopt a wide range of phenotypes and effector functions depending on the inflammatory context and the duration and extent of antigen exposure. Similarly, viral infections can exert diverse selective pressures on populations of clonally related T cells. Technical limitations have nevertheless made it challenging to investigate the relationship between clonal selection and transcriptional phenotypes of virus-specific T cells. We therefore performed single-cell T cell receptor (TCR) repertoire and transcriptome sequencing of virus-specific CD8 T cells in murine models of acute, chronic and latent infection. We observed clear infection-specific populations corresponding to memory, effector, exhausted, and inflationary phenotypes. We further uncovered a mouse-specific and polyclonal T cell response, despite all T cells sharing specificity to a single viral epitope, which was accompanied by stereotypic TCR germline gene usage in all three infection types. Persistent antigen exposure during chronic and latent viral infections resulted in a higher proportion of clonally expanded T cells relative to acute infection. We furthermore observed a relationship between transcriptional heterogeneity and clonal expansion for all three infections, with highly expanded clones having distinct transcriptional phenotypes relative to lowly expanded clones. Finally, we developed and utilized a bioinformatic pipeline integrating pseudotime and clonality, termed Clonotyme, to further support a model in which expanded virus-specific CD8+ T cells adopt heterogenic, yet preferentially, effector-like phenotypes. Together our work relates clonal selection to gene expression in the context of viral infection and further provides a dataset and accompanying software for the immunological community.</p>",2021-06-30
58,10.1101/2021.06.30.450460,6,bioRxiv,Microbiology,False,Antimicrobial activity of a repurposed harmine-derived compound on extensively drug-resistant Acinetobacter baumannii clinical isolates,"[{'name': 'Anke Breine'}, {'name': 'Mégane Van Gysel'}, {'name': 'Mathias Elsocht'}, {'name': 'Clémence Whiteway'}, {'name': 'Chantal Philippe'}, {'name': 'Théo Quinet'}, {'name': 'Adam Valcek'}, {'name': 'Johan Wouters'}, {'name': 'Steven Ballet'}, {'name': 'Charles Van der Henst'}]","<sec><title>Objectives</title><p>The spread of antibiotic resistant bacteria is an important threat for human healthcare. <italic>Acinetobacter baumannii</italic> bacteria impose one of the major issues, as multidrug- to pandrug-resistant strains have been found, rendering some infections untreatable. In addition, <italic>A. baumannii</italic> is a champion in surviving in harsh environments, being capable of resisting to disinfectants and to persist prolonged periods of desiccation. Due to the high degree of variability found in <italic>A. baumannii</italic> isolates, the search for new antibacterials is challenging. Here, we screened a compound library to identify compounds active against recent isolates of <italic>A. baumannii</italic> bacteria.</p></sec><sec><title>Methods</title><p>A repurposing drug screen was undertaken to identify <italic>A. baumannii</italic> growth inhibitors. One hit was further characterized by determining its IC<sub>50</sub> and testing its activity on 43 recent clinical <italic>A. baumannii</italic> isolates, amongst which 40 are extensively drug- and carbapenem-resistant strains.</p></sec><sec><title>Results</title><p>The repurposing screen led to the identification of a harmine-derived compound, called HDC1, which proved to have bactericidal activity on the multidrug-resistant AB5075-VUB reference strain with an IC<sub>50</sub> of 48.23 µM. In addition, HDC1 impairs growth of all 43 recent clinical <italic>A. baumannii</italic> isolates.</p></sec><sec><title>Conclusions</title><p>We identified a compound with inhibitory activity on all tested, extensively drug-resistant clinical <italic>A. baumannii</italic> isolates.</p></sec>",2021-06-30
59,10.1101/2021.06.30.450414,6,bioRxiv,Genomics,False,Probing molecular specificity with deep sequencing and biophysically interpretable machine learning,"[{'name': 'H. Tomas Rube'}, {'name': 'Chaitanya Rastogi'}, {'name': 'Siqian Feng'}, {'name': 'Judith F. Kribelbauer'}, {'name': 'Allyson Li'}, {'name': 'Basheer Becerra'}, {'name': 'Lucas A. N. Melo'}, {'name': 'Bach Viet Do'}, {'name': 'Xiaoting Li'}, {'name': 'Hammaad H. Adam'}, {'name': 'Neel H. Shah'}, {'name': 'Richard S. Mann'}, {'name': 'Harmen J. Bussemaker'}]","<p>Quantifying sequence-specific protein-ligand interactions is critical for understanding and exploiting numerous cellular processes, including gene regulation and signal transduction. Next-generation sequencing (NGS) based assays are increasingly being used to profile these interactions with high-throughput. However, these assays do not provide the biophysical parameters that have long been used to uncover the quantitative rules underlying sequence recognition. We developed a highly flexible machine learning framework, called ProBound, to define sequence recognition in terms of biophysical parameters based on NGS data. ProBound quantifies transcription factor (TF) behavior with models that accurately predict binding affinity over a range exceeding that of previous resources, captures the impact of DNA modifications and conformational flexibility of multi-TF complexes, and infers specificity directly from <italic>in vivo</italic> data such as ChIP-seq without peak calling. When coupled with a new assay called Kd-seq, it determines the absolute affinity of protein-ligand interactions. It can also profile the kinetics of kinase-substrate interactions. By constructing a biophysically robust foundation for profiling sequence recognition, ProBound opens up new avenues for decoding biological networks and rationally engineering protein-ligand interactions.</p>",2021-07-01
