,doi,tweets,archive,subject-area,covid,title,authors,abstract,posted
40,10.1101/2021.05.11.443570,28,bioRxiv,Genomics,False,Convergent loss of chemoreceptors across independent origins of slave-making in ants,"[{'name': 'Evelien Jongepier'}, {'name': 'Alice Séguret'}, {'name': 'Anton Labutin'}, {'name': 'Barbara Feldmeyer'}, {'name': 'Claudia Gstöttl'}, {'name': 'Susanne Foitzik'}, {'name': 'Jürgen Heinze'}, {'name': 'Erich Bornberg-Bauer'}]","<p>The evolution of an obligate parasitic lifestyle often leads to the reduction of morphological and physiological traits, which may be accompanied by loss of genes and functions. Slave-maker ants are social parasites that exploit the work force of closely related ant species for social behaviours such as brood care and foraging. Recent divergence between these social parasites and their hosts enables comparative studies of gene family evolution. We sequenced the genomes of eight ant species, representing three independent origins of ant slavery. During the evolution of eusociality, chemoreceptor genes multiplied due to the importance of chemical communication in societies. We investigated evolutionary patterns of chemoreceptors in relation to slave-making in ants. We found that slave-maker ant genomes harboured only half as many gustatory receptors as their hosts, potentially mirroring the outsourcing of foraging tasks to host workers. In addition, parasites had fewer odorant receptors and their loss shows patterns of convergence across origins of parasitism, representing a rare case of convergent molecular evolution. This convergent loss of specific odorant receptors suggests that selective deprivation of receptors is adaptive. The 9-exon odorant receptor subfamily, previously linked to social evolution in insects, was significantly enriched for convergent loss across the three origins of slavery in our study, indicating that the transition to social parasitism in ants is accompanied by the loss of receptors that are likely important for mediating eusocial behaviour. Overall, gene loss in slave-maker ants suggests that a switch to a parasitic lifestyle accompanies relaxed selection on chemical perception.</p>",2021-05-11
41,10.1101/2021.05.12.443814,26,bioRxiv,Genomics,False,One Cell At a Time: A Unified Framework to Integrate and Analyze Single-cell RNA-seq Data,"[{'name': 'Chloe Wang'}, {'name': 'Lin Zhang'}, {'name': 'Bo Wang'}]","<label>1</label><title>Abstract</title><p>The surge of single-cell RNA sequencing technologies enables the accessibility to large single-cell RNA-seq datasets at the scale of hundreds of thousands of single cells. Integrative analysis of large-scale scRNA-seq datasets has the potential of revealing <italic>de novo</italic> cell types as well as aggregating biological information. However, most existing methods fail to integrate multiple large-scale scRNA-seq datasets in a computational and memory efficient way. We hereby propose OCAT, <bold>O</bold>ne <bold>C</bold>ell <bold>A</bold>t a <bold>T</bold>ime, a graph-based method that sparsely encodes single-cell gene expressions to integrate data from multiple sources without most variable gene selection or explicit batch effect correction. We demonstrate that OCAT efficiently integrates multiple scRNA-seq datasets and achieves the state-of-the-art performance in cell-type clustering, especially in challenging scenarios of non-overlapping cell types. In addition, OCAT facilitates a variety of downstream analyses, such as gene prioritization, trajectory inference, pseudotime inference and cell inference. OCAT is a unifying tool to simplify and expedite single-cell data analysis.</p>",2021-05-13
42,10.1101/2021.05.11.443555,26,bioRxiv,Biochemistry,True,Mechanism of molnupiravir-induced SARS-CoV-2 mutagenesis,"[{'name': 'Florian Kabinger'}, {'name': 'Carina Stiller'}, {'name': 'Jana Schmitzová'}, {'name': 'Christian Dienemann'}, {'name': 'Hauke S. Hillen'}, {'name': 'Claudia Höbartner'}, {'name': 'Patrick Cramer'}]","<p>Molnupiravir is an orally available antiviral drug candidate that is in phase III trials for the treatment of COVID-19 patients<sup>1,2</sup>. Molnupiravir increases the frequency of viral RNA mutations<sup>3,4</sup> and impairs SARS-CoV-2 replication in animal models<sup>4-6</sup> and in patients<sup>2</sup>. Here we establish the molecular mechanisms that underlie molnupiravir-induced RNA mutagenesis by the RNA-dependent RNA polymerase (RdRp) of the coronavirus SARS-CoV-2. Biochemical assays show that the RdRp readily uses the active form of molnupiravir, β-D-N4-hydroxycytidine (NHC) triphosphate, as a substrate instead of CTP or UTP. Incorporation of NHC monophosphate into nascent RNA does not impair further RdRp progression. When the RdRp uses the resulting RNA as a template, NHC directs incorporation of either G or A, leading to mutated RNA products. Structural analysis of RdRp-RNA complexes containing mutagenesis products shows that NHC can form stable base pairs with either G or A in the RdRp active center, explaining how the polymerase escapes proofreading and synthesizes mutated RNA. This two-step mutagenesis mechanism likely applies to various viral polymerases and can explain the broad-spectrum antiviral activity of molnupiravir.</p>",2021-05-11
43,10.1101/2021.05.07.21256823,25,medRxiv,Infectious Diseases (except HIV/AIDS),True,Anti-SARS-CoV-2 Antibodies Persist for up to 13 Months and Reduce Risk of Reinfection,"[{'name': 'Floriane Gallais'}, {'name': 'Pierre Gantner'}, {'name': 'Timothée Bruel'}, {'name': 'Aurelie Velay'}, {'name': 'Delphine Planas'}, {'name': 'Marie-Josée Wendling'}, {'name': 'Sophie Bayer'}, {'name': 'Morgane Solis'}, {'name': 'Elodie Laugel'}, {'name': 'Nathalie Reix'}, {'name': 'Anne Schneider'}, {'name': 'Ludovic Glady'}, {'name': 'Baptiste Panaget'}, {'name': 'Nicolas Collongues'}, {'name': 'Marialuisa Partisani'}, {'name': 'Jean-Marc Lessinger'}, {'name': 'Arnaud Fontanet'}, {'name': 'David Rey'}, {'name': 'Yves Hansmann'}, {'name': 'Laurence Kling-Pillitteri'}, {'name': 'Olivier Schwartz'}, {'name': 'Jérome De Sèze'}, {'name': 'Nicolas Meyer'}, {'name': 'Maria Gonzalez'}, {'name': 'Catherine Schmidt-Mutter'}, {'name': 'Samira Fafi-Kremer'}]","<p>Assessment of the kinetics of SARS-CoV-2 antibodies is essential in predicting protection against reinfection and durability of vaccine protection. Here, we longitudinally measured Spike (S) and Nucleocapsid (N)-specific antibodies in 1,309 healthcare workers (HCWs), including 916 COVID-19 negative HCWs and 393 convalescent COVID-19 for up to 422 days post-symptom. From month (M)1 to M7-9 post-infection, SARS-CoV-2 antibodies decreased moderately in convalescent HCWs in a biphasic model, with men showing a slower decay of anti-N (p=0.02), and a faster decay of anti-S (p=0.0008) than women. At M11-13, anti-N dramatically decreased (half-life: 283 days) while anti-S stabilized (half-life: 725 days) at a median of 2.39 log Arbitrary Units (AU)/mL (Interquartile Range (IQR): 2.10 -2.75). Overall, 69 SARS-CoV-2 infections developed in the COVID-19 negative group (incidence of 12.22 per 100 person-years) versus one in the COVID-19 positive group (incidence of 0.40 per 100 person-years), indicating a relative reduction in the incidence of SARS-CoV-2 reinfection of 96.7% (p&lt;0.0001). Correlation with live-virus neutralization assay revealed that variants D614G and B.1.1.7, but not B.1.351, were sensitive to anti-S antibodies at 2.3 log AU/mL, while IgG ≥ 3 log AU/mL neutralized all three variants. After SARS-CoV-2 vaccination, anti-S levels were increased by &gt; 3 logs regardless of pre-vaccination IgG levels, type of vaccine, and number of doses. Our study demonstrates a long-term persistence of anti-S IgG antibodies that may protect against reinfection. By significantly increasing cross-neutralizing antibody titers, a single-dose vaccination strengthens protection against escape mutants.</p>",2021-05-14
44,10.1101/2021.05.12.443777,25,bioRxiv,Genomics,False,Single-cell epigenomic tracing of lifelong endothelial cell plasticity across mouse organs,"[{'name': 'Xianhong Yu'}, {'name': 'Yaxi Liu'}, {'name': 'Xiaoge Liu'}, {'name': 'Haiqing Xiong'}, {'name': 'Aibin He'}]","<p>Endothelial cells (ECs) across ages and tissues are highly heterogeneous in developmental origins, structures, functions, and cellular plasticity. Here, we applied CoBATCH for single-cell epigenomic tracing of dynamic EC lineage histories in five mouse organs from development to ageing. Our analyses showed that epigenomic memory reflects both developmental origins and tissue-restricted specialization of EC sublineages but with varying time lengths across organs. To gain insights into cellular plasticity of ECs, we identified bivalent chromatin occupancy of otherwise mutually exclusive EC- (ERG) and mesenchymal-specific (TWIST1/SNAI1) transcription factors promoting endothelial-to-mesenchymal transition. We further revealed that pseudotime trajectories by histone modifications H3K36me3 and H3K27ac faithfully recapitulate short- and long-range EC fate change over senescence, respectively. Together, our data provide a unique exploration of chromatin-level cell fate regulation of organotypic EC lineages across the lifespan.</p><sec><title>One-Sentence Summary</title><p>Single-cell chromatin binding is examined for tracing endothelial cell lineages in mouse organs across the lifespan.</p></sec>",2021-05-13
45,10.1101/2021.05.10.443473,25,bioRxiv,Microbiology,False,A widely distributed genus of soil Acidobacteria genomically enriched in biosynthetic gene clusters,"[{'name': 'Alexander Crits-Christoph'}, {'name': 'Spencer Diamond'}, {'name': 'Basem Al-Shayeb'}, {'name': 'Luis Valentin-Alvarado'}, {'name': 'Jillian F. Banfield'}]","<p>Bacteria of the phylum Acidobacteria are one of the most abundant bacterial across soil ecosystems, yet they are represented by comparatively few sequenced genomes, leaving gaps in our understanding of their metabolic diversity. Recently, genomes of Acidobacteria species with unusually large repertoires of biosynthetic gene clusters (BGCs) were reconstructed from grassland soil metagenomes, but the degree to which these species are widespread is still unknown. To investigate this, we augmented a dataset of publicly available Acidobacteria genomes with 46 metagenome-assembled genomes recovered from permanently saturated organic-rich soils of a vernal (spring) pool ecosystem in Northern California. We recovered high quality genomes for three novel species from <italic>Candidatus</italic> Angelobacter (a proposed subdivision 1 Acidobacterial genus), a genus that is genomically enriched in genes for specialized metabolite biosynthesis. Acidobacteria were particularly abundant in the vernal pool sediments, and a <italic>Ca</italic>. Angelobacter species was the most abundant bacterial species detected in some samples. We identified numerous diverse biosynthetic gene clusters in these genomes, and also in additional genomes from other publicly available soil metagenomes for other related <italic>Ca</italic>. Angelobacter species. Metabolic analysis indicates that <italic>Ca</italic>. Angelobacter likely are aerobes that ferment organic carbon, with potential to contribute to carbon compound turnover in soils. Using metatranscriptomics, we identified in situ expression of specialized metabolic traits for two species from this genus. In conclusion, we expand genomic sampling of the uncultivated <italic>Ca</italic>. Angelobacter, and show that they represent common and sometimes highly abundant members of dry and saturated soil communities, with a high degree of capacity for synthesis of diverse specialized metabolites.</p>",2021-05-11
46,10.1101/2021.05.12.443788,25,bioRxiv,Plant Biology,False,ABA homeostasis and long-distance translocation is redundantly regulated by ABCG ABA importers,"[{'name': 'Yuqin Zhang'}, {'name': 'Himabindu Vasuki'}, {'name': 'Jie Liu'}, {'name': 'Hamutal Bar'}, {'name': 'Shani Lazary'}, {'name': 'Aiman Egbaria'}, {'name': 'Dagmar Ripper'}, {'name': 'Laurence Charrier'}, {'name': 'Zeinu Mussa Belew'}, {'name': 'Nikolai Wulff'}, {'name': 'Hussam Hassan Nour-Eldin'}, {'name': 'Asaph Aharoni'}, {'name': 'Laura Ragni'}, {'name': 'Lucia Strader'}, {'name': 'Nir Sade'}, {'name': 'Roy Weinstain'}, {'name': 'Markus Geisler'}, {'name': 'Eilon Shani'}]","<p>The effects of abscisic acid (ABA) on plant growth, development and response to the environment depend on local ABA concentrations. Here, we exploited a genome-scale amiRNA screen, targeting the <italic>Arabidopsis</italic> transportome, to show that ABA homeostasis is regulated by two previously unknown ABA transporters. ABCG17 and ABCG18 are localized to the plasma membranes of leaf mesophyll and stem cortex cells to redundantly promote ABA import, leading to conjugated inactive ABA sinks, thus restricting stomatal closure. <italic>ABCG17</italic> and <italic>ABCG18</italic> double knockdown revealed that the transporters encoded by these genes not only limit stomatal aperture size, conductance and transpiration while increasing water-use efficiency but also control ABA translocation from the shoot to the root to regulate lateral root emergence. Under abiotic stress conditions, <italic>ABCG17</italic> and <italic>ABCG18</italic> are transcriptionally repressed, promoting active ABA movement and response. The transport mechanism mediated by ABCG17 and ABCG18 allows plants to maintain ABA homeostasis under normal growth conditions.</p>",2021-05-13
47,10.1101/2021.05.10.21256634,24,medRxiv,Infectious Diseases (except HIV/AIDS),True,Humoral immunogenicity of the seasonal influenza vaccine before and after CAR-T-cell therapy,"[{'name': 'Carla S. Walti'}, {'name': 'Andrea N. Loes'}, {'name': 'Kiel Shuey'}, {'name': 'Elizabeth M. Krantz'}, {'name': 'Jim Boonyaratanakornkit'}, {'name': 'Jacob Keane-Candib'}, {'name': 'Tillie Loeffelholz'}, {'name': 'Caitlin R. Wolf'}, {'name': 'Justin J. Taylor'}, {'name': 'Rebecca A. Gardner'}, {'name': 'Damian J. Green'}, {'name': 'Andrew J. Cowan'}, {'name': 'David G. Maloney'}, {'name': 'Cameron J. Turtle'}, {'name': 'Steven A. Pergam'}, {'name': 'Helen Y. Chu'}, {'name': 'Jesse D. Bloom'}, {'name': 'Joshua A. Hill'}]","<p>Recipients of chimeric antigen receptor-modified T (CAR-T) cell therapies for B-cell malignancies are immunocompromised and at risk for serious infections. Vaccine immunogenicity is unknown in this population. We conducted a prospective observational study of the humoral immunogenicity of 2019-2020 inactivated influenza vaccines (IIV) in children and adults immediately prior to (n=7) or 13-57 months after (n=15) CD19-, CD20-, or BCMA-targeted CAR-T-cell therapy, as well as controls (n=8). Individuals post-CAR-T-cell therapy were in remission. We tested for antibodies to 4 vaccine strains at baseline and ≥1 time point after IIV using neutralization and hemagglutination inhibition assays. An antibody response was defined as a ≥4-fold titer increase from baseline at the first post-vaccine time point. Baseline A(H1N1) titers in the CAR-T cohorts were significantly lower compared to controls. Antibody responses to ≥1 vaccine strain occurred in 2 (29%) individuals before CAR-T-cell therapy; one individual maintained a response for &gt;3 months post-CAR-T-cell therapy. Antibody responses to ≥1 vaccine strain occurred in 6 (40%) individuals vaccinated after CAR-T-cell therapy. An additional 2 (29%) and 6 (40%) individuals had ≥2-fold increases (at any time) in the pre- and post-CAR-T cohorts, respectively. There were no identified clinical or immunologic predictors of antibody responses. Neither severe hypogammaglobulinemia nor B-cell aplasia precluded antibody responses. These data support consideration for vaccination before and after CAR-T-cell therapy for influenza and other relevant pathogens such as SARS-CoV-2, irrespective of hypogammaglobulinemia or B-cell aplasia. Larger studies are needed to determine correlates of vaccine immunogenicity and durability in CAR-T-cell therapy recipients.</p><sec><title>Key Points</title><list list-type=""bullet""><list-item><p>Influenza vaccination was immunogenic pre- and post-CAR-T-cell therapy, despite hypogammaglobulinemia and B-cell aplasia.</p></list-item><list-item><p>Vaccination with inactivated vaccines can be considered before CAR-T-cell therapy and in individuals with remission after therapy.</p></list-item></list></sec>",2021-05-11
48,10.1101/2021.05.12.443923,24,bioRxiv,Plant Biology,False,Brace root phenotypes predict root lodging susceptibility and the contribution to anchorage in maize,"[{'name': 'Ashley N. Hostetler'}, {'name': 'Lindsay Erndwein'}, {'name': 'Jonathan W. Reneau'}, {'name': 'William Cantera'}, {'name': 'Adam Stager'}, {'name': 'Herbert G. Tanner'}, {'name': 'Douglas Cook'}, {'name': 'Erin E. Sparks'}]","<p>A changing global climate brings increasingly prevalent and severe storms that threaten crop production by imparting mechanical stresses. Plant failure due to mechanical stress is termed lodging and in the United States, yield loss due to lodging has been estimated at 7-25% for maize (<italic>Zea mays</italic>). In maize, the presence of specialized aerial brace roots has been shown to increase anchorage and root lodging resistance. However, beyond scoring for presence, there have been limited attempts to define the brace root phenotypes that optimize anchorage. This study reports variable root lodging and plant biomechanics in a population of 52 maize inbred lines. To quantify the variation in brace root phenotypes within this population, a semi-automated phenotyping workflow was developed. These empirical measurements were integrated into predictive random forest models to demonstrate that brace root phenotypes can classify root lodging incidence and plant biomechanics. The prediction accuracy of these models is driven by multiple brace root phenotypes suggesting that anchorage can be optimized by the manipulation of multiple functional traits. Plant height has been previously associated with lodging susceptibility yet the inclusion of plant height as a predictor does not always improve prediction accuracy. Previously, brace root node number has been shown to be genetically linked to plant height and here we show that additional brace root phenotypes are linked to plant height but with opposing effects on root lodging susceptibility. Together these data define the important brace root phenotypes that predict root lodging resistance and demonstrate the need to uncouple the linkage between plant height and root traits for the development of climate resilient crops.</p>",2021-05-13
49,10.1101/2021.05.11.443369,23,bioRxiv,Genomics,False,Integrated phospho-proteogenomic and single-cell transcriptomic analysis of meningiomas establishes robust subtyping and reveals subtype-specific immune invasion,"[{'name': 'Christina Blume'}, {'name': 'Helin Dogan'}, {'name': 'Lisa Schweizer'}, {'name': 'Matthieu Peyre'}, {'name': 'Sophia Doll'}, {'name': 'Daniel Picard'}, {'name': 'Roman Sankowski'}, {'name': 'Volker Hovestadt'}, {'name': 'Konstantin Okonechnikov'}, {'name': 'Philipp Sievers'}, {'name': 'Areeba Patel'}, {'name': 'David Reuss'}, {'name': 'Mirco Friedrich'}, {'name': 'Damian Stichel'}, {'name': 'Daniel Schrimpf'}, {'name': 'Katja Beck'}, {'name': 'Hans-Georg Wirsching'}, {'name': 'Gerhard Jungwirth'}, {'name': 'C Oliver Hanemann'}, {'name': 'Katrin Lamszus'}, {'name': 'Manfred Westphal'}, {'name': 'Nima Etminan'}, {'name': 'Andreas Unterberg'}, {'name': 'Christian Mawrin'}, {'name': 'Marc Remke'}, {'name': 'Olivier Ayrault'}, {'name': 'Peter Lichter'}, {'name': 'Stefan M Pfister'}, {'name': 'Guido Reifenberger'}, {'name': 'Michael Platten'}, {'name': 'Till Milde'}, {'name': 'David TW Jones'}, {'name': 'Rachel Grossmann'}, {'name': 'Zvi Ram'}, {'name': 'Miriam Ratliff'}, {'name': 'Christel Herold-Mende'}, {'name': 'Jan-Philipp Mallm'}, {'name': 'Marian C Neidert'}, {'name': 'Wolfgang Wick'}, {'name': 'Marco Prinz'}, {'name': 'Michael Weller'}, {'name': 'Matthias Mann'}, {'name': 'Michel Kalamarides'}, {'name': 'Andreas von Deimling'}, {'name': 'Matthias Schlesner'}, {'name': 'Felix Sahm'}]","<p>Meningiomas are the most frequent primary intracranial tumors. They can follow a wide clinical spectrum from benign to highly aggressive clinical course. No specific therapy exists for refractory cases or cases not amenable to resection and radiotherapy. Identification of risk of recurrence and malignant transformation for the individual patients is challenging. However, promising molecular markers and prognostic subgrouping by DNA methylation are emerging. Still, the biological underpinnings of these diagnostic subgroups are elusive, and, consequently, no novel therapeutic options arise thereof. Here we establish robust subgroups across the full landscape of meningiomas, consistent through DNA methylation, mutations, the transcriptomic, proteomic and phospho-proteomic level. Pronounced proliferative stress and DNA damage repair signals in malignant cells and in clusters exclusive to recurrent tumors are in line with their higher mitotic activity, but also provide an explanation for the accumulation of genomic instability in anaplastic meningiomas. Although homozygous deletion of <italic>CDKN2A/B</italic> is a diagnostic marker of high-grade meningioma, the expression of its gene product increased from low to non-deleted high-grade cases. Differences between subgroups in lymphocyte and myeloid cell infiltration, representing a majority of tumor mass in low-grade NF2 tumors, could be assigned to cluster-specific interaction with tumor cells. Activation to a more proinflammatory phenotype and decreased infiltration of myeloid cells in high-grade cases correlated with lower expression of <italic>CSF1</italic>, located on chromosome arm 1p, whose deletion is known as prognostic marker, with no proposed mechanism before. Our results demonstrate a robust molecular subclassification of a tumor type across multiple layers, provide insight into heterogeneous growth dynamics despite shared pathognomonic mutations, and highlight immune infiltration modulation as a novel target for meningioma therapy.</p>",2021-05-11
50,10.1101/2021.05.11.443328,23,bioRxiv,Neuroscience,False,Kinesin-3 mediated delivery of presynaptic neurexin stabilizes growing dendritic spines and postsynaptic components in vivo,"[{'name': 'Devyn Oliver'}, {'name': 'Shankar Ramachandran'}, {'name': 'Alison Philbrook'}, {'name': 'Christopher M. Lambert'}, {'name': 'Ken C. Q. Nguyen'}, {'name': 'David H. Hall'}, {'name': 'Michael M. Francis'}]","<p>A high degree of cell and circuit-specific regulation has complicated efforts to precisely define roles for synaptic adhesion proteins in establishing circuit connectivity. Here, we take advantage of the strengths of <italic>C. elegans</italic> for cell-specific analyses to investigate molecular coordination of pre- and postsynaptic development. We show that developing dendritic spines emerge from the dendrites of wild type GABAergic motor neurons following the localization of active zone proteins and the formation of immature synaptic vesicle assemblies in presynaptic terminals. Similarly, clusters of postsynaptic receptors and F-actin are visible in GABAergic dendrites prior to spine outgrowth. Surprisingly, these developmental processes occur without a requirement for synaptic activity. Likewise, the initial stages of spine outgrowth and receptor clustering are not altered by deletion of the <italic>C. elegans</italic> ortholog of the transsynaptic adhesion protein, neurexin/NRX-1. Over time, however, dendritic spines and postsynaptic receptor clusters are destabilized in the absence of presynaptic NRX-1/neurexin and collapse prior to adulthood. The kinesin-3 family member, UNC-104, delivers NRX-1 to presynaptic terminals and ongoing UNC-104 delivery is required into adulthood for the maintenance of postsynaptic structure. Our findings provide novel insights into the temporal order of synapse formation events <italic>in vivo</italic> and demonstrate a requirement for transsynaptic adhesion in stabilizing mature circuit connectivity.</p><sec><title>Contributions Summary</title><p>D.O. generated strains, transgenic lines, molecular constructs, confocal and electron microscopy images, and data analysis. S.R. performed all calcium imaging experiments and analysis. C.M.L. generated destination vectors and <italic>nrx-1</italic> constructs. D.H.H. and K.C.Q.N. aided in electron microscopy experiments and analysis. M.M.F and D.O designed and interpreted results of all experiments and wrote the manuscript.</p></sec>",2021-05-11
51,10.1101/2021.05.11.443685,23,bioRxiv,Bioinformatics,False,A clusterability measure for single-cell transcriptomics reveals phenotypic subpopulations,"[{'name': 'Maria Mircea'}, {'name': 'Mazène Hochane'}, {'name': 'Xueying Fan'}, {'name': 'Susana M. Chuva de Sousa Lopes'}, {'name': 'Diego Garlaschelli'}, {'name': 'Stefan Semrau'}]","<p>The ability to discover new cell populations by unsupervised clustering of single-cell transcriptomics data has revolutionized biology. Currently, there is no principled way to decide, whether a cluster of cells contains meaningful subpopulations that should be further resolved. Here we present SIGMA, a clusterability measure derived from random matrix theory, that can be used to identify cell clusters with non-random sub-structure, testably leading to the discovery of previously overlooked phenotypes.</p>",2021-05-13
