,doi,tweets,archive,subject-area,covid,title,authors,abstract,posted
52,10.1101/2021.10.29.466411,12,bioRxiv,Cell Biology,False,"The synthetic triterpenoids CDDO-TFEA and CDDO-Me, but not CDDO, are potent BACH1 inhibitors","[{'name': 'Laura Casares'}, {'name': 'Rita Moreno'}, {'name': 'Maureen Higgins'}, {'name': 'Sharada Dayalan Naidu'}, {'name': 'Graham Neill'}, {'name': 'Lena Cassin'}, {'name': 'Anders E Kiib'}, {'name': 'Esben B Svenningsen'}, {'name': 'Tadashi Honda'}, {'name': 'Thomas B Poulsen'}, {'name': 'Albena T Dinkova-Kostova'}, {'name': 'David Olagnier'}, {'name': 'Laureano de la Vega'}]","<p>The transcription factor BACH1 is a potential target against a variety of chronic conditions linked to oxidative stress and inflammation, and formation of cancer metastasis. However, only a few BACH1 degraders/inhibitors have been described. BACH1 is a transcriptional repressor of heme oxygenase 1 (HMOX1), which is positively regulated by transcription factor NRF2 and is highly inducible by derivatives of the synthetic oleanane triterpenoid 2-cyano-3,12-dioxooleana-1,9(11)-dien-28-oic acid (CDDO). Most of the therapeutic activities of these compounds are due to their anti-inflammatory and antioxidant properties, which are widely attributed to their ability to activate NRF2. However, with such a broad range of action, these drugs may have other molecular targets that have not been fully identified and could also be of importance for their therapeutic profile. Herein we identified BACH1 as a target of CDDO-derivatives, but not CDDO. While both CDDO and CDDO-derivatives activate NRF2 similarly, only CDDO-derivatives inhibit BACH1, which explains the much higher potency of CDDO-derivatives as HMOX1 inducers compared with unmodified CDDO. Notably, we demonstrate that CDDO-derivatives inhibit BACH1 via a novel mechanism that reduces BACH1 nuclear levels while accumulating its cytoplasmic form. Altogether, our study identifies CDDO-derivatives as dual KEAP1/BACH1 inhibitors, providing a rationale for further therapeutic uses of these drugs</p>",2021-10-29
53,10.1101/2021.10.22.465436,11,bioRxiv,Ecology,False,An updated framework to account for inter-individual variability when quantifying phenotypic variation,"[{'name': 'Giacomo Puglielli'}, {'name': 'Carlos P. Carmona'}, {'name': 'Laura Varone'}, {'name': 'Lauri Laanisto'}, {'name': 'Carlo Ricotta'}]","<p><list list-type=""order""><list-item><p>In trait-based ecology, phenotypic variation (<italic>PVar</italic>) is often quantified with measures that express average differences between populations standardized in the range 0-1. A major problem with these measures is that they disregard the within-population trait variability. In addition, most of these measures cannot be decomposed across scales. This can alter their interpretation, thus limiting their applicability.</p></list-item><list-item><p>To overcome these problems, we propose a new measure, the Phenotypic Dissimilarity Index (PhD) that is insensitive to the within-population interindividual trait variability. Likewise, PhD can be used to quantify <italic>PVar</italic> between individuals in a population while accounting for the <italic>PVar</italic> within individuals.</p></list-item><list-item><p>Using simulated and real data, we showed that PhD index correctly quantifies <italic>PVar</italic> when the within-population trait variability is not negligible, as in many ecological studies. By accounting for within-population trait variability, the PhD index generally provides a more parsimonious quantification of <italic>PVar</italic> across an environmental gradient compared to other estimators.</p></list-item><list-item><p>Traits sampled within a species have an inherent variability. Accounting for such variability is essential to understand species phenotypic responses to environmental cues. As such, the PhD index will provide ecologists with an asset to reliably quantify and compare <italic>PVar</italic> within and between species across environmental gradients at different scales. We also provide an R function to calculate the PhD index.</p></list-item></list></p>",2021-10-25
54,10.1101/2021.10.26.466009,11,bioRxiv,Microbiology,False,Total parenteral nutrition drives glucose metabolism disorders by modulating gut microbiota and its metabolites,"[{'name': 'Haifeng Sun'}, {'name': 'Peng Wang'}, {'name': 'Gulisudumu Maitiabula'}, {'name': 'Li Zhang'}, {'name': 'Jianbo Yang'}, {'name': 'Yupeng Zhang'}, {'name': 'Xuejin Gao'}, {'name': 'Jieshou Li'}, {'name': 'Bin Xue'}, {'name': 'Chao-Jun Li'}, {'name': 'Xinying Wang'}]","<p>The occurrence of glucose metabolism disorders is a potentially fatal complication of total parenteral nutrition (TPN). However, the mechanisms of TPN-associated glucose metabolism disorders remain unclarified. Given that the glucose metabolism was related to gut microbiome and TPN could induce the gut microbiota dysbiosis, we hypothesized that gut microbiota and its metabolites played the important roles in TPN-associated glucose metabolism disorders. By performing a cohort study of 256 type 2 IF patients given PN, we found that H-PN (PN&gt;80%) patients exhibited insulin resistance and a higher risk of complications. Then, TPN and microbiome transfer mice model showed that TPN promoted glucose metabolism disorders by inducing gut microbiota dysbiosis; 16S rRNA sequencing demonstrated that the abundance of <italic>Lactobacillacea</italic>e was decreased in mice model and negatively correlated with HOMA-IR and lipopolysaccharide level in TPN patients. Untargeted metabolomics found that indole-3-acetic acid (IAA) was decreased in TPN mice, and the serum level was also decreased in H-PN patients. Furthermore, GLP-1 secretion regulated by IAA and aryl hydrocarbon receptor was reduced in TPN mice and patients; IAA or liraglutide completely prevented glucose metabolism disorders in TPN mice. In conclusion, TPN drives glucose metabolism disorders by inducing alteration of gut microbiota and its metabolites.</p>",2021-10-27
55,10.1101/2021.10.28.466315,11,bioRxiv,Evolutionary Biology,False,Coloring inside the lines: genomic architecture and evolution of a widespread color pattern in frogs,"[{'name': 'Sandra Goutte'}, {'name': 'Imtiyaz Hariyani'}, {'name': 'Kole Deroy Utzinger'}, {'name': 'Yann Bourgeois'}, {'name': 'Stephane Boissinot'}]","<p>Traits shared among distantly related lineages are indicators of common evolutionary constraints, at the ecological, physiological or molecular level. The vertebral stripe is a color pattern that is widespread across the anuran phylogeny. Despite its prevalence in the order, surprisingly little is known about the genetic basis and evolutionary dynamic of this color pattern. Here we combine histology, genome- and transcriptome-wide analyses with order-scale phylogenetic comparative analyses to investigate this common phenotype. We show that the vertebral stripe has evolved hundreds of times in the evolutionary history of anurans and is selected for in terrestrial habitats. Using the Ethiopian Ptychadena radiation as a model system, we demonstrate that variation at the ASIP gene is responsible for the different vertebral stripe phenotypes. Alleles associated to these phenotypes are younger than the split between closely related Ptychadena species, thus indicating that the vertebral stripe results from parallel evolution within the group. Our findings demonstrate that this widespread color pattern evolves rapidly and recurrently in terrestrial anurans, and therefore constitute an ideal system to study repeated evolution.</p>",2021-10-29
56,10.1101/2021.10.26.465975,11,bioRxiv,Genetics,False,Integration of GWAS and TWAS to elucidate the genetic architecture of natural variation for leaf cuticular conductance in maize,"[{'name': 'Meng Lin'}, {'name': 'Pengfei Qiao'}, {'name': 'Susanne Matschi'}, {'name': 'Miguel Vasquez'}, {'name': 'Guillaume P. Ramstein'}, {'name': 'Richard Bourgault'}, {'name': 'Marc Mohammadi'}, {'name': 'Michael J Scanlon'}, {'name': 'Isabel Molina'}, {'name': 'Laurie G. Smith'}, {'name': 'Michael A Gore'}]","<p>The cuticle, a hydrophobic layer of cutin and waxes synthesized by plant epidermal cells, is the major barrier to water loss when stomata are closed. Dissecting the genetic architecture of natural variation for maize leaf cuticular conductance (gc) is important for identifying genes relevant to improving crop productivity in drought-prone environments. To this end, we performed an integrated genome- and transcriptome-wide association study (GWAS/TWAS) to identify candidate genes putatively regulating variation in leaf gc. Of the 22 plausible candidate genes identified, five were predicted to be involved in cuticle precursor biosynthesis and export, two in cell wall modification, nine in intracellular membrane trafficking, and seven in the regulation of cuticle development. A gene encoding an INCREASED SALT TOLERANCE1-LIKE1 (ISTL1) protein putatively involved in intracellular protein and membrane trafficking was identified in GWAS and TWAS as the strongest candidate causal gene. A set of maize nested near-isogenic lines that harbor the ISTL1 genomic region from eight donor parents were evaluated for gc, confirming the association between gc and ISTL1 in a haplotype-based association analysis. The findings of this study provide novel insights into the role of regulatory variants in the development of the maize leaf cuticle, and will ultimately assist breeders to develop drought-tolerant maize for target environments.</p>",2021-10-28
57,10.1101/2021.10.26.21265261,11,medRxiv,Infectious Diseases (except HIV/AIDS),True,Safety Monitoring of mRNA Vaccines Administered During the Initial 6 Months of the U.S. COVID-19 Vaccination Program: Reports to Vaccine Adverse Events Reporting System (VAERS) and v-safe,"[{'name': 'Hannah G. Rosenblum'}, {'name': 'Julianne M. Gee'}, {'name': 'Ruiling Liu'}, {'name': 'Paige L. Marquez'}, {'name': 'Bicheng Zhang'}, {'name': 'Penelope Strid'}, {'name': 'Winston E. Abara'}, {'name': 'Michael M. McNeil'}, {'name': 'Tanya R. Myers'}, {'name': 'Anne M. Hause'}, {'name': 'John R. Su'}, {'name': 'Bethany Baer'}, {'name': 'David Menschik'}, {'name': 'Lauri E. Markowitz'}, {'name': 'Tom T. Shimabukuro'}, {'name': 'David K. Shay'}]","<sec><title>Background</title><p>In December 2020, two mRNA-based COVID-19 vaccines were authorized for use in the United States. Vaccine safety was monitored using the Vaccine Adverse Event Reporting System (VAERS), a passive surveillance system, and v-safe, an active surveillance system.</p></sec><sec><title>Methods</title><p>VAERS and v-safe data during December 14, 2020—June 14, 2021 were analyzed. VAERS reports were categorized as non-serious, serious, or death; reporting rates were calculated. Rates of reported deaths were compared to expected mortality rates by age. Proportions of v-safe participants reporting local and systemic reactions or health impacts the week following doses 1 and 2 were determined.</p></sec><sec><title>Findings</title><p>During the analytic period, 298,792,852 doses of mRNA vaccines were administered in the United States. VAERS processed 340,522 reports; 92·1% were non-serious; 6·6%, serious, non-death; and 1·3%, death. Over half of 7,914,583 v-safe participants self-reported local and systemic reactogenicity, more frequently after dose 2. Injection-site pain, fatigue, and headache were commonly reported during days 0–7 following vaccination. Reactogenicity was reported most frequently one day after vaccination; most reactions were mild. More reports of being unable to work or do normal activities occurred after dose 2 (32·1%) than dose 1 (11·9%); &lt;1% of participants reported seeking medical care after vaccination. Rates of deaths reported to VAERS were lower than expected background rates by age group.</p></sec><sec><title>Interpretation</title><p>Safety data from &gt;298 million doses of mRNA COVID-19 vaccine administered in the first 6 months of the U.S. vaccination program show the majority of reported adverse events were mild and short in duration.</p></sec>",2021-10-27
58,10.1101/2021.10.26.465842,11,bioRxiv,Biochemistry,False,Somatostatin venom analogs evolved by fish-hunting cone snails: From prey capture behavior to identifying drug leads,"[{'name': 'Iris Bea. L. Ramiro'}, {'name': 'Walden E. Bjørn-Yoshimoto'}, {'name': 'Julita S. Imperial'}, {'name': 'Joanna Gajewiak'}, {'name': 'Maren Watkins'}, {'name': 'Dylan Taylor'}, {'name': 'William Resager'}, {'name': 'Beatrix Ueberheide'}, {'name': 'Hans Bräuner-Osborne'}, {'name': 'Frank G. Whitby'}, {'name': 'Christopher P. Hill'}, {'name': 'Laurent F. Martin'}, {'name': 'Amol Patwardhan'}, {'name': 'Gisela P. Concepcion'}, {'name': 'Baldomero M. Olivera'}, {'name': 'Helena Safavi-Hemami'}]","<p>Somatostatin (SS) is a peptide hormone with diverse physiological roles. By investigating a deep-water clade of fish-hunting cone snails, we show that predator-prey evolution has generated a diverse set of SS analogs, each optimized to elicit specific systemic physiological effects in prey. The increased metabolic stability, distinct SS receptor activation profiles, and chemical diversity of the venom analogs make them suitable leads for therapeutic application, including pain, cancer and endocrine disorders. Our findings not only establish the existence of SS-like peptides in animal venoms, but also serve as a model for the synergy gained from combining molecular phylogenetics and behavioral observations to optimize the discovery of natural products with biomedical potential.</p><sec><title>One Sentence Summary</title><p>Somatostatin drug design by fish-hunting cone snails</p></sec>",2021-10-26
59,10.1101/2021.10.26.465851,11,bioRxiv,Microbiology,False,Fungal auxin is a quorum-based modulator of blast disease severity,"[{'name': 'Lihong Dong'}, {'name': 'Qing Shen'}, {'name': 'Cheng-yen Chen'}, {'name': 'Lizheng Shen'}, {'name': 'Fan Yang'}, {'name': 'Naweed I. Naqvi'}, {'name': 'Yi Zhen Deng'}]","<p>Auxin is an important phytohormone regulating plant growth and development, and can also be produced by microbial pathogens including the rice-blast fungus <italic>Magnaporthe oryzae</italic>. However, the detailed biosynthesis pathway, biological function(s), and cellular distribution of such fungal auxin in <italic>M. oryzae</italic> remain largely unknown. Here, we report a sequential accumulation of intrinsic auxin in the three conidial cells, the infection structure (appressorium), and the invasive hyphae in <italic>M. oryzae</italic>. Such fungus-derived auxin was also secreted out and perceived by the host plants. A mitochondria-associated Indole-3-pyruvate decarboxylase, Ipd1, is essential for auxin/Indole-3-acetic acid biosynthesis in <italic>M. oryzae</italic>. The <italic>ipd1</italic>Δ was defective in pathogenicity whereas overexpression of <italic>IPD1</italic> led to enhanced virulence in rice. Chemical inhibition of fungal IAA biosynthesis, or its increase via external supplementation decreased or increased the severity of blast disease, respectively, in a dose-dependent manner. Furthermore, the IAA produced and secreted by <italic>M. oryzae</italic> governed the incidence and severity of blast disease in a quorum-dependent manner. Appressorium formation, conidial cell death critical for appressorium function, and the transcription of infection-related genes, <italic>MPG1</italic> and <italic>INV1</italic>, directly correlated with cell density and/or IAA levels within the conidial population at the early stages of pathogenic development. Overall, our study revealed that the severity of blast disease is regulated via quorum sensing with intrinsic IAA serving as an associated signal transducer in rice blast.</p>",2021-10-26
60,10.1101/2021.10.26.465922,10,bioRxiv,Neuroscience,False,Computational and neural mechanisms of affected beliefs,"[{'name': 'Laura Müller-Pinzler'}, {'name': 'Nora Czekalla'}, {'name': 'Annalina V Mayer'}, {'name': 'Alexander Schröder'}, {'name': 'David S Stolz'}, {'name': 'Frieder Michel Paulus'}, {'name': 'Sören Krach'}]","<p>The feedback people receive on their behavior shapes the process of belief formation and self-efficacy in mastering a given task. The neural and computational mechanisms of how the subjective value of these beliefs and corresponding affect bias the learning process are yet unclear. Here we investigate this question during learning of self-efficacy beliefs using fMRI, pupillometry, computational modeling and individual differences in affective experience. Biases in the formation of self-efficacy beliefs were associated with affect, pupil dilation and neural activity within the anterior insula, amygdala, VTA/SN, and mPFC. Specifically, neural and pupil responses map the valence of the prediction errors in correspondence to the experienced affect and learning bias people show during belief formation. Together with the functional connectivity dynamics of the anterior insula within this network our results hint towards neural and computational mechanisms that integrate affect in the process of belief formation.</p>",2021-10-28
61,10.1101/2021.10.28.466260,10,bioRxiv,Microbiology,False,RACK1 associates with RNA-binding proteins Vigilin and SERBP1 to control dengue virus replication,"[{'name': 'Alexis Brugier'}, {'name': 'Mohamed-Lamine Hafirassou'}, {'name': 'Marie Pourcelot'}, {'name': 'Morgane Baldaccini'}, {'name': 'Laurine Couture'}, {'name': 'Vasiliya Kril'}, {'name': 'Beate Kuemmerer'}, {'name': 'Sarah Gallois-Montbrun'}, {'name': 'Lucie Bonnet-Madin'}, {'name': 'Sebastien Pfeffer'}, {'name': 'Pierre-Olivier Vidalain'}, {'name': 'Constance Delaugerre'}, {'name': 'Laurent Meertens'}, {'name': 'Ali Amara'}]","<p>Dengue virus (DENV), a re-emerging virus transmitted by Aedes mosquitoes, causes severe pathogenesis in humans. No effective treatment is available against this virus. We recently identified the scaffold protein RACK1 as a component of the DENV replication complex, a macromolecular complex essential for viral genome amplification. Here, we show that RACK1 is important for DENV infection. RACK1 mediates DENV replication through binding to the 40S ribosomal subunit. Mass spectrometry analysis of RACK1 partners coupled to a loss-of-function screen identified the RNA binding proteins Vigilin and SERBP1 as DENV host dependency factors. Vigilin and SERBP1 interact with DENV viral RNA (vRNA), forming a ternary complex with RACK1 to mediate viral replication. Overall, our results indicate that RACK1 recruits Vigilin and SERBP1, linking the DENV vRNA to the translation machinery for optimal translation and replication.</p>",2021-10-29
62,10.1101/2021.10.28.463794,10,bioRxiv,Neuroscience,False,Chemogenetic activation of Locus Coeruleus Noradrenergic Neurons Modulates the Default Mode Network,"[{'name': 'Esteban A. Oyarzabal'}, {'name': 'Liming Hsu'}, {'name': 'Manasmita Das'}, {'name': 'Tzu-Hao Harry Chao'}, {'name': 'Jingheng Zhou'}, {'name': 'Sheng Song'}, {'name': 'Weiting Zhang'}, {'name': 'Kathleen G. Smith'}, {'name': 'Natale R. Sciolino'}, {'name': 'Irina Y. Evsyukova'}, {'name': 'Hong Yuan'}, {'name': 'Sung-Ho Lee'}, {'name': 'Guohong Cui'}, {'name': 'Patricia Jensen'}, {'name': 'Yen-Yu Ian Shih'}]","<p>The default mode network (DMN) of the brain is involved in cognition, emotion regulation, impulsivity, and balancing between internally and externally focused states. Dysregulation of DMN has been implicated in several neurological and neuropsychiatric disorders. In this study, we used functional magnetic resonance imaging (fMRI), positron emission tomography (PET), and spectral fiber-photometry to investigate the selective neuromodulatory effect of norepinephrine (NE)-releasing noradrenergic neurons in the locus coeruleus (LC) on DMN in mice. Chemogenetic-induced LC-NE activation decreased cerebral blood volume (CBV) and glucose uptake, while increasing synchronous low frequency power within the frontal cortices of the DMN. Fiber-photometry results corroborated these findings, showing LC-NE activation induces NE release, enhances calcium-weighted neuronal spiking, and reduces CBV in the anterior cingulate cortex. These data suggest the lack of conventional stimulus-evoked coupling between neuronal activity and CBV in the frontal DMN. We also demonstrated that chemogenetic activation of LC-NE neurons strengthen functional connectivity within the frontal DMN, and this effect is causally mediated by reduced modulatory inputs from retrosplenial and hippocampal regions to the association cortices of the DMN.</p>",2021-10-29
63,10.1101/2021.10.28.465226,10,bioRxiv,Biochemistry,True,A Potential Novel COVID-19 Vaccine With RBD-HR1/HR2 Hexamer Structure,"[{'name': 'Hongbo Liu'}, {'name': 'Xiang Gao'}, {'name': 'Guoyong Wang'}, {'name': 'Jianjun Zhang'}, {'name': 'Jiajie Zhou'}, {'name': 'Tingting Wei'}, {'name': 'Yu Zhang'}, {'name': 'Yujiao Liu'}, {'name': 'Jinhua Piao'}, {'name': 'Qiulei Zhang'}, {'name': 'Yayuan Wang'}, {'name': 'Xin Ma'}, {'name': 'Xiaoting Zhu'}, {'name': 'Yikun Rao'}, {'name': 'Wenjuan Xia'}, {'name': 'Heng Xie'}, {'name': 'Wei Zhang'}]","<p>The COVID-19 pandemic and the continued spreading of the SARS-CoV-2 variants have brought a grave public health consequence and severely devastated the global economy with recessions. Vaccination is considered as one of the most promising and efficient methods to end the COVID-19 pandemic and mitigate the disease conditions if infected. Although a few vaccines have been developed with an unprecedented speed, scientists around the world are continuing pursuing the best possible vaccines with innovations. Comparing to the expensive mRNA vaccines and attenuated/inactivated SARS-CoV-2 vaccines, recombinant protein vaccines have certain advantages, including their safety (non-virus components), potential stronger immunogenicity, broader protection, ease of scaling-up production, reduced cost, etc. In this study, we reported a novel COVID-19 vaccine generated with RBD-HR1/HR2 hexamer that was creatively fused with the RBD domain and heptad repeat 1 (HR1) or heptad repeat 2 (HR2) to form a dumbbell-shaped hexamer to target the spike S1 subunit. The novel hexamer COVID-19 vaccine induced high titers of neutralizing antibody in mouse studies (&gt;100,000), and further experiments also showed that the vaccine also induced an alternative antibody to the HR1 region, which probably alleviated the drop of immunogenicity from the frequent mutations of SARS-CoV-2.</p>",2021-10-29
64,10.1101/2021.10.28.466305,9,bioRxiv,Developmental Biology,False,Differential regulation of cranial and cardiac neural crest by Serum Response Factor,"[{'name': 'Colin J Dinsmore'}, {'name': 'Philippe Soriano'}]","<p>Serum response factor (SRF) is an essential transcription factor that influences many cellular processes including cell proliferation, migration, and differentiation. SRF directly regulates and is required for immediate early gene (IEG) and actin cytoskeleton-related gene expression. SRF coordinates these competing transcription programs through discrete sets of cofactors, the Ternary Complex Factors (TCFs) and Myocardin Related Transcription Factors (MRTFs). The relative contribution of these two programs to in vivo SRF activity and mutant phenotypes is not fully understood. To study how SRF utilizes its cofactors during development, we generated a knock-in Srfα1I allele in mice harboring point mutations that disrupt SRF-MRTF-DNA complex formation but leave SRF-TCF activity unaffected. Homozygous Srfα1I/α1I mutants die at E10.5 with notable cardiovascular phenotypes, and neural crest conditional mutants succumb at birth to defects of the cardiac outflow tract but display none of the craniofacial phenotypes associated with complete loss of SRF in that lineage. Our studies further support an important role for MRTF mediating SRF function in cardiac neural crest and suggest new mechanisms by which SRF regulates transcription during development.</p>",2021-10-28
65,10.1101/2021.10.29.466147,9,bioRxiv,Biochemistry,False,A hold-and-feed mechanism drives directional DNA loop extrusion by condensin,"[{'name': 'Indra A Shaltiel'}, {'name': 'Sumanjit Datta'}, {'name': 'Léa Lecomte'}, {'name': 'Markus Hassler'}, {'name': 'Marc Kschonsak'}, {'name': 'Sol Bravo'}, {'name': 'Catherine Stober'}, {'name': 'Sebastian Eustermann'}, {'name': 'Christian H Haering'}]","<p>SMC protein complexes structure genomes by extruding DNA loops, but the molecular mechanism that underlies their activity has remained unknown. We show that the active condensin complex entraps the bases of a DNA loop in two separate chambers. Single-molecule and cryo-electron microscopy provide evidence for a power-stroke movement at the first chamber that feeds DNA into the SMC-kleisin ring upon ATP binding, while the second chamber holds on upstream of the same DNA double helix. Unlocking the strict separation of 'motor' and 'anchor' chambers turns condensin from a one-sided into a bidirectional DNA loop extruder. We conclude that the orientation of two topologically bound DNA segments during the course of the SMC reaction cycle determines the directionality of DNA loop extrusion.</p>",2021-10-29
