,doi,tweets,archive,subject-area,covid,title,authors,abstract,posted
88,10.1101/2021.05.11.443509,11,bioRxiv,Biophysics,False,Spontaneous formation of prebiotic compartment colonies on Hadean Earth and pre-Noachian Mars,"[{'name': 'Elif S. Köksal'}, {'name': 'Inga Põldsalu'}, {'name': 'Henrik Friis'}, {'name': 'Stephen Mojzsis'}, {'name': 'Martin Bizzarro'}, {'name': 'Irep Gözen'}]","<p>The primitive cells that emerged at the origin of life are commonly viewed as spherical biosurfactant shells, freely suspended in aqueous media<sup>1–3</sup>. This model explains initial, but not subsequent events in the development process towards structured protocells. Taking into consideration the involvement of naturally occurring surfaces, which were abundant on the early Earth<sup>4</sup>, we report feasible and productive pathways for the development of primitive cells. Surfaces intrinsically possess energy, easily utilized by the interfacing amphiphiles, such as lipids, to attain self-organization and spontaneous transformations<sup>5–7</sup>. We show that the physical interaction of phospholipid pools with 20 Hadean Earth analogue materials as well as a Martian meteorite composed of fused regolith representing the ancient crust of Mars, consistently lead to the shape transformation and autonomous formation of surfactant compartment assemblies. Dense, colony-like protocell populations grow from these lipid deposits, predominantly at the grain boundaries or cleavages of the investigated natural surfaces, and remain there for several days. The model protocells in our study are able to autonomously develop, transform and pseudo-divide, and encapsulate RNA as well as DNA. We also demonstrate that they can accommodate non-enzymatic, DNA strand displacement reactions. Our findings suggest a feasible route towards the transformation from nonliving to living entities, and provide fresh support for the ‘Lipid World’ hypothesis<sup>8</sup>.</p>",2021-05-11
89,10.1101/2021.05.07.21256728,11,medRxiv,Neurology,False,Loss and Reorganisation of Superficial White Matter in Alzheimer’s disease: A Diffusion MRI study,"[{'name': 'Thomas Veale'}, {'name': 'Ian B. Malone'}, {'name': 'Teresa Poole'}, {'name': 'Thomas D. Parker'}, {'name': 'Catherine F. Slattery'}, {'name': 'Ross W. Paterson'}, {'name': 'Alexander J.M. Foulkes'}, {'name': 'David L. Thomas'}, {'name': 'Jonathan M. Schott'}, {'name': 'Hui Zhang'}, {'name': 'Nick C. Fox'}, {'name': 'David M. Cash'}]","<p>Pathological involvement of cerebral white matter in Alzheimer’s disease has been shown using diffusion tensor imaging. Superficial white matter (SWM) changes have been relatively understudied despite their importance in cortico-cortical connections. Measuring SWM degeneration using diffusion tensor imaging is challenging due to its complex structure and proximity to the cortex. To overcome this we investigated diffusion MRI changes in young-onset Alzheimer’s disease using standard diffusion tensor imaging and Neurite Orientation Dispersion and Density Imaging to distinguish between disease-related changes that are due to degeneration (e.g. loss of myelinated fibres) and those due to reorganisation (e.g. increased fibre dispersion). Twenty-nine young-onset Alzheimer’s disease patients and 22 healthy controls had both single-shell and multi-shell diffusion MRI. We calculated fractional anisotropy, mean diffusivity, neurite density index, orientation dispersion index and tissue fraction (1-free water fraction). Diffusion metrics were sampled in 15 <italic>a priori</italic> regions of interest at four points along the cortical profile: cortical grey matter, the grey/white boundary, SWM (1mm below grey/white boundary) and SWM/deeper white matter (2mm below grey/white boundary). To estimate cross-sectional group differences, we used average marginal effects from linear mixed effect models of participants’ diffusion metrics along the cortical profile. The SWM of young-onset Alzheimer’s disease individuals had lower neurite density index compared to controls in five regions (superior and inferior parietal, precuneus, entorhinal and parahippocampus) (all <italic>P</italic>&lt;0.05), and higher orientation dispersion index in three regions (fusiform, entorhinal and parahippocampus) (all <italic>P</italic>&lt;0.05). Young-onset Alzheimer’s disease individuals had lower fractional anisotropy in the SWM of two regions (entorhinal and parahippocampus) (both <italic>P</italic>&lt;0.05) and higher fractional anisotropy within the postcentral region (<italic>P</italic>&lt;0.05). Mean diffusivity in SWM was higher in the young-onset Alzheimer’s disease group in the parahippocampal region (<italic>P</italic>&lt;0.05) and lower in three regions (postcentral, precentral and superior temporal) (all <italic>P</italic>&lt;0.05). In the overlying grey matter, disease-related changes were largely consistent with SWM findings when using neurite density index and fractional anisotropy, but appeared at odds with orientation dispersion and mean diffusivity SWM changes. Tissue fraction was significantly lower across all grey matter regions in young-onset Alzheimer’s disease individuals (all <italic>P</italic>&lt;0.001) but group differences reduced in magnitude and coverage when moving towards the SWM. These results show that microstructural changes occur within SWM and along the cortical profile in individuals with young-onset Alzheimer’s disease. Lower neurite density and higher orientation dispersion suggests underlying SWM fibres undergo neurodegeneration and reorganisation, two effects previously indiscernible using standard diffusion tensor metrics in SWM.</p>",2021-05-14
90,10.1101/2021.05.11.443637,11,bioRxiv,Neuroscience,False,Cortical ripples provide the conditions for consolidation during NREM sleep in humans,"[{'name': 'Charles W. Dickey'}, {'name': 'Ilya A. Verzhbinsky'}, {'name': 'Xi Jiang'}, {'name': 'Burke Q. Rosen'}, {'name': 'Sophie Kajfez'}, {'name': 'Emad N. Eskandar'}, {'name': 'Jorge Gonzalez-Martinez'}, {'name': 'Sydney S. Cash'}, {'name': 'Eric Halgren'}]","<p>Hippocampal ripples index the reconstruction of spatiotemporal neuronal firing patterns essential for the consolidation of memories in the cortex during non-rapid eye movement (NREM) sleep. However, it is not known whether ripples are generated in the human cortex during sleep. Here, using human intracranial recordings, we show that ∼70ms long ∼80Hz ripples are ubiquitous in all regions of the cortex during NREM sleep as well as waking. During waking, cortical ripples occur on local high frequency activity peaks. During sleep, cortical ripples occur during spindles on the down-to-upstate transition, with unit-firing patterns consistent with generation by pyramidal-interneuron feedback. Cortical ripples mark the recurrence of spatiotemporal activity patterns from preceding waking, and they group co-firing within the window of spike-timing-dependent plasticity. Thus, cortical ripples guided by sequential sleep waves may facilitate memory consolidation during NREM sleep in humans.</p>",2021-05-13
91,10.1101/2021.05.10.21256912,11,medRxiv,Infectious Diseases (except HIV/AIDS),True,Household overcrowding and risk of SARS-CoV-2: analysis of the Virus Watch prospective community cohort study in England and Wales,"[{'name': 'Robert W Aldridge'}, {'name': 'Helen Pineo'}, {'name': 'Ellen Fragaszy'}, {'name': 'Max Eyre'}, {'name': 'Jana Kovar'}, {'name': 'Vincent Nguyen'}, {'name': 'Sarah Beale'}, {'name': 'Thomas Byrne'}, {'name': 'Anna Aryee'}, {'name': 'Colette Smith'}, {'name': 'Delanjathan Devakumar'}, {'name': 'Jonathon Taylor'}, {'name': 'Srinivasa Vittal Katikireddi'}, {'name': 'Wing Lam Erica Fong'}, {'name': 'Cyril Geismar'}, {'name': 'Parth Patel'}, {'name': 'Madhumita Shrotri'}, {'name': 'Isobel Braithwaite'}, {'name': 'Annalan M D Navaratnam'}, {'name': 'Anne M Johnson'}, {'name': 'Andrew Hayward'}]","<sec><title>Background</title><p>Household overcrowding is associated with increased risk of infectious diseases across contexts and countries. Limited data exist linking household overcrowding and risk of COVID-19. We used data collected from the Virus Watch cohort to examine the association between overcrowded households and SARS-CoV-2.</p></sec><sec><title>Methods</title><p>The Virus Watch study is a household community cohort of acute respiratory infections in England &amp; Wales that began recruitment in June 2020. We calculated the persons per room for each household and classified accommodation as overcrowded when the number of rooms□was fewer than the number of people. We considered two primary outcomes - PCR-confirmed positive SARS-CoV-2 antigen tests and laboratory confirmed SARS-CoV-2 antibodies (Roche Elecsys anti-N total immunoglobulin assay). We used mixed effects logistic regression models that accounted for household structure to estimate the association between household overcrowding and SARS-CoV-2 infection.</p></sec><sec><title>Results</title><p>The proportion of participants with a positive SARS-CoV-2 PCR result was highest in the overcrowded group (6.6%; 73/1,102) and lowest in the under-occupied group (2.9%; 682/23,219). In a mixed effects logistic regression model that included age, sex, ethnicity, household income and geographical region, we found strong evidence of an increased odds of having a positive PCR SARS-CoV-2 antigen result (Odds Ratio 3.72; 95% CI: 1.92, 7.13; p-value &lt; 0.001) and increased odds of having a positive SARS-CoV-2 antibody result in individuals living in overcrowded houses (2.96; 95% CI: 1.13, 7.74; p-value =0.027) compared to people living in under-occupied houses. The proportion of variation at the household level was 9.91% and 9.97% in the PCR and antibody models respectively.</p></sec><sec><title>Discussion</title><p>Public health interventions to prevent and stop the spread of SARS-CoV-2 should consider the much greater risk of infection for people living in overcrowded households and pay greater attention to reducing household transmission. There is an urgent need to better recognise housing as a leading determinant of health in the context of a pandemic and beyond.</p></sec>",2021-05-11
92,10.1101/2021.05.11.443588,11,bioRxiv,Microbiology,False,CdrS is a global transcriptional regulator influencing cell division in Haloferax volcanii,"[{'name': 'Yan Liao'}, {'name': 'Verena Vogel'}, {'name': 'Sabine Hauber'}, {'name': 'Jürgen Bartel'}, {'name': 'Omer S. Alkhnbashi'}, {'name': 'Sandra Maaß'}, {'name': 'Thandi S. Schwarz'}, {'name': 'Rolf Backofen'}, {'name': 'Dörte Becher'}, {'name': 'Iain G. Duggin'}, {'name': 'Anita Marchfelder'}]","<p>Transcriptional regulators that integrate cellular and environmental signals to control cell division are well known in bacteria and eukaryotes, but their existence is poorly understood in archaea. We identified a conserved gene (<italic>cdrS)</italic> that encodes a small protein and is highly transcribed in the model archaeon <italic>Haloferax volcanii</italic>. The <italic>cdrS</italic> gene could not be deleted, but CRISPRi-mediated repression of the <italic>cdrS</italic> gene caused slow growth, cell division defects, and changed the expression of multiple genes and their products associated with cell division, protein degradation and metabolism. Consistent with this complex regulatory network, overexpression of <italic>cdrS</italic> inhibited cell division, whereas overexpression of the operon encoding both CdrS and a tubulin-like cell division protein (FtsZ2) stimulated division. ChIP-Seq identified 18 DNA-binding sites of the CdrS protein including one upstream of the promoter for diadenylate cyclase, which is an essential gene involved in c-di-AMP signalling implicated in the regulation of cell division. These findings suggest that CdrS is a transcription factor that plays a central role in a regulatory network coordinating metabolism and cell division.</p><sec><title>Importance</title><p>Cell division is a central mechanism of life, and is essential for growth and development. Bacteria and Eukarya have different mechanisms for cell division, which have been studied in detail. In contrast, cell division in Archaea is still understudied, and its regulation is poorly understood. Interestingly, different cell division machineries appear in the Archaea, with the Euryarchaeota using a cell division apparatus based on the tubulin-like cytoskeletal protein FtsZ, as in bacteria. Here we identify the small protein CdrS as essential for survival and a central regulator of cell division in the Euryarchaeon <italic>Haloferax volcanii</italic>. CdrS also appears to coordinate other cellular pathways including synthesis of signalling molecules and protein degradation. Our results show that CdrS plays a sophisticated role in cell division, including regulation of numerous associated genes. These findings are expected to initiate investigations into conditional regulation of division in archaea.</p></sec>",2021-05-11
93,10.1101/2021.05.10.443157,11,bioRxiv,Cancer Biology,False,O-GlcNAc transferase regulates glioblastoma acetate metabolism via regulation of CDK5-dependent ACSS2 phosphorylation,"[{'name': 'Lorela Ciraku'}, {'name': 'Zachary A. Bacigalupa'}, {'name': 'Jing Ju'}, {'name': 'Rebecca A. Moeller'}, {'name': 'Rusia H. Lee'}, {'name': 'Michael D. Smith'}, {'name': 'Christina M. Ferrer'}, {'name': 'Sophie Trefely'}, {'name': 'Mary T. Doan'}, {'name': 'Wiktoria A. Gocal'}, {'name': 'Luca D’Agostino'}, {'name': 'Wenyin Shi'}, {'name': 'Joshua G. Jackson'}, {'name': 'Christos D. Katsetos'}, {'name': 'Nathaniel W. Snyder'}, {'name': 'Mauricio J. Reginato'}]","<p>Glioblastomas (GBMs) preferentially generate acetyl-CoA from acetate as a fuel source to promote tumor growth. O-GlcNAcylation has been shown to be elevated by increasing O-GlcNAc transferase (OGT) in many cancers and reduced O-GlcNAcylation can block cancer growth. Here, we identify a novel mechanism whereby OGT regulates acetate-dependent acetyl-CoA production by regulating phosphorylation of acetyl-CoA synthetase 2 (ACSS2) by cyclin-dependent kinase 5 (CDK5). OGT is required and sufficient for GBM cell growth and regulates acetate conversion to acetyl-CoA. Elevating O-GlcNAcylation in GBM cells increases phosphorylation of ACSS2 on Ser-267 in a CDK5-dependent manner. Importantly, we show that ACSS2 Ser-267 phosphorylation regulates its stability by reducing polyubiquitination and degradation. ACSS2 Ser-267 is critical for OGT-mediated GBM growth as overexpression of ACSS2 Ser-267 phospho-mimetic rescues growth <italic>in vitro</italic> and <italic>in</italic> vivo. Importantly, we show that pharmacologically targeting OGT and CDK5 reduces GBM growth <italic>ex vivo</italic>. Thus, the OGT/CDK5/ACSS2 pathway may be a way to target altered metabolic dependencies in brain tumors.</p>",2021-05-11
94,10.1101/2021.05.12.443898,10,bioRxiv,Neuroscience,False,Dual origin and multiple neuropeptidergic trajectories of hypothalamic POMC progenitors revealed by developmental single-cell transcriptomics,"[{'name': 'Hui Yu'}, {'name': 'Marcelo Rubinstein'}, {'name': 'Malcolm J Low'}]","<p>Proopiomelanocortin (POMC) neurons of the hypothalamic arcuate nucleus are essential to regulate food intake and energy balance. However, the ontogenetic transcriptional programs that specify the identity and functioning of these neurons are poorly understood. Here, we use scRNAseq to define the transcriptomes characterizing POMC progenitors in the developing hypothalamus and their transition into mature neurons. Our data show that <italic>Pomc</italic>-expressing neurons originate from two independent developmental pathways expressing distinct combinations of transcription factors. The predominant cluster, featured by high levels of <italic>Pomc</italic> and <italic>Prdm12</italic> transcripts represents the precursors of canonical arcuate POMC neurons. Additional clusters of progenitors expressing lower levels of <italic>Pomc</italic> mature into different neuronal phenotypes characterized by distinct combinations of transcription factors, neuropeptides, processing enzymes, cell surface and nuclear receptors. We conclude that the genetic programs specifying the identity and differentiation of arcuate POMC neurons are diverse and generate a heterogeneous repertoire of neuronal phenotypes early in development.</p>",2021-05-13
95,10.1101/2021.05.13.444109,10,bioRxiv,Biophysics,False,Microinductor-Fused Atomic Force Microscopy Cantilevers for Dynamic Imaging and Multimodal Manipulation,"[{'name': 'Charilaos Mousoulis'}, {'name': 'Xin Xu'}, {'name': 'Robert L. Wilson'}, {'name': 'Garrett Chado'}, {'name': 'Joseph Wahlquist'}, {'name': 'Mark P. Stoykovich'}, {'name': 'Virginia L. Ferguson'}, {'name': 'Babak Ziaie'}, {'name': 'Corey P. Neu'}]","<p>Recent advances in atomic force microscopy (AFM) imaging and force spectroscopy have demonstrated improvements in rapid acquisition of quantitative data for applications in materials science, surface characterization, and biology. However, conventional AFM technology is limited in detection sensitivity and the ability to excite at off-resonance frequencies restricting broad utility of the technology. Here we demonstrate new AFM cantilevers fabricated with a planar microcoil at the tip region, which can be used to generate or sense highly-localized magnetic fields. Torsion/bending actuation of the cantilevers is accomplished with simple experimental configurations, enabling quantitative and simultaneous mapping of both stiffness and friction at the sample surface with more than one order of magnitude improvement in compositional contrast. Our method is compatible with commercial AFM systems, allowing us to clearly resolve small stiffness and friction variations in copolymer and biological samples that were difficult to detect by conventional AFM methods. In combination with fluorescence microscopy, we also generated localized fields to selectively stimulate and monitor structural changes in viable cells with nm-scale detail. Hybrid AFM cantilevers may be useful to characterize a broad range of complex material surfaces, in addition to combined physical and chemical analyses of single cells and biological microenvironments.</p>",2021-05-16
96,10.1101/2021.05.12.443696,10,bioRxiv,Ecology,False,One Hundred and Fifty Years of Warming on Caribbean Coral Reefs,"[{'name': 'Colleen B. Bove'}, {'name': 'Laura Mudge'}, {'name': 'John F. Bruno'}]","<p>Anthropogenic climate change is rapidly altering the characteristics and dynamics of biological communities. This is especially apparent in marine systems as the world’s oceans are warming at an unprecedented rate, causing dramatic changes to coastal marine systems, especially on coral reefs of the Caribbean. We used three complementary ocean temperature databases (HadISST, Pathfinder, and OISST) to quantify change in thermal characteristics of Caribbean coral reefs over the last 150 years (1871–2020). These sea surface temperature (SST) databases included combined <italic>in situ</italic> and satellite-derived SST (HadISST, OISST), as well as satellite-only observations (Pathfinder) at multiple spatial resolutions. We also compiled a Caribbean coral reef database identifying 5,326 unique reefs across the region. We found that Caribbean reefs have warmed on average by 0.20 °C per decade since 1987, the calculated year that rapid warming began on Caribbean reefs. Further, geographic variation in warming rates ranged from 0.17 °C per decade on Bahamian reefs to 0.26 °C per decade on reefs within the Southern and Eastern Caribbean ecoregions. If this linear rate of warming continues, these already threatened ecosystems would warm by an <italic>additional</italic> 1.6 °C on average by 2100. We also found that marine heatwave (MHW) events are increasing in both frequency and duration across the Caribbean. Caribbean coral reefs now experience on average 5 MHW events annually, compared to 1 per year in the early 1980s. Combined, these changes have caused a dramatic shift in the composition and function of Caribbean coral reef ecosystems. If reefs continue to warm at this rate, we are likely to lose even the remnant Caribbean coral reef communities of today in the coming decades.</p>",2021-05-13
97,10.1101/2021.05.11.443545,10,bioRxiv,Microbiology,False,Unraveling protein interactions between the temperate virus Bam35 and its Bacillus host using an integrative Yeast two hybrid-High throughput sequencing approach,"[{'name': 'Ana Lechuga'}, {'name': 'Cédric Lood'}, {'name': 'Mónica Berjón-Otero'}, {'name': 'Alicia del Prado'}, {'name': 'Jeroen Wagemans'}, {'name': 'Vera van Noort'}, {'name': 'Rob Lavigne'}, {'name': 'Margarita Salas'}, {'name': 'Modesto Redrejo-Rodríguez'}]","<p><italic>Bacillus</italic> virus Bam35 is the model <italic>Betatectivirus</italic> and member of the <italic>Tectiviridae</italic> family, which is composed of tailless, icosahedral, and membrane-containing bacteriophages. The interest in these viruses has greatly increased in recent years as they are thought to be an evolutionary link between diverse groups of prokaryotic and eukaryotic viruses. Additionally, betatectiviruses infect bacteria of the <italic>Bacillus cereus</italic> group, known for their applications in industry and notorious since it contains many pathogens. Here, we present the first protein-protein interactions network for a tectivirus-host system by studying the Bam35-<italic>Bacillus thuringiensis</italic> model using a novel approach that integrates the traditional yeast two-hybrid system and Illumina high-throughput sequencing. We generated and thoroughly analyzed a genomic library of Bam35’s host <italic>B. thuringiensis</italic> HER1410 and screened interactions with all the viral proteins using different combinations of bait-prey couples. In total, this screen resulted in the detection of over 4,000 potential interactions, of which 183 high-confidence interactions were defined as part of the core virus-host interactome. Overall, host metabolism proteins and peptidases are particularly enriched within the detected interactions, distinguishing this host-phage system from the other reported host-phage protein-protein interaction networks (PPIs). Our approach also suggests biological roles for several Bam35 proteins of unknown function, resulting in a better understanding of the Bam35-<italic>B. thuringiensis</italic> interaction at the molecular level.</p><sec><title>A<sc>uthor summary</sc></title><p>Members of the family <italic>Tectiviridae</italic>, composed of non-tailed icosahedral, membrane-containing bacteriophages, have been increasingly scrutinized in recent years for their possible role in the origin of dsDNA viruses. In particular, the genus <italic>Betatectivirus</italic> receives increased attention as these phages can infect clinical strains as well as industrially relevant members of the <italic>B. cereus</italic> group. However, little is known about the interactions between these temperate viruses and their hosts. Here, we present the first high-throughput study of tectivirus-host protein-protein interactions focusing on Bam35, model virus of betatectiviruses, and its host <italic>B. thuringiensis</italic>, an important entomopathogenic bacterium. We adapted the well-known technique yeast-two-hybrid and integrated high-throughput sequencing and bioinformatics for the downstream analysis of the results which enables large-scale analysis of protein-protein interactions. In total, 182 detected interactions show an enrichment in host metabolic proteins and peptidases, in contrast with the current knowledge on host-phage PPIs. Specific host-viral protein-protein interactions were also detected enabling us to propose functions for uncharacterized proteins.</p></sec>",2021-05-11
