,doi,tweets,archive,subject-area,covid,title,authors,abstract,posted
0,10.1101/2021.04.27.441510,1699,bioRxiv,Microbiology,True,Aerosol Exposure of Cynomolgus Macaques to SARS-CoV-2 Results in More Severe Pathology than Existing Models,"[{'given': 'Sandra L.', 'family': 'Bixler', 'sequence': 'first', 'affiliation': []}, {'given': 'Christopher P.', 'family': 'Stefan', 'sequence': 'additional', 'affiliation': []}, {'given': 'Alexandra', 'family': 'Jay', 'sequence': 'additional', 'affiliation': []}, {'given': 'Franco', 'family': 'Rossi', 'sequence': 'additional', 'affiliation': []}, {'given': 'Keersten M.', 'family': 'Ricks', 'sequence': 'additional', 'affiliation': []}, {'given': 'Charles J.', 'family': 'Shoemaker', 'sequence': 'additional', 'affiliation': []}, {'given': 'Alicia M.', 'family': 'Moreau', 'sequence': 'additional', 'affiliation': []}, {'given': 'Xiankun', 'family': 'Zeng', 'sequence': 'additional', 'affiliation': []}, {'given': 'Jay W.', 'family': 'Hooper', 'sequence': 'additional', 'affiliation': []}, {'given': 'David', 'family': 'Dyer', 'sequence': 'additional', 'affiliation': []}, {'given': 'Ondraya', 'family': 'Frick', 'sequence': 'additional', 'affiliation': []}, {'given': 'Jeffrey W.', 'family': 'Koehler', 'sequence': 'additional', 'affiliation': []}, {'given': 'Brian', 'family': 'Kearney', 'sequence': 'additional', 'affiliation': []}, {'given': 'Nina', 'family': 'DiPinto', 'sequence': 'additional', 'affiliation': []}, {'given': 'Jun', 'family': 'Liu', 'sequence': 'additional', 'affiliation': []}, {'given': 'Samantha', 'family': 'Tostenson', 'sequence': 'additional', 'affiliation': []}, {'given': 'Tamara L.', 'family': 'Clements', 'sequence': 'additional', 'affiliation': []}, {'given': 'Jeffrey M.', 'family': 'Smith', 'sequence': 'additional', 'affiliation': []}, {'given': 'Joshua A.', 'family': 'Johnson', 'sequence': 'additional', 'affiliation': []}, {'given': 'Kerry', 'family': 'Berrier', 'sequence': 'additional', 'affiliation': []}, {'given': 'Heather', 'family': 'Esham', 'sequence': 'additional', 'affiliation': []}, {'given': 'Korey L.', 'family': 'Delp', 'sequence': 'additional', 'affiliation': []}, {'given': 'Susan R.', 'family': 'Coyne', 'sequence': 'additional', 'affiliation': []}, {'given': 'Holly', 'family': 'Bloomfield', 'sequence': 'additional', 'affiliation': []}, {'given': 'Paul', 'family': 'Kuehnert', 'sequence': 'additional', 'affiliation': []}, {'given': 'Kristen', 'family': 'Akers', 'sequence': 'additional', 'affiliation': []}, {'given': 'Kathleen', 'family': 'Gibson', 'sequence': 'additional', 'affiliation': []}, {'given': 'Timothy D.', 'family': 'Minogue', 'sequence': 'additional', 'affiliation': []}, {'given': 'Aysegul', 'family': 'Nalca', 'sequence': 'additional', 'affiliation': []}, {'given': 'Margaret L. M.', 'family': 'Pitt', 'sequence': 'additional', 'affiliation': []}]","<jats:title>Abstract</jats:title><jats:p>The emergence of SARS-CoV-2 pandemic has highlighted the need for animal models that faithfully recapitulate the salient features of COVID-19 disease in humans; these models are necessary for the rapid down-selection, testing, and evaluation of medical countermeasures. Here we performed a direct comparison of two distinct routes of SARS-CoV-2 exposure, combined intratracheal/intranasal and small particle aerosol, in two nonhuman primate species: rhesus and cynomolgus macaques. While all four experimental groups displayed very few outward clinical signs, evidence of mild to moderate respiratory disease was present on radiographs and at the time of necropsy. Cynomolgus macaques exposed via the aerosol route also developed the most consistent fever responses and had the most severe respiratory disease and pathology. This study demonstrates that while all four models were suitable representations of mild COVID-like illness, aerosol exposure of cynomolgus macaques to SARS-CoV-2 produced the most severe disease, which may provide additional clinical endpoints for evaluating therapeutics and vaccines.</jats:p>",2021-04-27
1,10.1101/2021.04.26.21256152,170,medRxiv,Infectious Diseases (except HIV/AIDS),False,Effectiveness of portable air filtration on reducing indoor aerosol counts: preclinical observational trials,"[{'given': 'Jung Hoon', 'family': 'Lee', 'sequence': 'first', 'affiliation': []}, {'given': 'Max', 'family': 'Rounds', 'sequence': 'additional', 'affiliation': []}, {'given': 'Forbes', 'family': 'McGain', 'sequence': 'additional', 'affiliation': []}, {'given': 'Robyn', 'family': 'Schofield', 'sequence': 'additional', 'affiliation': []}, {'given': 'Grant', 'family': 'Skidmore', 'sequence': 'additional', 'affiliation': []}, {'given': 'Imogen', 'family': 'Wadlow', 'sequence': 'additional', 'affiliation': []}, {'given': 'Kevin', 'family': 'Kevin', 'sequence': 'additional', 'affiliation': []}, {'given': 'Ashley', 'family': 'Stevens', 'sequence': 'additional', 'affiliation': []}, {'given': 'Caroline', 'family': 'Marshall', 'sequence': 'additional', 'affiliation': []}, {'given': 'Lou', 'family': 'Irving', 'sequence': 'additional', 'affiliation': []}, {'given': 'Marion', 'family': 'Kainer', 'sequence': 'additional', 'affiliation': []}, {'given': 'Kirsty', 'family': 'Buising', 'sequence': 'additional', 'affiliation': []}, {'given': 'Jason', 'family': 'Monty', 'sequence': 'additional', 'affiliation': []}]","<jats:title>Abstract</jats:title><jats:sec><jats:title>Objective</jats:title><jats:p>To assess the effectiveness of aerosol filtration by portable air cleaning devices with high efficiency particulate air (HEPA) filters used in addition to standard building heating ventilation and air-conditioning (HVAC).</jats:p></jats:sec><jats:sec><jats:title>Methods</jats:title><jats:p>Test rooms, including a hospital single-patient room, were filled with test aerosol to simulate aerosol movement. Aerosol counts were measured over time with various portable air cleaning devices and room ventilation systems to quantify the aerosol concentration reduction rate and overall clearance rate.</jats:p></jats:sec><jats:sec><jats:title>Results</jats:title><jats:p>Portable air cleaners were very effective in removing aerosols, especially for the devices with high flow rate. In a small control room, the aerosols were cleared 4 to 5 times faster with portable air cleaners than the room with HVAC alone. A single bed hospital room equipped with an excellent ventilation rate (∼ 14 air changes per hour) can clear the aerosols in 20 minutes. However, with the addition of two air cleaners, the clearance time became 3 times faster (in 6 minutes and 30 seconds).</jats:p></jats:sec><jats:sec><jats:title>Conclusions</jats:title><jats:p>Portable air cleaning devices with HEPA filtration were highly effective at removing aerosols. To clear aerosols (above 90% clearance) in under 10 minutes requires around 25 air changes per hour; readily feasible with air cleaners. Inexpensive portable air cleaning devices should be considered for small and enclosed spaces in health care settings such as inpatient rooms, personal protective equipment donning/doffing stations, and staff tea rooms. Portable air cleaners are particularly important where there is limited ability to reduce aerosol transmission with building HVAC ventilation.</jats:p></jats:sec>",2021-04-28
2,10.1101/2021.04.26.21256136,131,medRxiv,Infectious Diseases (except HIV/AIDS),True,Detecting in-school transmission of SARS-CoV-2 from case ratios and documented clusters,"[{'ORCID': 'http://orcid.org/0000-0001-8011-0012', 'authenticated-orcid': False, 'given': 'Kaitlyn', 'family': 'Johnson', 'sequence': 'first', 'affiliation': []}, {'ORCID': 'http://orcid.org/0000-0002-1086-9717', 'authenticated-orcid': False, 'given': 'Michael', 'family': 'Lachmann', 'sequence': 'additional', 'affiliation': []}, {'given': 'Madison', 'family': 'Stoddard', 'sequence': 'additional', 'affiliation': []}, {'ORCID': 'http://orcid.org/0000-0002-9321-6876', 'authenticated-orcid': False, 'given': 'Remy', 'family': 'Pasco', 'sequence': 'additional', 'affiliation': []}, {'ORCID': 'http://orcid.org/0000-0003-1969-3778', 'authenticated-orcid': False, 'given': 'Spencer J', 'family': 'Fox', 'sequence': 'additional', 'affiliation': []}, {'ORCID': 'http://orcid.org/0000-0002-5828-8874', 'authenticated-orcid': False, 'given': 'Lauren Ancel', 'family': 'Meyers', 'sequence': 'additional', 'affiliation': []}, {'given': 'Arijit', 'family': 'Chakravarty', 'sequence': 'additional', 'affiliation': []}]",<jats:p>Claims that in-person schooling has not amplified SARS-CoV-2 transmission are based on similar infection rates in schools and their surrounding communities and limited numbers of documented in-school transmission events. Simulations assuming high in-school transmission suggest that these metrics cannot exclude the possibility that transmission in schools exacerbated overall pandemic risks.</jats:p>,2021-04-28
3,10.1101/2021.04.28.441626,121,bioRxiv,Evolutionary Biology,False,"A re-analysis of the data in Sharkey et al.'s (2021) minimalist revision reveals that BINs do not deserve names, but BOLD Systems needs a stronger commitment to open science","[{'ORCID': 'http://orcid.org/0000-0002-4452-2885', 'authenticated-orcid': False, 'given': 'Rudolf', 'family': 'Meier', 'sequence': 'first', 'affiliation': []}, {'ORCID': 'http://orcid.org/0000-0002-8961-9998', 'authenticated-orcid': False, 'given': 'Bonnie', 'family': 'Blaimer', 'sequence': 'additional', 'affiliation': []}, {'ORCID': 'http://orcid.org/0000-0002-5265-815X', 'authenticated-orcid': False, 'given': 'Eliana', 'family': 'Buenaventura', 'sequence': 'additional', 'affiliation': []}, {'ORCID': 'http://orcid.org/0000-0002-8598-9844', 'authenticated-orcid': False, 'given': 'Emily', 'family': 'Hartop', 'sequence': 'additional', 'affiliation': []}, {'ORCID': 'http://orcid.org/0000-0002-6253-3078', 'authenticated-orcid': False, 'given': 'Thomas', 'family': 'von Rintelen', 'sequence': 'additional', 'affiliation': []}, {'ORCID': 'http://orcid.org/0000-0002-7988-3437', 'authenticated-orcid': False, 'given': 'Amrita', 'family': 'Srivathsan', 'sequence': 'additional', 'affiliation': []}, {'ORCID': 'http://orcid.org/0000-0003-1888-7482', 'authenticated-orcid': False, 'given': 'Darren', 'family': 'Yeo', 'sequence': 'additional', 'affiliation': []}]","<jats:p>Halting biodiversity decline is one of the most critical challenges for humanity, but biodiversity assessment and monitoring are hampered by taxonomic impediments. We here distinguish between a ""dark taxon impediment"" caused by a large number of undescribed species and a ""superficial description impediment"" caused by species descriptions so imprecise that type specimens have to be consulted in order to resolve species identities. Recently, Sharkey et al. (2021) proposed to address the dark taxon impediment for Costa Rican braconid wasps by describing 403 species based on barcode clusters (""BINs"") computed by BOLD Systems. The default assumption of the revision is that BIN=Species (e.g., BOLD:ACM9419 becomes Bracon federicomatarritai Sharkey, sp. nov.) and therefore the diagnoses of most species consist only of a consensus barcode. We here argue that this type of ""minimalist revision"" is unnecessary and undesirable. It is unnecessary because barcode clusters (e.g. BINs) already provide grouping statements that overcome many of the obstacles associated with dark taxon impediments. However, minimalist revisions are also undesirable and problematic because the diagnoses are only based on one character system - that in the case of Sharkey et al. was poorly analyzed. Furthermore, the revision relies on units that violate basic rules of reproducibility because the BINs were delimited by a proprietary algorithm (RESL) that is applied to a mixture of public and private data. Here, we illustrate that many of the BINs described as species are unstable when the available public data are reanalyzed, reiterate that COI mostly measures time of divergence, and that BOLD Systems violates key principles of open science. We conclude by urging authors, reviewers, editors, and grantors to only publish and fund projects that adhere to modern standards of reproducibility.</jats:p>",2021-04-29
4,10.1101/2021.04.29.442030,103,bioRxiv,Evolutionary Biology,False,Genomic consequences of domestication of the Siamese fighting fish,"[{'given': 'Young', 'family': 'Kwon', 'sequence': 'first', 'affiliation': []}, {'ORCID': 'http://orcid.org/0000-0003-0728-4715', 'authenticated-orcid': False, 'given': 'Nathan', 'family': 'Vranken', 'sequence': 'additional', 'affiliation': []}, {'given': 'Carla', 'family': 'Hoge', 'sequence': 'additional', 'affiliation': []}, {'given': 'Madison R', 'family': 'Lichak', 'sequence': 'additional', 'affiliation': []}, {'given': 'Kerel X', 'family': 'Francis', 'sequence': 'additional', 'affiliation': []}, {'given': 'Julia', 'family': 'Camacho-Garcia', 'sequence': 'additional', 'affiliation': []}, {'ORCID': 'http://orcid.org/0000-0002-6155-3093', 'authenticated-orcid': False, 'given': 'Iliana', 'family': 'Bista', 'sequence': 'additional', 'affiliation': []}, {'ORCID': 'http://orcid.org/0000-0002-7545-2162', 'authenticated-orcid': False, 'given': 'Jonathan', 'family': 'Wood', 'sequence': 'additional', 'affiliation': []}, {'ORCID': 'http://orcid.org/0000-0002-2715-4187', 'authenticated-orcid': False, 'given': 'Shane', 'family': 'McCarthy', 'sequence': 'additional', 'affiliation': []}, {'ORCID': 'http://orcid.org/0000-0002-9056-201X', 'authenticated-orcid': False, 'given': 'William', 'family': 'Chow', 'sequence': 'additional', 'affiliation': []}, {'given': 'Heok Hui', 'family': 'Tan', 'sequence': 'additional', 'affiliation': []}, {'ORCID': 'http://orcid.org/0000-0003-2237-513X', 'authenticated-orcid': False, 'given': 'Kerstin', 'family': 'Howe', 'sequence': 'additional', 'affiliation': []}, {'ORCID': 'http://orcid.org/0000-0003-1029-1457', 'authenticated-orcid': False, 'given': 'Sepalika', 'family': 'Bandara', 'sequence': 'additional', 'affiliation': []}, {'ORCID': 'http://orcid.org/0000-0002-2079-2143', 'authenticated-orcid': False, 'given': 'Johannes', 'family': 'von Lintig', 'sequence': 'additional', 'affiliation': []}, {'given': 'Lukas', 'family': 'Ruber', 'sequence': 'additional', 'affiliation': []}, {'given': 'Richard', 'family': 'Durbin', 'sequence': 'additional', 'affiliation': []}, {'given': 'Hannes', 'family': 'Svardal', 'sequence': 'additional', 'affiliation': []}, {'given': 'Andres', 'family': 'Bendesky', 'sequence': 'additional', 'affiliation': []}]","<jats:p>Siamese fighting fish, commonly known as betta, are among the world's most popular and morphologically diverse pet fish, but the genetic processes leading to their domestication and phenotypic diversification are largely unknown. We assembled de novo the genome of a wild Betta splendens and whole-genome sequenced multiple individuals across five species within the B. splendens species complex, including wild populations and domesticated ornamental betta. Given our estimate of the mutation rate from pedigrees, our analyses suggest that betta were domesticated at least 1,000 years ago, centuries earlier than previously thought. Ornamental betta individuals have variable contributions from other Betta species and have also introgressed into wild populations of those species. We identify dmrt1 as the main sex determination gene in ornamental betta but not in wild B. splendens, and find evidence for recent directional selection at the X-allele of the locus. Furthermore, we find genes with signatures of recent, strong selection that have large effects on color in specific parts of the body, or the shape of individual fins, and are almost all unlinked. Our results demonstrate how simple genetic architectures paired with anatomical modularity can lead to vast phenotypic diversity generated during animal domestication, and set the stage for using betta as a modern system for evolutionary genetics.</jats:p>",2021-04-30
5,10.1101/2021.04.27.441464,100,bioRxiv,Biophysics,False,Stochastic dynamics of single molecules across phase boundaries,"[{'ORCID': 'http://orcid.org/0000-0002-2738-867X', 'authenticated-orcid': False, 'given': 'Stefano', 'family': 'Bo', 'sequence': 'first', 'affiliation': []}, {'ORCID': 'http://orcid.org/0000-0003-1934-7437', 'authenticated-orcid': False, 'given': 'Lars', 'family': 'Hubatsch', 'sequence': 'additional', 'affiliation': []}, {'ORCID': 'http://orcid.org/0000-0002-0301-7655', 'authenticated-orcid': False, 'given': 'Jonathan', 'family': 'Bauermann', 'sequence': 'additional', 'affiliation': []}, {'ORCID': 'http://orcid.org/0000-0001-6279-0405', 'authenticated-orcid': False, 'given': 'Christoph A.', 'family': 'Weber', 'sequence': 'additional', 'affiliation': []}, {'ORCID': 'http://orcid.org/0000-0003-4731-9185', 'authenticated-orcid': False, 'given': 'Frank', 'family': 'Julicher', 'sequence': 'additional', 'affiliation': []}]","<jats:p>We discuss the stochastic trajectories of single molecules in a phase-separated liquid, when a dense and a dilute phase coexist. Starting from a continuum theory of macroscopic phase separation we derive a stochastic Langevin equation for molecular trajectories that takes into account thermal fluctuations. We find that molecular trajectories can be described as diffusion with drift in an effective potential, which has a steep gradient at phase boundaries. We discuss how the physics of phase coexistence affects the statistics of molecular trajectories and in particular the statistics of displacements of molecules crossing a phase boundary. At thermodynamic equilibrium detailed balance imposes that the distributions of displacements crossing the phase boundary from the dense or from the dilute phase are the same. Our theory can be used to infer key phase separation parameters from the statistics of single-molecule trajectories. For simple Brownian motion, there is no drift in the presence of a concentration gradient. We show that interactions in the fluid give rise to an average drift velocity in concentration gradients. Interestingly, under non-equilibrium conditions, single molecules tend to drift uphill the concentration gradient. Thus, our work bridges between single-molecule dynamics and collective dynamics at macroscopic scales and provides a framework to study single-molecule dynamics in phase-separating systems.</jats:p>",2021-04-27
6,10.1101/2021.04.26.441518,75,bioRxiv,Immunology,True,Nucleocapsid vaccine elicits spike-independent SARS-CoV-2 protective immunity,"[{'ORCID': 'http://orcid.org/0000-0001-7515-2226', 'authenticated-orcid': False, 'given': 'William E.', 'family': 'Matchett', 'sequence': 'first', 'affiliation': []}, {'ORCID': 'http://orcid.org/0000-0002-0723-3347', 'authenticated-orcid': False, 'given': 'Vineet', 'family': 'Joag', 'sequence': 'additional', 'affiliation': []}, {'ORCID': 'http://orcid.org/0000-0002-4321-6413', 'authenticated-orcid': False, 'given': 'J. Michael', 'family': 'Stolley', 'sequence': 'additional', 'affiliation': []}, {'given': 'Frances K.', 'family': 'Shepherd', 'sequence': 'additional', 'affiliation': []}, {'given': 'Clare F.', 'family': 'Quarnstrom', 'sequence': 'additional', 'affiliation': []}, {'given': 'Clayton K.', 'family': 'Mickelson', 'sequence': 'additional', 'affiliation': []}, {'ORCID': 'http://orcid.org/0000-0002-8819-2654', 'authenticated-orcid': False, 'given': 'Sathi', 'family': 'Wijeyesinghe', 'sequence': 'additional', 'affiliation': []}, {'ORCID': 'http://orcid.org/0000-0001-7291-8433', 'authenticated-orcid': False, 'given': 'Andrew G.', 'family': 'Soerens', 'sequence': 'additional', 'affiliation': []}, {'given': 'Samuel', 'family': 'Becker', 'sequence': 'additional', 'affiliation': []}, {'ORCID': 'http://orcid.org/0000-0002-6603-281X', 'authenticated-orcid': False, 'given': 'Joshua M.', 'family': 'Thiede', 'sequence': 'additional', 'affiliation': []}, {'given': 'Eyob', 'family': 'Weyu', 'sequence': 'additional', 'affiliation': []}, {'given': 'Stephen', 'family': 'O’Flanagan', 'sequence': 'additional', 'affiliation': []}, {'given': 'Jennifer A.', 'family': 'Walter', 'sequence': 'additional', 'affiliation': []}, {'given': 'Michelle N.', 'family': 'Vu', 'sequence': 'additional', 'affiliation': []}, {'ORCID': 'http://orcid.org/0000-0001-8803-7606', 'authenticated-orcid': False, 'given': 'Vineet D.', 'family': 'Menachery', 'sequence': 'additional', 'affiliation': []}, {'ORCID': 'http://orcid.org/0000-0001-7360-6546', 'authenticated-orcid': False, 'given': 'Tyler D.', 'family': 'Bold', 'sequence': 'additional', 'affiliation': []}, {'ORCID': 'http://orcid.org/0000-0002-2520-809X', 'authenticated-orcid': False, 'given': 'Vaiva', 'family': 'Vezys', 'sequence': 'additional', 'affiliation': []}, {'ORCID': 'http://orcid.org/0000-0001-8009-7655', 'authenticated-orcid': False, 'given': 'Marc K.', 'family': 'Jenkins', 'sequence': 'additional', 'affiliation': []}, {'ORCID': 'http://orcid.org/0000-0002-0515-571X', 'authenticated-orcid': False, 'given': 'Ryan A.', 'family': 'Langlois', 'sequence': 'additional', 'affiliation': []}, {'ORCID': 'http://orcid.org/0000-0002-9440-3884', 'authenticated-orcid': False, 'given': 'David', 'family': 'Masopust', 'sequence': 'additional', 'affiliation': []}]","<jats:title>Abstract</jats:title><jats:p>Severe acute respiratory syndrome coronavirus 2 (SARS-CoV-2) is responsible for the COVID-19 pandemic. Neutralizing antibodies target the receptor binding domain of the spike (S) protein, a focus of successful vaccine efforts. Concerns have arisen that S-specific vaccine immunity may fail to neutralize emerging variants. We show that vaccination with HAd5 expressing the nucleocapsid (N) protein can establish protective immunity, defined by reduced weight loss and viral load, in both Syrian hamsters and k18-hACE2 mice. Challenge of vaccinated mice was associated with rapid N-specific T cell recall responses in the respiratory mucosa. This study supports the rationale for including additional viral antigens, even if they are not a target of neutralizing antibodies, to broaden epitope coverage and immune effector mechanisms.</jats:p>",2021-04-27
7,10.1101/2021.04.27.441667,74,bioRxiv,Evolutionary Biology,False,Enhanced lipogenesis through Pparγ helps cavefish adapt to food scarcity.,"[{'given': 'Shaolei', 'family': 'Xiong', 'sequence': 'first', 'affiliation': []}, {'given': 'Wei', 'family': 'Wang', 'sequence': 'additional', 'affiliation': []}, {'given': 'Alexander', 'family': 'Kenzior', 'sequence': 'additional', 'affiliation': []}, {'given': 'Luke', 'family': 'Olsen', 'sequence': 'additional', 'affiliation': []}, {'given': 'Jaya', 'family': 'Krishnan', 'sequence': 'additional', 'affiliation': []}, {'given': 'Jenna', 'family': 'Persons', 'sequence': 'additional', 'affiliation': []}, {'given': 'Kyle', 'family': 'Medley', 'sequence': 'additional', 'affiliation': []}, {'given': 'Robert', 'family': 'Peuss', 'sequence': 'additional', 'affiliation': []}, {'given': 'Yongfu', 'family': 'Wang', 'sequence': 'additional', 'affiliation': []}, {'given': 'Shiyuan', 'family': 'Chen', 'sequence': 'additional', 'affiliation': []}, {'given': 'Ning', 'family': 'Zhang', 'sequence': 'additional', 'affiliation': []}, {'given': 'Nancy', 'family': 'Thomas', 'sequence': 'additional', 'affiliation': []}, {'given': 'John', 'family': 'Miles', 'sequence': 'additional', 'affiliation': []}, {'ORCID': 'http://orcid.org/0000-0002-1966-6959', 'authenticated-orcid': False, 'given': 'Alejandro', 'family': 'Sanchez Alvarado', 'sequence': 'additional', 'affiliation': []}, {'ORCID': 'http://orcid.org/0000-0003-3248-2772', 'authenticated-orcid': False, 'given': 'Nicolas', 'family': 'Rohner', 'sequence': 'additional', 'affiliation': []}]","<jats:p>Nutrient availability varies seasonally and spatially in the wild. The resulting nutrient limitation or restricted access to nutrients pose a major challenge for every organism. While many animals, such as hibernating animals, evolved strategies to overcome periods of nutrient scarcity, the cellular mechanisms of these strategies are poorly understood. Cave environments represent an extreme example of nutrient deprived environments since the lack of sunlight and therefore primary energy production drastically diminishes the nutrient availability. Here, we used Astyanax mexicanus, which includes river-dwelling surface fish and cave adapted cavefish populations to study the genetic adaptation to nutrient limitations. We show that cavefish populations store large amounts of fat in different body regions when fed ad libitum in the lab. We found higher expression of lipogenesis genes in cavefish livers when fed the same amount of food as surface fish, suggesting an improved ability of cavefish to use lipogenesis to convert available energy into triglycerides for storage into adipose tissue. Moreover, the lipid metabolism regulator, Peroxisome proliferator-activated receptor γ (Pparγ), is upregulated at both transcript and protein levels in cavefish livers. Chromatin Immunoprecipitation sequencing (ChIP seq) showed that Pparγ binds cavefish promoter regions of genes to a higher extent than surface fish. Finally, we identified two possible regulatory mechanisms of Pparγ in cavefish: higher amounts of ligands of the nuclear receptor, and nonsense mutations in per2, a known repressor of Pparγ. Taken together, our study reveals that upregulated Pparγ promotes higher levels of lipogenesis in the liver and contributes to higher body fat accumulation in cavefish populations, an important adaptation to nutrient limited environments.</jats:p>",2021-04-28
