,doi,tweets,archive,subject-area,covid,title,authors,abstract,posted
30,10.1101/2021.04.26.21256081,25,medRxiv,Infectious Diseases (except HIV/AIDS),True,Clinical validation of RCSMS: a rapid and sensitive CRISPR-Cas12a test for the molecular detection of SARS-CoV-2 from saliva,"[{'ORCID': 'http://orcid.org/0000-0002-1157-8452', 'authenticated-orcid': False, 'given': 'Joaquín Abugattás Núñez', 'family': 'del Prado', 'sequence': 'first', 'affiliation': []}, {'ORCID': 'http://orcid.org/0000-0002-3555-4017', 'authenticated-orcid': False, 'given': 'Angélica Quintana', 'family': 'Reyes', 'sequence': 'additional', 'affiliation': []}, {'ORCID': 'http://orcid.org/0000-0001-9763-1682', 'authenticated-orcid': False, 'given': 'Juan Blume', 'family': 'La Torre', 'sequence': 'additional', 'affiliation': []}, {'ORCID': 'http://orcid.org/0000-0001-6466-5288', 'authenticated-orcid': False, 'given': 'Renzo', 'family': 'Gutiérrez Loli', 'sequence': 'additional', 'affiliation': []}, {'given': 'Alejandro', 'family': 'Pinzón Olejua', 'sequence': 'additional', 'affiliation': []}, {'ORCID': 'http://orcid.org/0000-0001-5040-0641', 'authenticated-orcid': False, 'given': 'Elena Rocío', 'family': 'Chamorro Chirinos', 'sequence': 'additional', 'affiliation': []}, {'given': 'Félix Antonio', 'family': 'Loza Mauricio', 'sequence': 'additional', 'affiliation': []}, {'ORCID': 'http://orcid.org/0000-0002-4136-7795', 'authenticated-orcid': False, 'given': 'Jorge L.', 'family': 'Maguiña', 'sequence': 'additional', 'affiliation': []}, {'ORCID': 'http://orcid.org/0000-0002-1113-4544', 'authenticated-orcid': False, 'given': 'Julio', 'family': 'Leon', 'sequence': 'additional', 'affiliation': []}, {'ORCID': 'http://orcid.org/0000-0002-3828-4235', 'authenticated-orcid': False, 'given': 'Piere', 'family': 'Rodríguez Aliaga', 'sequence': 'additional', 'affiliation': []}, {'ORCID': 'http://orcid.org/0000-0001-6230-0832', 'authenticated-orcid': False, 'given': 'Edward', 'family': 'Málaga Trillo', 'sequence': 'additional', 'affiliation': []}]","<jats:title>ABSTRACT</jats:title><jats:p>Early detection of SARS-CoV-2 using molecular techniques is paramount to the fight against COVID-19. Due to its high sensitivity and specificity, RT-qPCR is the “gold standard” method for this purpose. However, its technical requirements, processing time and elevated costs hamper its use towards massive and timely molecular testing for COVID-19 in rural and socioeconomically deprived areas of Latin America. The advent and rapid evolution of CRISPR-Cas technology has boosted the development of new pathogen detection methodologies. Recently, DETECTR -a combination of isothermal RT-LAMP amplification and Cas12a-mediated enzymatic detection-has been successfully validated in the Netherlands and the USA as a rapid and low-cost alternative to RT-qPCR for the detection of SARS-CoV-2 from nasopharyngeal swabs. Here, we evaluated the performance of RCSMS, a locally adapted variant of DETECTR, to ascertain the presence of SARS-CoV-2 in saliva samples from 276 patients in two hospitals in Lima, Perú <jats:italic>(current status over a total of 350 samples</jats:italic>). We show that a low-cost thermochemical treatment with TCEP/EDTA is sufficient to inactivate viral particles and cellular nucleases in saliva, eliminating the need to extract viral RNA with commercial kits, as well as the cumbersome nasopharyngeal swab procedure and the requirement of biosafety level 2 laboratories for molecular analyses. Our clinical validation shows that RCSMS detects up to 5 viral copies per reaction in 40 min, with sensitivity and specificity of 93.8% and 99.0% in the field, respectively, relative to RT-qPCR. Since CRISPR-Cas biosensors can be easily reprogrammed by using different guide RNA molecules, RCSMS has the potential to be quickly adapted for the detection of new SARS-CoV-2 variants. Notably, estimation of its negative and positive predictive values suggests that RCSMS can be confidently deployed in both high and low prevalence settings. Furthermore, our field study validates the use of lateral flow strips to easily visualize the presence of SARS-CoV-2, which paves the way to deploy RCSMS as a “point of care” test in environments with limited access to state-of-the-art diagnostic laboratories. In sum, RCSMS is a fast, efficient and inexpensive alternative to RT-qPCR for expanding COVID-19 testing capacity in low- and middle-income countries.</jats:p>",2021-04-27
31,10.1101/2021.04.26.441424,24,bioRxiv,Genomics,False,The role of insulators and transcription in 3D chromatin organisation of flies,"[{'given': 'Keerthi T', 'family': 'Chathoth', 'sequence': 'first', 'affiliation': []}, {'given': 'Liudmila A', 'family': 'Mikheeva', 'sequence': 'additional', 'affiliation': []}, {'given': 'Gilles', 'family': 'Crevel', 'sequence': 'additional', 'affiliation': []}, {'given': 'Jareth C.', 'family': 'Wolfe', 'sequence': 'additional', 'affiliation': []}, {'given': 'Ioni', 'family': 'Hunter', 'sequence': 'additional', 'affiliation': []}, {'given': 'Saskia', 'family': 'Beckett-Doyle', 'sequence': 'additional', 'affiliation': []}, {'given': 'Sue', 'family': 'Cotterill', 'sequence': 'additional', 'affiliation': []}, {'given': 'Hongsheng', 'family': 'Dai', 'sequence': 'additional', 'affiliation': []}, {'given': 'Andrew', 'family': 'Harrison', 'sequence': 'additional', 'affiliation': []}, {'ORCID': 'http://orcid.org/0000-0001-9964-6271', 'authenticated-orcid': False, 'given': 'Nicolae Radu', 'family': 'Zabet', 'sequence': 'additional', 'affiliation': []}]","<jats:title>Abstract</jats:title><jats:p>The DNA in many organisms, including humans, is shown to be organised in topologically associating domains (TADs). In <jats:italic>Drosophila</jats:italic>, several architectural proteins are enriched at TAD borders, but it is still unclear whether these proteins play a functional role in the formation and maintenance of TADs. Here, we show that depletion of BEAF-32, Cp190, Chro and Dref leads to changes in TAD organisation and chromatin loops. Their depletion predominantly affects TAD borders located in heterochromatin, while TAD borders located in euchromatin are resilient to these mutants. Furthermore, transcriptomic data has revealed hundreds of genes displaying differential expression in these mutants and showed that the majority of differentially expressed genes are located within reorganised TADs. Our work identifies a novel and functional role for architectural proteins at TAD borders in <jats:italic>Drosophila</jats:italic> and a link between TAD reorganisation and subsequent changes in gene expression.</jats:p>",2021-04-27
32,10.1101/2021.04.28.441874,23,bioRxiv,Developmental Biology,False,Temporal single-cell transcriptomes of zebrafish spinal cord pMN progenitors reveal distinct neuronal and glial progenitor populations,"[{'given': 'Kayt', 'family': 'Scott', 'sequence': 'first', 'affiliation': []}, {'given': 'Rebecca', 'family': 'O’Rourke', 'sequence': 'additional', 'affiliation': []}, {'given': 'Caitlin C.', 'family': 'Winkler', 'sequence': 'additional', 'affiliation': []}, {'given': 'Christina A.', 'family': 'Kearns', 'sequence': 'additional', 'affiliation': []}, {'ORCID': 'http://orcid.org/0000-0003-4500-0672', 'authenticated-orcid': False, 'given': 'Bruce', 'family': 'Appel', 'sequence': 'additional', 'affiliation': []}]","<jats:title>Abstract</jats:title><jats:p>Ventral spinal cord progenitor cells, which express the basic helix loop helix transcription factor Olig2, sequentially produce motor neurons and oligodendrocyte precursor cells (OPCs). Following specification some OPCs differentiate as myelinating oligodendrocytes while others persist as OPCs. Though a considerable amount of work has described the molecular profiles that define motor neurons, OPCs, and oligodendrocytes, less is known about the progenitors that produce them. To identify the developmental origins and transcriptional profiles of motor neurons and OPCs, we performed single-cell RNA sequencing on isolated pMN cells from embryonic zebrafish trunk tissue at stages that encompassed motor neurogenesis, OPC specification, and initiation of oligodendrocyte differentiation. Downstream analyses revealed two distinct pMN progenitor populations: one that appears to produce neurons and one that appears to produce OPCs. This latter population, called Pre-OPCs, is marked by expression of <jats:italic>GS Homeobox 2</jats:italic> (<jats:italic>gsx2)</jats:italic>, a gene that encodes a homeobox transcription factor. Using fluorescent in situ hybridizations, we identified <jats:italic>gsx2</jats:italic>-expressing Pre-OPCs in the spinal cord prior to expression of canonical OPC marker genes. Our data therefore reveal heterogeneous gene expression profiles among pMN progenitors, supporting prior fate mapping evidence.</jats:p><jats:sec><jats:title>Highlights</jats:title><jats:list list-type=""bullet""><jats:list-item><jats:p>Single-cell RNA sequencing reveals the developmental trajectories of neurons and glia that arise from spinal cord pMN progenitor cells in zebrafish embryos</jats:p></jats:list-item><jats:list-item><jats:p>Transcriptionally distinct subpopulations of pMN progenitors are the apparent sources of neurons or oligodendrocytes, consistent with fate mapping data</jats:p></jats:list-item><jats:list-item><jats:p><jats:italic>gsx2</jats:italic> expression marks pMN progenitors that produce oligodendrocyte lineage cells</jats:p></jats:list-item></jats:list></jats:sec>",2021-04-29
33,10.1101/2021.04.27.441137,22,bioRxiv,Genetics,False,Germline loss-of-function variants in the base-excision repair gene MBD4 cause a Mendelian recessive syndrome of adenomatous colorectal polyposis and acute myeloid leukaemia,"[{'given': 'Claire', 'family': 'Palles', 'sequence': 'first', 'affiliation': []}, {'given': 'Edward', 'family': 'Chew', 'sequence': 'additional', 'affiliation': []}, {'given': 'Judith E.', 'family': 'Grolleman', 'sequence': 'additional', 'affiliation': []}, {'given': 'Sara', 'family': 'Galavotti', 'sequence': 'additional', 'affiliation': []}, {'given': 'Christoffer', 'family': 'Flensburg', 'sequence': 'additional', 'affiliation': []}, {'given': 'Erik A.M.', 'family': 'Jansen', 'sequence': 'additional', 'affiliation': []}, {'given': 'Helen', 'family': 'Curley', 'sequence': 'additional', 'affiliation': []}, {'given': 'Laura', 'family': 'Chegwidden', 'sequence': 'additional', 'affiliation': []}, {'given': 'Edward Arbe', 'family': 'Barnes', 'sequence': 'additional', 'affiliation': []}, {'given': 'Ashish', 'family': 'Bajel', 'sequence': 'additional', 'affiliation': []}, {'given': 'Kitty', 'family': 'Sherwood', 'sequence': 'additional', 'affiliation': []}, {'given': 'Lynn', 'family': 'Martin', 'sequence': 'additional', 'affiliation': []}, {'given': 'Huw', 'family': 'Thomas', 'sequence': 'additional', 'affiliation': []}, {'given': 'Demetra', 'family': 'Georgiou', 'sequence': 'additional', 'affiliation': []}, {'given': 'Florentia', 'family': 'Fostira', 'sequence': 'additional', 'affiliation': []}, {'given': 'Yael', 'family': 'Goldberg', 'sequence': 'additional', 'affiliation': []}, {'given': 'David J.', 'family': 'Adams', 'sequence': 'additional', 'affiliation': []}, {'given': 'Simone A.M.', 'family': 'van der Biezen', 'sequence': 'additional', 'affiliation': []}, {'given': 'Michael', 'family': 'Christie', 'sequence': 'additional', 'affiliation': []}, {'given': 'Mark', 'family': 'Clendenning', 'sequence': 'additional', 'affiliation': []}, {'given': 'Constantinos', 'family': 'Deltas', 'sequence': 'additional', 'affiliation': []}, {'given': 'Aleksandar J.', 'family': 'Dimovski', 'sequence': 'additional', 'affiliation': []}, {'given': 'Dagmara', 'family': 'Dymerska', 'sequence': 'additional', 'affiliation': []}, {'given': 'Jan', 'family': 'Lubinski', 'sequence': 'additional', 'affiliation': []}, {'given': 'Khalid', 'family': 'Mahmood', 'sequence': 'additional', 'affiliation': []}, {'given': 'Rachel S.', 'family': 'van der Post', 'sequence': 'additional', 'affiliation': []}, {'given': 'Mathijs', 'family': 'Sanders', 'sequence': 'additional', 'affiliation': []}, {'given': 'Jürgen', 'family': 'Weitz', 'sequence': 'additional', 'affiliation': []}, {'given': 'Jenny C.', 'family': 'Taylor', 'sequence': 'additional', 'affiliation': []}, {'given': 'Clare', 'family': 'Turnbull', 'sequence': 'additional', 'affiliation': []}, {'given': 'Lilian', 'family': 'Vreede', 'sequence': 'additional', 'affiliation': []}, {'given': 'Tom', 'family': 'van Wezel', 'sequence': 'additional', 'affiliation': []}, {'given': 'Celina', 'family': 'Whalley', 'sequence': 'additional', 'affiliation': []}, {'given': 'Claudia Arnedo', 'family': 'Pac', 'sequence': 'additional', 'affiliation': []}, {'given': 'Gulio', 'family': 'Caravagna', 'sequence': 'additional', 'affiliation': []}, {'given': 'William', 'family': 'Cross', 'sequence': 'additional', 'affiliation': []}, {'given': 'Daniel', 'family': 'Chubb', 'sequence': 'additional', 'affiliation': []}, {'given': 'Anna', 'family': 'Frangou', 'sequence': 'additional', 'affiliation': []}, {'given': 'Andreas', 'family': 'Gruber', 'sequence': 'additional', 'affiliation': []}, {'given': 'Ben', 'family': 'Kinnersley', 'sequence': 'additional', 'affiliation': []}, {'given': 'Boris', 'family': 'Noyvert', 'sequence': 'additional', 'affiliation': []}, {'given': 'David', 'family': 'Church', 'sequence': 'additional', 'affiliation': []}, {'given': 'Trevor', 'family': 'Graham', 'sequence': 'additional', 'affiliation': []}, {'given': 'Richard', 'family': 'Houlston', 'sequence': 'additional', 'affiliation': []}, {'given': 'Nuria', 'family': 'Lopez-Bigas', 'sequence': 'additional', 'affiliation': []}, {'given': 'Andrea', 'family': 'Sottoriva', 'sequence': 'additional', 'affiliation': []}, {'given': 'David', 'family': 'Wedge', 'sequence': 'additional', 'affiliation': []}, {'given': 'Mark A.', 'family': 'Jenkins', 'sequence': 'additional', 'affiliation': []}, {'given': 'Roland P.', 'family': 'Kuiper', 'sequence': 'additional', 'affiliation': []}, {'given': 'Andrew W.', 'family': 'Roberts', 'sequence': 'additional', 'affiliation': []}, {'given': 'Marjolijn J.L.', 'family': 'Ligtenberg', 'sequence': 'additional', 'affiliation': []}, {'given': 'Nicoline', 'family': 'Hoogerbrugge', 'sequence': 'additional', 'affiliation': []}, {'given': 'Viktor H.', 'family': 'Koelzer', 'sequence': 'additional', 'affiliation': []}, {'given': 'Andres Dacal', 'family': 'Rivas', 'sequence': 'additional', 'affiliation': []}, {'given': 'Ingrid M.', 'family': 'Winship', 'sequence': 'additional', 'affiliation': []}, {'given': 'Clara Ruiz', 'family': 'Ponte', 'sequence': 'additional', 'affiliation': []}, {'given': 'Daniel D.', 'family': 'Buchanan', 'sequence': 'additional', 'affiliation': []}, {'given': 'Ian P.M.', 'family': 'Tomlinson', 'sequence': 'additional', 'affiliation': []}, {'given': 'Ian J.', 'family': 'Majewski', 'sequence': 'additional', 'affiliation': []}, {'ORCID': 'http://orcid.org/0000-0002-8222-0343', 'authenticated-orcid': False, 'given': 'Richarda M.', 'family': 'de Voer', 'sequence': 'additional', 'affiliation': []}, {'name': 'Genomics England Research Consortium', 'sequence': 'additional', 'affiliation': []}, {'name': 'The CORGI Consortium', 'sequence': 'additional', 'affiliation': []}, {'name': 'WGS500 Consortium', 'sequence': 'additional', 'affiliation': []}]","<jats:title>ABSTRACT</jats:title><jats:p>Inherited defects in base-excision repair (BER) predispose to adenomatous polyposis and colorectal cancer (CRC), yet our understanding of this important DNA repair pathway remains incomplete. By combining detailed clinical, histological and molecular profiling, we reveal biallelic germline loss-of-function (LOF) variants in the BER gene <jats:italic>MBD4</jats:italic> to predispose to adenomatous polyposis and –uniquely amongst CRC predisposition syndromes– to myeloid neoplasms. Neoplasms from MBD4-deficient patients almost exclusively accumulate somatic CpG&gt;TpG mutations, resembling mutational signature SBS1. MBD4-deficient adenomas harbour mutations in known CRC driver genes, although <jats:italic>AMER1</jats:italic> mutations were more common and <jats:italic>KRAS</jats:italic> mutations less frequent. We did not find an increased risk for colorectal tumours in individuals with a monoallelic <jats:italic>MBD4</jats:italic> LOF variant. We suggest that this condition should be termed <jats:italic>MBD4</jats:italic>-associated neoplasia syndrome (MANS) and that <jats:italic>MBD4</jats:italic> is included in testing for the genetic diagnosis of polyposis and/or early-onset AML.</jats:p>",2021-04-28
34,10.1101/2021.04.27.441583,21,bioRxiv,Biophysics,False,OCT4 interprets and enhances nucleosome flexibility,"[{'given': 'Caitlin M.', 'family': 'MacCarthy', 'sequence': 'first', 'affiliation': []}, {'given': 'Jan', 'family': 'Huertas', 'sequence': 'additional', 'affiliation': []}, {'given': 'Claudia', 'family': 'Ortmeier', 'sequence': 'additional', 'affiliation': []}, {'given': 'Hermann', 'family': 'vom Bruch', 'sequence': 'additional', 'affiliation': []}, {'given': 'Deike', 'family': 'Reinke', 'sequence': 'additional', 'affiliation': []}, {'given': 'Astrid', 'family': 'Sander', 'sequence': 'additional', 'affiliation': []}, {'given': 'Tim', 'family': 'Bergbrede', 'sequence': 'additional', 'affiliation': []}, {'given': 'Hans R.', 'family': 'Schöler', 'sequence': 'additional', 'affiliation': []}, {'given': 'Vlad', 'family': 'Cojocaru', 'sequence': 'additional', 'affiliation': []}]","<jats:p>Pioneer transcription factors induce cellular identity transitions by binding to sites on inaccessible DNA wrapped in nuclear chromatin. They contribute to chromatin opening and recruit other factors to regulatory DNA sites. The structural basis of their interaction with the chromatin structural unit, the nucleosome, is still unresolved. From a combination of experiments and molecular simulations we reveal here how Oct4, the master regulator and inducer of cellular pluripotency, interprets and enhances nucleosome structural flexibility. The magnitude of Oct4 impact on nucleosome dynamics depends on the binding site position and the mobility of unstructured tails of nucleosomal histone proteins. Oct4 propagates and stabilizes open nucleosome conformations by specific sequence recognition and unspecific DNA exploration. Our findings provide a structural basis for the versatility of transcription factors in engaging with nucleosomes and have implications for understanding how pioneer factors induce chromatin dynamics.</jats:p>",2021-04-27
35,10.1101/2021.04.24.21256047,20,medRxiv,Genetic and Genomic Medicine,True,Interleukin-6 receptor genetic variation and tocilizumab treatment response to COVID-19,"[{'given': 'Ammar Ali', 'family': 'Almarzooq', 'sequence': 'first', 'affiliation': []}]","<jats:title>ABSTRACT</jats:title><jats:p>Interleukin-6 receptor (IL6R) stimulates the inflammatory pathways as part of the acute-phase response to infection. Tocilizumab is a monoclonal antibody that inhibits both membrane-bound and soluble IL6R and is used to treat inflammatory conditions, including COVID-19. Despite the disproportionate incidence of COVID-19 among underserved, racial, and ethnic minority populations, the efficacy of tocilizumab in hospitalized COVID-19 patients from these populations is unclear. In this work, three genetic markers for the <jats:italic>IL6R</jats:italic> gene were analyzed across diverse ethnic backgrounds to identify population differences in response to tocilizumab treatment. Genetic structure analyses showed that African populations were significantly different from other described populations. In addition, mapped frequencies of these alleles showed that Sub-Saharan African populations were 3.4x more likely to show an impaired response to tocilizumab than East Asian populations, and 1.8x more likely than European ancestry populations. Existing <jats:italic>IL6R</jats:italic> genotype results may identify populations at increased therapeutic failure risk. As results from current clinical trials on the efficacy of tocilizumab treatment for extreme COVID-19 infections are conflicting, more studies are needed across diverse patient backgrounds to better understand the genetic factors necessary to predict treatment efficacy. This work demonstrates how pharmacogenomics studies can elucidate genetic variation on treatment efficacy on COVID-19.</jats:p>",2021-04-27
36,10.1101/2021.04.27.441718,20,bioRxiv,Microbiology,False,A Novel Family of RNA-Binding Proteins Regulate Polysaccharide Metabolism in Bacteroides thetaiotaomicron,"[{'given': 'Amanda N.D.', 'family': 'Adams', 'sequence': 'first', 'affiliation': []}, {'given': 'Muhammad S.', 'family': 'Azam', 'sequence': 'additional', 'affiliation': []}, {'given': 'Zachary A.', 'family': 'Costliow', 'sequence': 'additional', 'affiliation': []}, {'given': 'Xiangqian', 'family': 'Ma', 'sequence': 'additional', 'affiliation': []}, {'given': 'Patrick H.', 'family': 'Degnan', 'sequence': 'additional', 'affiliation': []}, {'given': 'Carin K.', 'family': 'Vanderpool', 'sequence': 'additional', 'affiliation': []}]","<jats:title>Abstract</jats:title><jats:p>Human gut microbiome composition is constantly changing, and diet is a major driver of these changes. Gut microbial species that persist in mammalian hosts for long periods of time must possess mechanisms for sensing and adapting to nutrient shifts to avoid being outcompeted. Global regulatory mechanisms mediated by RNA-binding proteins (RBPs) that govern responses to nutrient shifts have been characterized in Proteobacteria and Firmicutes but remain undiscovered in the Bacteroidetes. Here we report the identification of RBPs that are broadly distributed across the Bacteroidetes, with many genomes encoding multiple copies. Genes encoding these RBPs are highly expressed in many <jats:italic>Bacteroides</jats:italic> species. A purified RBP, RbpB, from <jats:italic>Bacteroides thetaiotaomicron</jats:italic> binds to single-stranded RNA <jats:italic>in vitro</jats:italic> with an affinity similar to other characterized regulatory RBPs. <jats:italic>B. thetaiotaomicron</jats:italic> mutants lacking RBPs show dramatic shifts in expression of polysaccharide utilization and capsular polysaccharide loci, suggesting that these RBPs may act as global regulators of polysaccharide metabolism. A <jats:italic>B. thetaiotaomicron</jats:italic> Δ<jats:italic>rbpB</jats:italic> mutant shows a growth defect on dietary sugars belonging to the raffinose family of oligosaccharides (RFOs). The Δ<jats:italic>rbpB</jats:italic> mutant had reduced expression of <jats:italic>BT1871</jats:italic>, encoding a predicted RFO-degrading melibiase, compared to the wild-type strain. Mutation of <jats:italic>BT1871</jats:italic> confirmed that the enzyme it encodes is essential for growth on melibiose and promotes growth on the RFOs raffinose and stachyose. Our data reveal that RbpB is required for optimal expression of <jats:italic>BT1871</jats:italic> and other polysaccharide-related genes, suggesting that we have identified an important new family of global regulatory proteins in the Bacteroidetes.</jats:p><jats:sec><jats:title>Importance</jats:title><jats:p>The human colon houses hundreds of bacterial species, including many belonging to the genus <jats:italic>Bacteroides,</jats:italic> that aid in breaking down our food to keep us healthy. <jats:italic>Bacteroides</jats:italic> have many genes responsible for breaking down different dietary carbohydrates and complex regulatory mechanisms ensure that specific genes are only expressed when the right carbohydrates are available. In this study, we discovered that <jats:italic>Bacteroides</jats:italic> use a family of RNA-binding proteins as global regulators to coordinate expression of carbohydrate utilization genes. The ability to turn different carbohydrate utilization genes on and off in response to changing nutrient conditions is critical for <jats:italic>Bacteroides</jats:italic> to live successfully in the gut, and thus the new regulators we have identified may be important for life in the host.</jats:p></jats:sec>",2021-04-28
