,doi,tweets,archive,subject-area,covid,title,authors,abstract,posted
56,10.1101/2021.04.26.441407,12,bioRxiv,Developmental Biology,False,Guidance by followers ensures long-range coordination of cell migration through α-Catenin mechanoperception,"[{'given': 'Arthur', 'family': 'Boutillon', 'sequence': 'first', 'affiliation': []}, {'given': 'Diego', 'family': 'Jahn', 'sequence': 'additional', 'affiliation': []}, {'given': 'Sebastián', 'family': 'González-Tirado', 'sequence': 'additional', 'affiliation': []}, {'given': 'Jörn', 'family': 'Starruß', 'sequence': 'additional', 'affiliation': []}, {'given': 'Lutz', 'family': 'Brusch', 'sequence': 'additional', 'affiliation': []}, {'given': 'Nicolas B.', 'family': 'David', 'sequence': 'additional', 'affiliation': []}]","<jats:title>Abstract</jats:title><jats:p>Morphogenesis, wound healing and some cancer metastases depend upon migration of cell collectives that need to be guided to their destination as well as coordinated with other cell movements. During zebrafish gastrulation, extension of the embryonic axis is led by the mesendodermal polster that migrates towards the animal pole, followed by axial mesoderm that is undergoing convergence and extension. We here investigate how polster cells are guided towards the animal pole. Using a combination of precise laser ablations, advanced transplantations and functional as well as silico approaches, we establish that the directional information guiding polster cells is mechanical, and is provided by the anteriorward migration of the following cells. This information is detected by cell-cell contact through E-Cadherin/α-Catenin mechanotransduction and propagates from cell to cell over the whole tissue. Such guidance of migrating cells by followers ensures long-range coordination of movements and developmental robustness.</jats:p>",2021-04-27
57,10.1101/2021.04.27.441586,12,bioRxiv,Cell Biology,False,"Kinase activity of TBK1 is required for its binding to STING, but not for its recruitment to the Golgi","[{'given': 'Haruka', 'family': 'Kemmoku', 'sequence': 'first', 'affiliation': []}, {'given': 'Yoshihiko', 'family': 'Kuchitsu', 'sequence': 'additional', 'affiliation': []}, {'ORCID': 'http://orcid.org/0000-0001-9806-910X', 'authenticated-orcid': False, 'given': 'Kojiro', 'family': 'Mukai', 'sequence': 'additional', 'affiliation': []}, {'ORCID': 'http://orcid.org/0000-0003-0464-6370', 'authenticated-orcid': False, 'given': 'Tomohiko', 'family': 'Taguchi', 'sequence': 'additional', 'affiliation': []}]","<jats:title>Abstract</jats:title><jats:p>Stimulator of interferon genes (STING) is an innate immune protein for DNA pathogens. In response to the emergence of DNA in the cytosol, STING relocates from the endoplasmic reticulum (ER) to the Golgi and induces the type I interferon response through cytosolic TANK-binding kinase 1 (TBK1). The molecular mechanism underlying TBK1 activation by STING remains poorly understood. Here we report a cell system by which STING and TBK1 are simultaneously monitored. The system utilizes STING/TBK1-double knockout (KO) cells, fluorescent protein-tagged TBK1 and STING, and super-resolution microscopy. After STING stimulation, TBK1 is directly recruited to the trans-Golgi network (TGN), not to the other parts of the Golgi. The recruitment of TBK1 does not require its kinase activity. C-terminal STING variants (ΔC9 and L373A), in which the TBK1-STING binding interface is mutated or deleted, induce the recruitment of TBK1. These results indicate that the kinase activity of TBK1 or the C-terminal motif of STING is not required for its recruitment to TGN, but rather for the formation of the stable STING signalling complex at TGN.</jats:p>",2021-04-27
58,10.1101/2021.04.29.442004,12,bioRxiv,Bioinformatics,False,VirusTaxo: Taxonomic classification of virus genome using multi-class hierarchical classification by k-mer enrichment,"[{'given': 'Rajan Saha', 'family': 'Raju', 'sequence': 'first', 'affiliation': []}, {'given': 'Abdullah Al', 'family': 'Nahid', 'sequence': 'additional', 'affiliation': []}, {'given': 'Preonath', 'family': 'Shuvo', 'sequence': 'additional', 'affiliation': []}, {'ORCID': 'http://orcid.org/0000-0001-6747-6191', 'authenticated-orcid': False, 'given': 'Rashedul', 'family': 'Islam', 'sequence': 'additional', 'affiliation': []}]","<jats:p>Taxonomic classification of viruses is a multi-class hierarchical classification problem, as taxonomic ranks (e.g., order, family and genus) of viruses are hierarchically structured and have multiple classes in each rank. Classification of biological sequences which are hierarchically structured with multiple classes is challenging. Here we developed a machine learning architecture, VirusTaxo, using a multi-class hierarchical classification by k-mer enrichment. VirusTaxo classifies DNA and RNA viruses to their taxonomic ranks using genome sequence. To assign taxonomic ranks, VirusTaxo extracts k-mers from genome sequence and creates bag-of-k-mers for each class in a rank. VirusTaxo uses a top-down hierarchical classification approach and accurately assigns the order, family and genus of a virus from the genome sequence. The average accuracies of VirusTaxo for DNA viruses are 99% (order), 98% (family) and 95% (genus) and for RNA viruses 97% (order), 96% (family) and 82% (genus). VirusTaxo can be used to detect taxonomy of novel viruses using full length genome or contig sequences.</jats:p>",2021-04-30
59,10.1101/2021.04.27.441665,12,bioRxiv,Neuroscience,False,The medial orbitofrontal cortex - basolateral amygdala circuit regulates the influence of reward cues on adaptive behavior and choice,"[{'given': 'Nina T.', 'family': 'Lichtenberg', 'sequence': 'first', 'affiliation': []}, {'given': 'Linnea', 'family': 'Sepe-Forrest', 'sequence': 'additional', 'affiliation': []}, {'given': 'Zachary T.', 'family': 'Pennington', 'sequence': 'additional', 'affiliation': []}, {'given': 'Alexander C.', 'family': 'Lamparelli', 'sequence': 'additional', 'affiliation': []}, {'given': 'Venuz Y.', 'family': 'Greenfield', 'sequence': 'additional', 'affiliation': []}, {'given': 'Kate M.', 'family': 'Wassum', 'sequence': 'additional', 'affiliation': []}]","<jats:title>ABSTRACT</jats:title><jats:p>Adaptive reward-related decision making requires accurate prospective consideration of the current availability and desirability of potential rewarding options. Often this information must be inferred based on the presence of predictive environmental events. The basolateral amygdala (BLA) and medial orbitofrontal cortex (mOFC) are two key nodes in the circuitry supporting such outcome guided behavior, but very little is known about the function of direct connections between these regions. Here, in male rats, we first anatomically confirmed the existence of bidirectional, direct projections between the mOFC and BLA and found that BLA projections to mOFC are distinct from those to lateral OFC (lOFC). Next, using pathway-specific chemogenetic inhibition and the outcome-selective Pavlovian-to-instrumental transfer and devaluation tests, we interrogated the function of the bidirectional mOFC→BLA connections in reward-directed behavior. We found evidence that the mOFC→BLA pathway mediates the use of environmental cues to predict which reward is available, information needed to infer which action to choose, and how desirable that reward is to ensure adaptive cue responses. By contrast, the BLA→mOFC pathway is not needed to use cues to know which reward is available but is needed to use the current desirability of that reward to infer how advantageous it would be to respond to the cue. These functions differ from those we previously identified for the lOFC-BLA circuit. Collectively, these data reveal the mOFC-BLA circuit as critical for the cue-dependent reward outcome expectations that influence adaptive behavior and decision making.</jats:p><jats:sec><jats:title>SIGNIFICANCE STATEMENT</jats:title><jats:p>To make good decisions we evaluate how advantageous a particular course of action would be. This requires understanding what rewarding events might be available and how desirable those events are currently. Such prospective considerations are critical for adaptive decision making but are disrupted in many psychiatric diseases. Here we reveal that direct connections between the medial orbitofrontal cortex and basolateral amygdala mediate these functions. These findings are especially important in light of evidence of dysfunction in this circuit in substance use disorder and mental illnesses marked by poor decision making.</jats:p></jats:sec>",2021-04-27
60,10.1101/2021.04.27.441656,12,bioRxiv,Cancer Biology,False,Immune microenvironment subtypes and association with tumor cell mutations and antigen expression in follicular lymphoma,"[{'given': 'Guangchun', 'family': 'Han', 'sequence': 'first', 'affiliation': []}, {'given': 'Qing', 'family': 'Deng', 'sequence': 'additional', 'affiliation': []}, {'given': 'Enyu', 'family': 'Dai', 'sequence': 'additional', 'affiliation': []}, {'given': 'Minghao', 'family': 'Dang', 'sequence': 'additional', 'affiliation': []}, {'given': 'John', 'family': 'Ma', 'sequence': 'additional', 'affiliation': []}, {'given': 'Haopeng', 'family': 'Yang', 'sequence': 'additional', 'affiliation': []}, {'given': 'Olga', 'family': 'Kudryashova', 'sequence': 'additional', 'affiliation': []}, {'given': 'Mark', 'family': 'Meerson', 'sequence': 'additional', 'affiliation': []}, {'given': 'Sergey', 'family': 'Isaev', 'sequence': 'additional', 'affiliation': []}, {'given': 'Nikita', 'family': 'Kotlov', 'sequence': 'additional', 'affiliation': []}, {'given': 'Krystle', 'family': 'Nomie', 'sequence': 'additional', 'affiliation': []}, {'given': 'Alexander', 'family': 'Bagaev', 'sequence': 'additional', 'affiliation': []}, {'given': 'Simrit', 'family': 'Parmar', 'sequence': 'additional', 'affiliation': []}, {'given': 'Fredrick', 'family': 'Hagemeister', 'sequence': 'additional', 'affiliation': []}, {'given': 'Sairah', 'family': 'Ahmed', 'sequence': 'additional', 'affiliation': []}, {'given': 'Swami', 'family': 'Iyer', 'sequence': 'additional', 'affiliation': []}, {'given': 'Filepe', 'family': 'Samaniego', 'sequence': 'additional', 'affiliation': []}, {'given': 'Raphael', 'family': 'Steiner', 'sequence': 'additional', 'affiliation': []}, {'given': 'Luis', 'family': 'Fayad', 'sequence': 'additional', 'affiliation': []}, {'given': 'Hun', 'family': 'Lee', 'sequence': 'additional', 'affiliation': []}, {'given': 'Nathan', 'family': 'Fowler', 'sequence': 'additional', 'affiliation': []}, {'given': 'Francisco', 'family': 'Vega', 'sequence': 'additional', 'affiliation': []}, {'given': 'Christopher R.', 'family': 'Flowers', 'sequence': 'additional', 'affiliation': []}, {'given': 'Paolo', 'family': 'Strati', 'sequence': 'additional', 'affiliation': []}, {'given': 'Jason R.', 'family': 'Westin', 'sequence': 'additional', 'affiliation': []}, {'given': 'Sattva S.', 'family': 'Neelapu', 'sequence': 'additional', 'affiliation': []}, {'given': 'Loretta J.', 'family': 'Nastoupil', 'sequence': 'additional', 'affiliation': []}, {'given': 'Linghua', 'family': 'Wang', 'sequence': 'additional', 'affiliation': []}, {'ORCID': 'http://orcid.org/0000-0001-6309-9472', 'authenticated-orcid': False, 'given': 'Michael R.', 'family': 'Green', 'sequence': 'additional', 'affiliation': []}]","<jats:title>Abstract</jats:title><jats:p>Follicular lymphoma (FL) is a B-cell lymphoma with a complex tumor microenvironment that is rich in non-malignant immune cells. We applied single-cell RNA-sequencing to characterize the diverse tumor and immune cell populations of FL and identified major phenotypic subsets of FL T-cells including a novel cytotoxic CD4 T-cell population. Their relative proportions of T-cells defined four major FL subtypes, characterized by differential representation or relative depletion of distinct T-cell subsets. By integrating exome sequencing, we observed that somatic mutations are associated with, but not definitive for, reduced antigen presentation on FL cells. In turn, expression of MHC class II genes by FL cells was associated with significant differences in the proportions and targetable immunophenotypic characteristics. This provides a classification framework of the FL microenvironment, their association with FL genotypes and antigen presentation, and informs different potential immunotherapeutic strategies based upon tumor cell MHC class II expression.</jats:p><jats:sec><jats:title>Statement of significance</jats:title><jats:p>We have characterized the FL-infiltrating T-cells, identified cytotoxic CD4 T-cells as an important component, showed that the abundance of these T-cell populations is associated with tumor-cell-intrinsic characteristics, and identified sets of targetable immune checkpoints on T-cells that differed between FLs with normal versus low antigen presentation.</jats:p></jats:sec>",2021-04-28
61,10.1101/2021.04.26.21256138,11,medRxiv,Infectious Diseases (except HIV/AIDS),True,Development of a Real-Time Risk Model (RTRM) for Predicting In-Hospital COVID-19 Mortality,"[{'ORCID': 'http://orcid.org/0000-0001-5127-4034', 'authenticated-orcid': False, 'given': 'Daniel', 'family': 'Schlauch', 'sequence': 'first', 'affiliation': []}, {'ORCID': 'http://orcid.org/0000-0002-8635-9705', 'authenticated-orcid': False, 'given': 'Arielle M.', 'family': 'Fisher', 'sequence': 'additional', 'affiliation': []}, {'given': 'Jessica', 'family': 'Correia', 'sequence': 'additional', 'affiliation': []}, {'given': 'Xiaotong', 'family': 'Fu', 'sequence': 'additional', 'affiliation': []}, {'given': 'Casey', 'family': 'Martin', 'sequence': 'additional', 'affiliation': []}, {'ORCID': 'http://orcid.org/0000-0002-3858-2734', 'authenticated-orcid': False, 'given': 'Angela', 'family': 'Junglen', 'sequence': 'additional', 'affiliation': []}, {'ORCID': 'http://orcid.org/0000-0002-1501-2931', 'authenticated-orcid': False, 'given': 'Howard A.', 'family': 'Burris', 'sequence': 'additional', 'affiliation': []}, {'ORCID': 'http://orcid.org/0000-0003-3748-7492', 'authenticated-orcid': False, 'given': 'Lindsay E.', 'family': 'Sears', 'sequence': 'additional', 'affiliation': []}, {'given': 'Gregg', 'family': 'Fromell', 'sequence': 'additional', 'affiliation': []}, {'given': 'Mick', 'family': 'Correll', 'sequence': 'additional', 'affiliation': []}, {'ORCID': 'http://orcid.org/0000-0003-2462-0186', 'authenticated-orcid': False, 'given': 'Charles F.', 'family': 'LeMaistre', 'sequence': 'additional', 'affiliation': []}, {'ORCID': 'http://orcid.org/0000-0002-6472-939X', 'authenticated-orcid': False, 'given': 'Shanna A.', 'family': 'Arnold Egloff', 'sequence': 'additional', 'affiliation': []}]","<jats:p>Background: With over 83 million cases and 1.8 million deaths reported worldwide by the end of 2020 for SARS-CoV-2 (COVID-19), there is an urgent need to enhance identification of high-risk populations to properly evaluate therapy effectiveness with real-world evidence and improve outcomes.

Methods: Baseline and daily indicators were evaluated using electronic health records for 46,971 patients hospitalized with COVID-19 from 176 HCA Healthcare-affiliated hospitals, presenting from March to September 2020, to develop a real-time risk model (RTRM) of all-cause, hospitalized mortality. Patient facility, dates-of-care, clinico-demographics, comorbidities, vitals, laboratory markers, and respiratory support findings were aggregated in a logistic regression model.

Findings: The RTRM predicted overall mortality as well as mortality 1, 3, and 7 days in advance with an area under the receiver operating characteristic curve (AUCROC) of 0.905, 0.911, 0.905, and 0.901 respectively, significantly outperforming a combined model of age and daily modified WHO progression scale (all p&lt;0.0001; AUCROC, 0.846, 0.848, 0.850, and 0.852). The RTRM delineated risk at presentation from ongoing risk associated with medical care and showed that mortality rates decreased over time due to both decreased severity and changes in care.

Interpretation: To our knowledge, this study is the largest of its kind to comprehensively evaluate predictors and incorporate daily risk measures of COVID-19 mortality. The RTRM validates current literature trends in mortality across time and allows direct translation for research and clinical applications.</jats:p>",2021-04-28
62,10.1101/2021.04.26.441422,11,bioRxiv,Genetics,False,Discovery of an unusual high number of de novo mutations in sperm of older men using duplex sequencing,"[{'given': 'Renato', 'family': 'Salazar', 'sequence': 'first', 'affiliation': []}, {'ORCID': 'http://orcid.org/0000-0001-8367-1560', 'authenticated-orcid': False, 'given': 'Barbara', 'family': 'Arbeithuber', 'sequence': 'additional', 'affiliation': []}, {'given': 'Maja', 'family': 'Ivankovic', 'sequence': 'additional', 'affiliation': []}, {'given': 'Monika', 'family': 'Heinzl', 'sequence': 'additional', 'affiliation': []}, {'ORCID': 'http://orcid.org/0000-0002-9000-2290', 'authenticated-orcid': False, 'given': 'Sofia', 'family': 'Moura', 'sequence': 'additional', 'affiliation': []}, {'ORCID': 'http://orcid.org/0000-0002-4522-2999', 'authenticated-orcid': False, 'given': 'Ingrid', 'family': 'Hartl', 'sequence': 'additional', 'affiliation': []}, {'ORCID': 'http://orcid.org/0000-0002-6917-1364', 'authenticated-orcid': False, 'given': 'Theresa', 'family': 'Mair', 'sequence': 'additional', 'affiliation': []}, {'ORCID': 'http://orcid.org/0000-0001-7402-3369', 'authenticated-orcid': False, 'given': 'Angelika', 'family': 'Heissl', 'sequence': 'additional', 'affiliation': []}, {'given': 'Thomas', 'family': 'Ebner', 'sequence': 'additional', 'affiliation': []}, {'ORCID': 'http://orcid.org/0000-0002-8583-6071', 'authenticated-orcid': False, 'given': 'Omar', 'family': 'Shebl', 'sequence': 'additional', 'affiliation': []}, {'ORCID': 'http://orcid.org/0000-0002-0635-2598', 'authenticated-orcid': False, 'given': 'Johannes', 'family': 'Pröll', 'sequence': 'additional', 'affiliation': []}, {'ORCID': 'http://orcid.org/0000-0002-3621-7020', 'authenticated-orcid': False, 'given': 'Irene', 'family': 'Tiemann-Boege', 'sequence': 'additional', 'affiliation': []}]","<jats:title>Abstract</jats:title><jats:p><jats:italic>De novo</jats:italic> mutations (DNMs) are an important player in heritable diseases and evolution, yet little is known about the different mutagenic processes in our germline given the difficulty to reliably identify ultra-low frequency variants. Of particular interest are highly recurrent DNMs associated with congenital disorders that have been described as selfish mutations expanding in the male germline, thus becoming more frequent with age. Here, we have adapted duplex sequencing (DS), an ultra-deep sequencing method that renders sequence information on both DNA strands; thus, one mutation can be reliably called in millions of sequenced bases. With DS, we examined ~4.5 kb of the <jats:italic>FGFR3</jats:italic> coding region in sperm DNA from older and younger donors. We identified highly mutable sites with mutation frequencies 4-5 orders of magnitude higher than the genome average. Multiple mutations were found at a higher frequency, or exclusively, in older donors, suggesting that these mutations are testis exclusive mosaics expanding in the male germline with age. Also, older donors harbored more mutations associated with congenital disorders. Some mutations were found in both age groups with no significant difference, suggesting that these might result from a different mechanism (e.g., post-zygotic mosaicism). We also observed that independently of age, the frequency and deleteriousness of the mutations in sperm were elevated compared to reports in the population. Our approach is an important strategy to identify mutations that could be associated with aberrant receptor tyrosine kinase activity, with unexplored consequences in a society with delayed fatherhood.</jats:p>",2021-04-27
63,10.1101/2021.04.27.441542,11,bioRxiv,Plant Biology,False,The Boundary-Expressed EPIDERMAL PATTERNING FACTOR-LIKE2 Gene Encoding a Signaling Peptide Promotes Cotyledon Growth during Arabidopsis thaliana Embryogenesis,"[{'given': 'Rina', 'family': 'Fujihara', 'sequence': 'first', 'affiliation': []}, {'ORCID': 'http://orcid.org/0000-0002-4123-6154', 'authenticated-orcid': False, 'given': 'Naoyuki', 'family': 'Uchida', 'sequence': 'additional', 'affiliation': []}, {'given': 'Toshiaki', 'family': 'Tameshige', 'sequence': 'additional', 'affiliation': []}, {'ORCID': 'http://orcid.org/0000-0001-6565-7132', 'authenticated-orcid': False, 'given': 'Nozomi', 'family': 'Kawamoto', 'sequence': 'additional', 'affiliation': []}, {'given': 'Yugo', 'family': 'Hotokezaka', 'sequence': 'additional', 'affiliation': []}, {'ORCID': 'http://orcid.org/0000-0002-1379-3930', 'authenticated-orcid': False, 'given': 'Takumi', 'family': 'Higaki', 'sequence': 'additional', 'affiliation': []}, {'ORCID': 'http://orcid.org/0000-0002-1317-7716', 'authenticated-orcid': False, 'given': 'Ruediger', 'family': 'Simon', 'sequence': 'additional', 'affiliation': []}, {'ORCID': 'http://orcid.org/0000-0002-6168-427X', 'authenticated-orcid': False, 'given': 'Keiko U', 'family': 'Torii', 'sequence': 'additional', 'affiliation': []}, {'given': 'Masao', 'family': 'Tasaka', 'sequence': 'additional', 'affiliation': []}, {'ORCID': 'http://orcid.org/0000-0001-9000-7502', 'authenticated-orcid': False, 'given': 'Mitsuhiro', 'family': 'Aida', 'sequence': 'additional', 'affiliation': []}]","<jats:p>The shoot organ boundaries have important roles in plant growth and morphogenesis. It has been reported that a gene encoding a cysteine-rich secreted peptide of the EPIDERMAL PATTERNING FACTOR-LIKE (EPFL) family, <jats:italic>EPFL2</jats:italic>, is expressed in the boundary domain between the two cotyledon primordia of Arabidopsis thaliana embryo. However, its developmental functions remain unknown. This study aimed to analyze the role of <jats:italic>EPFL2</jats:italic> during embryogenesis. We found that cotyledon growth was reduced in its loss-of-function mutants, and this phenotype was associated with the reduction of auxin response peaks at the tips of the primordia. The reduced cotyledon size of the mutant embryo recovered in germinating seedlings, indicating the presence of a factor that acted redundantly with <jats:italic>EPFL2</jats:italic> to promote cotyledon growth in late embryogenesis. Our analysis indicates that the boundary domain between the cotyledon primordia acts as a signaling center that organizes auxin response peaks and promotes cotyledon growth.</jats:p>",2021-04-28
64,10.1101/2021.04.28.441745,11,bioRxiv,Neuroscience,False,Experience-dependent plasticity modulates ongoing activity in the antennal lobe and enhances odor representations,"[{'ORCID': 'http://orcid.org/0000-0003-3156-8320', 'authenticated-orcid': False, 'given': 'Luis M', 'family': 'Franco', 'sequence': 'first', 'affiliation': []}, {'ORCID': 'http://orcid.org/0000-0003-3761-0235', 'authenticated-orcid': False, 'given': 'Emre', 'family': 'Yaksi', 'sequence': 'additional', 'affiliation': []}]","<jats:p>Ongoing neural activity has been observed across several brain regions and thought to reflect the internal state of the brain. Yet, it is not fully understood how ongoing brain activity interacts with sensory experience and shape sensory representations. Here, we show that projection neurons of the fruit fly antennal lobe exhibit spatiotemporally organized ongoing activity in the absence of odor stimulation. Upon repeated exposure to odors, we observe a gradual and long-lasting decrease in the amplitude and frequency of spontaneous calcium events, as well as a reorganization of correlations between olfactory glomeruli during ongoing activity. Accompanying these plastic changes, we find that repeated odor experience reduces trial-to-trial variability and enhances the specificity of odor representations. Our results reveal a previously undescribed experience-dependent plasticity of ongoing and sensory driven activity at peripheral levels of the fruit fly olfactory system.</jats:p>",2021-04-29
