,doi,tweets,archive,subject-area,covid,title,authors,abstract,posted
84,10.1101/2021.04.27.441672,8,bioRxiv,Bioinformatics,False,TReNCo: Topologically associating domain (TAD) aware regulatory network construction,"[{'ORCID': 'http://orcid.org/0000-0003-3329-2567', 'authenticated-orcid': False, 'given': 'Christopher', 'family': 'Bennett', 'sequence': 'first', 'affiliation': []}, {'given': 'Viren', 'family': 'Amin', 'sequence': 'additional', 'affiliation': []}, {'given': 'Daehwan', 'family': 'Kim', 'sequence': 'additional', 'affiliation': []}, {'ORCID': 'http://orcid.org/0000-0002-0622-0376', 'authenticated-orcid': False, 'given': 'Murat', 'family': 'Cobanoglu', 'sequence': 'additional', 'affiliation': []}, {'ORCID': 'http://orcid.org/0000-0002-0144-0564', 'authenticated-orcid': False, 'given': 'Venkat', 'family': 'Malladi', 'sequence': 'additional', 'affiliation': []}]","<jats:title>Abstract</jats:title><jats:p>There has long been a desire to understand, describe, and model gene regulatory networks controlling numerous biologically meaningful processes like differentiation. Despite many notable improvements to models over the years, many models do not accurately capture subtle biological and chemical characteristics of the cell such as high-order chromatin domains of the chromosomes. Topologically Associated Domains (TAD) are one of these genomic regions that are enriched for contacts within themselves. Here we present TAD-aware Regulatory Network Construction or TReNCo, a memory-lean method utilizing epigenetic marks of enhancer and promoter activity, and gene expression to create context-specific transcription factor-gene regulatory networks. TReNCo utilizes common assay’s, ChIP-seq, RNA-seq, and TAD boundaries as a hard cutoff, instead of distance based, to efficiently create context-specific TF-gene regulatory networks. We used TReNCo to define the enhancer landscape and identify transcription factors (TFs) that drive the cardiac development of the mouse. Our results show that we are able to build specialized adjacency regulatory network graphs containing biologically relevant connections and time dependent dynamics.</jats:p>",2021-04-28
85,10.1101/2021.04.30.441093,8,bioRxiv,Biophysics,True,Allosteric Cross-Talk Among SARS-CoV-2 Spike's Receptor-Binding Domain Mutations Triggers an Effective Hijacking of Human Cell Receptor,"[{'ORCID': 'http://orcid.org/0000-0002-8387-8956', 'authenticated-orcid': False, 'given': 'Angelo', 'family': 'Spinello', 'sequence': 'first', 'affiliation': []}, {'given': 'Andrea', 'family': 'Saltalamacchia', 'sequence': 'additional', 'affiliation': []}, {'given': 'Jure', 'family': 'Borisek', 'sequence': 'additional', 'affiliation': []}, {'ORCID': 'http://orcid.org/0000-0002-2003-1985', 'authenticated-orcid': False, 'given': 'Alessandra', 'family': 'Magistrato', 'sequence': 'additional', 'affiliation': []}]","<jats:p>The rapid and relentless emergence of novel highly transmissible SARS-CoV-2 variants, possibly decreasing vaccine efficacy, currently represents a formidable medical and societal challenge. These variants frequently hold mutations on the Spike protein's Receptor-Binding Domain (RBD), which, binding to the Angiotensin-Converting Enzyme 2 (ACE2) receptor, mediates viral entry into the host cells. Here, all-atom Molecular Dynamics simulations and Dynamical Network Theory of the wild-type and mutant RDB/ACE2 adducts disclose that while the N501Y mutation (UK variant) enhances the Spike's binding affinity towards ACE2, the N501Y, E484K and K417N mutations (South African variant) aptly adapt to increase SARS-CoV-2 propagation via a two-pronged strategy: (i) effectively grasping ACE2 through an allosteric signaling between pivotal RBD structural elements; and (ii) impairing the binding of antibodies elicited by infected/vaccinated patients. This information, unlocking the molecular terms and evolutionary strategies underlying the increased virulence of emerging SARS-CoV-2 variants, set the basis for developing the next-generation anti-COVID-19 therapeutics.</jats:p>",2021-04-30
86,10.1101/2021.04.24.21256044,8,medRxiv,Infectious Diseases (except HIV/AIDS),True,SARS-CoV-2 virus transfers to skin through contact with contaminated solids,"[{'ORCID': 'http://orcid.org/0000-0002-6271-2623', 'authenticated-orcid': False, 'given': 'Saeed', 'family': 'Behzadinasab', 'sequence': 'first', 'affiliation': []}, {'ORCID': 'http://orcid.org/0000-0002-6556-9092', 'authenticated-orcid': False, 'given': 'Alex W.H.', 'family': 'Chin', 'sequence': 'additional', 'affiliation': []}, {'ORCID': 'http://orcid.org/0000-0002-9482-0215', 'authenticated-orcid': False, 'given': 'Mohsen', 'family': 'Hosseini', 'sequence': 'additional', 'affiliation': []}, {'ORCID': 'http://orcid.org/0000-0002-9101-7953', 'authenticated-orcid': False, 'given': 'Leo L.M.', 'family': 'Poon', 'sequence': 'additional', 'affiliation': []}, {'ORCID': 'http://orcid.org/0000-0002-8207-768X', 'authenticated-orcid': False, 'given': 'William A.', 'family': 'Ducker', 'sequence': 'additional', 'affiliation': []}]","<jats:title>Abstract</jats:title><jats:p>Transfer of SARS-CoV-2 from solids to fingers is one step in infection via contaminated solids, and the possibility of infection from this route has driven calls for increased frequency of handwashing during the COVID-19 pandemic. To analyze this route of infection, we measured the percentage of SARS-CoV-2 that was transferred from a solid to an artificial finger. A droplet of SARS-CoV-2 suspension (1 µL) was placed on a solid, and then artificial skin was briefly pressed against the solid with a light force (3 N). Transfer from a variety of solids was detected, and transfer from the non-porous solids, glass, stainless steel, and Teflon, was substantial (13-16 %) when the droplet was still wet. Transfer still occurred after the droplet evaporated, but it was smaller. We found a lower level of transfer from porous solids but did not find a significant effect of solid wettability for non-porous solids.</jats:p>",2021-04-28
87,10.1101/2021.04.26.441502,8,bioRxiv,Cell Biology,False,Trypanosoma brucei Tim50 Plays a Critical Role in Cell Cycle Regulation and Parasite Infectivity,"[{'given': 'Anuj', 'family': 'Tripathi', 'sequence': 'first', 'affiliation': []}, {'given': 'Ujjal K', 'family': 'Singha', 'sequence': 'additional', 'affiliation': []}, {'given': 'Ayorinde', 'family': 'Cooley', 'sequence': 'additional', 'affiliation': []}, {'given': 'Taneisha', 'family': 'Gillyard', 'sequence': 'additional', 'affiliation': []}, {'given': 'Evan', 'family': 'Krystofiak', 'sequence': 'additional', 'affiliation': []}, {'given': 'Siddharth', 'family': 'Pratap', 'sequence': 'additional', 'affiliation': []}, {'given': 'Jamaine', 'family': 'Davis', 'sequence': 'additional', 'affiliation': []}, {'given': 'Minu', 'family': 'Chaudhuri', 'sequence': 'additional', 'affiliation': []}]","<jats:title>Abstract</jats:title><jats:p>Tim50 is a receptor subunit of the preprotein-translocase of the mitochondrial inner membrane, TIM23. <jats:italic>Trypanosoma brucei</jats:italic>, the infective agent for African trypanosomiasis, possesses a homologue of Tim50 (TbTim50) with a pair of characteristic DXDX(T/V) phosphatase signature motifs. Here, we demonstrated that besides its protein phosphatase activity, the recombinant TbTim50 binds and hydrolyzes phosphatidic acid in a concentration-dependent manner. <jats:italic>In silico</jats:italic> structural homology models identify the putative binding interfaces that may accommodate different phospho-substrates. Interestingly, TbTim50 depletion in the bloodstream form (BF) of <jats:italic>T. brucei</jats:italic> reduced cardiolipin (CL) levels and decreased mitochondrial membrane potential (ΔΨ). TbTim50 knockdown (KD) also reduced the population of G2 phase and increased G1 phase; thus, BF cell growth was reduced. Confocal and electron microscopy revealed a defect in regulation of kinetoplast (kDNA) replication due to TbTim50 KD. Depletion of TbTim50 increased the levels of AMPK phosphorylation, and parasite morphology was changed to stumpy-like with upregulation of few stumpy marker gene expressions. Importantly, we observed that TbTim50-depleted parasites were unable to establish infection in mice and rats. Proteomics analysis showed reductions of the translation factors, flagellar transport proteins, and many proteasomal subunits, including the mitochondrial HslVU that is known to play a role in kDNA replication. Reduction of the level of HslV in TbTim50 KD cells was further validated by immunoblot analysis. Altogether, our results showed that TbTim50 is essential for mitochondrial function, regulation of kDNA replication, and cell cycle in the BF. Therefore, TbTim50 is an important target for structure-based drug design to combat African trypanosomiasis.</jats:p><jats:sec><jats:title>Importance</jats:title><jats:p>African trypanosomiasis, a neglected tropical disease caused by parasitic protozoan <jats:italic>Trypanosoma brucei</jats:italic>, is transmitted by the tsetse fly prevalent in sub-Saharan Africa. During its digenetic life cycle, <jats:italic>T. brucei</jats:italic> undergoes multiple developmental changes to adapt in different environments. <jats:italic>T. brucei</jats:italic> BF, dwelling in mammalian blood, generates ATP from glycolysis and hydrolyzes ATP in mitochondria for inner membrane potential. We found that TbTim50, a HAD-family phosphatase, is critical for <jats:italic>T. brucei</jats:italic> BF survival <jats:italic>in vitro</jats:italic> and <jats:italic>in vivo</jats:italic>. Depletion of TbTim50 in BF reduced CL levels and mitochondrial ΔΨ and caused a detrimental effect on many cellular functions. Cells accumulated in G1-S phase, and kinetoplast was over-replicated due to depletion of mitochondrial proteasomes, HslVU, a master-regulator of kDNA replication. Cell growth inhibition was accompanied by changes in morphology, AMPK phosphorylation, and upregulation of stumpy-specific gene expression. TbTim50 is essential for <jats:italic>T. brucei</jats:italic> survival and an important <jats:italic>T. brucei</jats:italic> therapeutic target.</jats:p></jats:sec>",2021-04-27
88,10.1101/2021.04.27.441521,8,bioRxiv,Biochemistry,True,Thermostable designed ankyrin repeat proteins (DARPins) as building blocks for innovative drugs,"[{'ORCID': 'http://orcid.org/0000-0002-2206-0501', 'authenticated-orcid': False, 'given': 'Johannes', 'family': 'Schilling', 'sequence': 'first', 'affiliation': []}, {'ORCID': 'http://orcid.org/0000-0002-4169-5879', 'authenticated-orcid': False, 'given': 'Christian', 'family': 'Jost', 'sequence': 'additional', 'affiliation': []}, {'ORCID': 'http://orcid.org/0000-0002-5935-3332', 'authenticated-orcid': False, 'given': 'Ioana Mariuca', 'family': 'Ilie', 'sequence': 'additional', 'affiliation': []}, {'ORCID': 'http://orcid.org/0000-0003-2452-9892', 'authenticated-orcid': False, 'given': 'Joachim', 'family': 'Schnabl', 'sequence': 'additional', 'affiliation': []}, {'given': 'Oralea', 'family': 'Buechi', 'sequence': 'additional', 'affiliation': []}, {'ORCID': 'http://orcid.org/0000-0001-7269-3633', 'authenticated-orcid': False, 'given': 'Rohan S.', 'family': 'Eapen', 'sequence': 'additional', 'affiliation': []}, {'given': 'Rafaela', 'family': 'Truffer', 'sequence': 'additional', 'affiliation': []}, {'ORCID': 'http://orcid.org/0000-0002-2317-6792', 'authenticated-orcid': False, 'given': 'Amedeo', 'family': 'Caflisch', 'sequence': 'additional', 'affiliation': []}, {'ORCID': 'http://orcid.org/0000-0002-9717-0991', 'authenticated-orcid': False, 'given': 'Patrik', 'family': 'Forrer', 'sequence': 'additional', 'affiliation': []}]","<jats:title>Abstract</jats:title><jats:p>Designed Ankyrin Repeat Proteins (DARPins) are a class of antibody mimetics with a high and mostly unexplored potential in drug development. They are clinically validated and thus represent a true alternative to classical immunoglobulin formats. In contrast to immunoglobulins, they are built from solenoid protein domains comprising an N-terminal capping repeat, one or more internal repeats and a C-terminal capping repeat. By using <jats:italic>in silico</jats:italic> analysis and a rationally guided Ala-Scan, we identified position 17 of the N-terminal capping repeat to play a key role for the overall protein thermostability. The melting temperature of a DARPin domain with a single full-consensus internal repeat was increased by about 8°C to 10°C when the original Asp17 was replaced by Leu, Val, Ile, Met, Ala or Thr, as shown by high-temperature unfolding experiments at equilibrium. We then transferred the Asp17Leu mutation to various backgrounds, including different N- and C-terminal capping repeats and clinically validated DARPin domains, such as the VEGF-binding ankyrin repeat domain of abicipar pegol. In all cases, the proteins remained monomeric and showed improvements in the thermostability of about 8°C to 16°C. Thus, the replacement of Asp17 seems to be generically applicable to this drug class. Molecular dynamics simulations show that the Asp17Leu mutation reduces electrostatic repulsion and improves van-der-Waals packing, rendering the DARPin domain less flexible and more stable. Interestingly, such a beneficial Asp17Leu mutation is present in the N-terminal caps of three of the five DARPin domains of ensovibep, a SARS-CoV-2 entry inhibitor currently in clinical development. This mutation is likely responsible, at least in part, for the very high melting temperature (&gt;90°C) of this promising anti-Covid-19 drug. Overall, such N-terminal capping repeats with increased thermostability seem to be beneficial for the development of innovative drugs based on DARPins.</jats:p>",2021-04-27
89,10.1101/2021.04.26.441556,8,bioRxiv,Immunology,False,Maternal Obesity Dysregulates Fetal Hematopoietic Stem and Progenitor Cell Development in Rhesus Macaques,"[{'ORCID': 'http://orcid.org/0000-0002-4141-8564', 'authenticated-orcid': False, 'given': 'Suhas', 'family': 'Sureshchandra', 'sequence': 'first', 'affiliation': []}, {'given': 'Jacob J.', 'family': 'Robino', 'sequence': 'additional', 'affiliation': []}, {'ORCID': 'http://orcid.org/0000-0002-5667-5600', 'authenticated-orcid': False, 'given': 'Devorah', 'family': 'Goldman', 'sequence': 'additional', 'affiliation': []}, {'ORCID': 'http://orcid.org/0000-0002-2867-5582', 'authenticated-orcid': False, 'given': 'Diana', 'family': 'Takahashi', 'sequence': 'additional', 'affiliation': []}, {'ORCID': 'http://orcid.org/0000-0003-3137-1085', 'authenticated-orcid': False, 'given': 'Weining', 'family': 'Shen', 'sequence': 'additional', 'affiliation': []}, {'ORCID': 'http://orcid.org/0000-0002-6760-3733', 'authenticated-orcid': False, 'given': 'Jon D.', 'family': 'Hennebold', 'sequence': 'additional', 'affiliation': []}, {'ORCID': 'http://orcid.org/0000-0003-1756-5772', 'authenticated-orcid': False, 'suffix': 'Jr.', 'given': 'Charles T.', 'family': 'Roberts', 'sequence': 'additional', 'affiliation': []}, {'ORCID': 'http://orcid.org/0000-0001-7767-022X', 'authenticated-orcid': False, 'given': 'Benjamin J.', 'family': 'Burwitz', 'sequence': 'additional', 'affiliation': []}, {'ORCID': 'http://orcid.org/0000-0003-3203-2405', 'authenticated-orcid': False, 'given': 'Ilhem', 'family': 'Messaoudi', 'sequence': 'additional', 'affiliation': []}, {'ORCID': 'http://orcid.org/0000-0003-0294-215X', 'authenticated-orcid': False, 'given': 'Oleg', 'family': 'Varlamov', 'sequence': 'additional', 'affiliation': []}]","<jats:title>ABSTRACT</jats:title><jats:p>Infants from obese moms have an increased susceptibility to immune dysregulation. However, the mechanisms by which maternal obesity alters fetal hematopoiesis remain largely unknown. Here, we determined the impact of maternal consumption of an obesogenic western-style diet (WSD) on hematopoietic development in fetal rhesus macaques using a combination of phenotypic, functional, and genomic assays. We demonstrate that maternal WSD resulted in accelerated fetal growth and altered fetal hematopoiesis. Specifically, single-cell RNA sequencing analysis of fetal bone marrow HSPCs showed that maternal WSD altered the transcriptional program of the common lymphoid progenitors and decreased the frequencies of bone marrow B-cells and NK-cells. Despite an expansion of monocyte progenitors in FBM, fetal blood monocytes from the WSD group demonstrated a blunted response to bacterial lipopolysaccharide. Furthermore, maternal WSD led to poor engraftment of fetal HSPCs in nonlethally irradiated immunodeficient NOD/SCID/IL2rγ<jats:sup>-/-</jats:sup>mice. Collectively, this study demonstrates that maternal WSD dysregulates fetal HSPC development.</jats:p>",2021-04-27
90,10.1101/2021.04.24.21255884,8,medRxiv,Genetic and Genomic Medicine,False,"A versatile, fast and unbiased method for estimation of gene-by-environment interaction effects on biobank-scale datasets","[{'ORCID': 'http://orcid.org/0000-0001-5076-279X', 'authenticated-orcid': False, 'given': 'Mohammad', 'family': 'Khan', 'sequence': 'first', 'affiliation': []}, {'ORCID': 'http://orcid.org/0000-0001-6280-3739', 'authenticated-orcid': False, 'given': 'Matteo', 'family': 'Di Scipio', 'sequence': 'additional', 'affiliation': []}, {'ORCID': 'http://orcid.org/0000-0001-9473-2920', 'authenticated-orcid': False, 'given': 'Conor', 'family': 'Judge', 'sequence': 'additional', 'affiliation': []}, {'ORCID': 'http://orcid.org/0000-0002-2395-2333', 'authenticated-orcid': False, 'given': 'Nicolas', 'family': 'Perrot', 'sequence': 'additional', 'affiliation': []}, {'ORCID': 'http://orcid.org/0000-0002-0555-4622', 'authenticated-orcid': False, 'given': 'Michael', 'family': 'Chong', 'sequence': 'additional', 'affiliation': []}, {'ORCID': 'http://orcid.org/0000-0002-0881-2412', 'authenticated-orcid': False, 'given': 'Shihong', 'family': 'Mao', 'sequence': 'additional', 'affiliation': []}, {'ORCID': 'http://orcid.org/0000-0003-1707-7613', 'authenticated-orcid': False, 'given': 'Shuang', 'family': 'Di', 'sequence': 'additional', 'affiliation': []}, {'given': 'Walter', 'family': 'Nelson', 'sequence': 'additional', 'affiliation': []}, {'ORCID': 'http://orcid.org/0000-0003-1614-1046', 'authenticated-orcid': False, 'given': 'Jeremy', 'family': 'Petch', 'sequence': 'additional', 'affiliation': []}, {'ORCID': 'http://orcid.org/0000-0002-6795-4760', 'authenticated-orcid': False, 'given': 'Guillaume', 'family': 'Paré', 'sequence': 'additional', 'affiliation': []}]","<jats:title>Abstract</jats:title><jats:p>Current methods to evaluate gene-by-environment (GxE) interactions on biobank-scale datasets are limited. MonsterLM enables multiple linear regression on genome-wide datasets, does not rely on parameters specification and provides unbiased estimates of variance explained by GxE interaction effects. We applied MonsterLM to the UK Biobank for eight blood biomarkers (N=325,991), identifying significant genome-wide interaction variance with waist-to-hip ratio for five biomarkers, with variance explained by interactions ranging from 0.11 to 0.58. 48% to 94% of GxE interaction variance can be attributed to variants without significant marginal association with the phenotype of interest. Conversely, for most traits, &gt;40% of interaction variance was explained by less than 5% of genetic variants. We observed significant improvements in polygenic score prediction with incorporation of GxE interactions in four biomarkers. Our results imply an important contribution of GxE interaction effects, driven largely by a restricted set of variants distinct from loci with strong marginal effects.</jats:p>",2021-04-27
91,10.1101/2021.04.30.442137,7,bioRxiv,Plant Biology,False,Functional characterization of TANGLED1 interaction with PHRAGMOPLAST ORIENTING KINESIN1 during mitosis in Arabidopsis,"[{'given': 'Alison M.', 'family': 'Mills', 'sequence': 'first', 'affiliation': []}, {'ORCID': 'http://orcid.org/0000-0003-4881-6343', 'authenticated-orcid': False, 'given': 'Victoria H.', 'family': 'Morris', 'sequence': 'additional', 'affiliation': []}, {'ORCID': 'http://orcid.org/0000-0002-4354-6295', 'authenticated-orcid': False, 'given': 'Carolyn G', 'family': 'Rasmussen', 'sequence': 'additional', 'affiliation': []}]","<jats:title>Abstract</jats:title><jats:p>Cell division requires spatial coordination to properly position the division plane. How division plane positioning contributes to plant growth remains unknown. Two unrelated microtubule binding proteins, TANGLED1 (TAN1) and AUXIN-INDUCED-IN-ROOT-CULTURES9 (AIR9), are together required for normal Arabidopsis growth and division. <jats:italic>tan1 air9</jats:italic> double mutants have synthetic growth and division plane orientation defects while single mutants lack obvious defects. We show that the first 132 amino acids of TAN1 (TAN1<jats:sub>1-132</jats:sub>) rescue the <jats:italic>tan1 air9</jats:italic> double mutant and localize to the division site during telophase. Loss of both rescue and division-site localization occurred when interaction between TAN1 and PHRAGMOPLAST ORIENTING KINESIN1 (POK1) was disrupted by replacing six amino acid residues with alanines in TAN1<jats:sub>1-132</jats:sub>. However, full-length TAN1 with the same alanine substitutions significantly rescued the <jats:italic>tan1 air9</jats:italic> double mutant and remained at the division site throughout mitosis, although its accumulation was reduced and phragmoplast positioning defects occurred. POK1 often fails to accumulate at the division site in <jats:italic>tan1 air9</jats:italic> mutants, suggesting that both TAN1 and AIR9 stabilize POK1 there. Finally, a mitosis specific promoter driving <jats:italic>TAN1</jats:italic> rescued the <jats:italic>tan1 air9</jats:italic> double mutant phenotypes indicating that defects seen in the root differentiation zone reflect the loss of mitotic-specific TAN1 activity.</jats:p><jats:sec><jats:title>One sentence summary</jats:title><jats:p>Specific amino acids within TAN1 are required for its correct localization and function partially through interaction with POK1; both TAN1 and AIR9 mediate POK1 division site localization.</jats:p></jats:sec>",2021-04-30
92,10.1101/2021.04.27.441621,7,bioRxiv,Synthetic Biology,False,QPromoters: Sequence based prediction of promoter strength in Saccharomyces cerevisiae,"[{'given': 'Devang Haresh', 'family': 'Liya', 'sequence': 'first', 'affiliation': []}, {'given': 'Mirudula', 'family': 'Elanchezhian', 'sequence': 'additional', 'affiliation': []}, {'given': 'Mukulika', 'family': 'Pahari', 'sequence': 'additional', 'affiliation': []}, {'given': 'Nithishwer Mouroug', 'family': 'Anand', 'sequence': 'additional', 'affiliation': []}, {'given': 'Shivani', 'family': 'Suresh', 'sequence': 'additional', 'affiliation': []}, {'given': 'Nivedha', 'family': 'Balaji', 'sequence': 'additional', 'affiliation': []}, {'ORCID': 'http://orcid.org/0000-0003-3523-1477', 'authenticated-orcid': False, 'given': 'Ashwin Kumar', 'family': 'Jainarayanan', 'sequence': 'additional', 'affiliation': []}]","<jats:title>Abstract</jats:title><jats:p>Promoters play a key role in influencing transcriptional regulation for fine-tuning expression of genes. Heterologous promoter engineering has been a widely used concept to control the level of transcription in all model organisms. The strength of a promoter is mainly determined by its nucleotide composition. Many promoter libraries have been curated but few have attempted to develop theoretical methods to predict the strength of promoters from its nucleotide sequence.</jats:p><jats:p>Such theoretical methods are not only valuable in the design of promoters with specified strength, but are also meaningful to understand the mechanism of promoters in gene transcription. In this study, we present a theoretical model to describe the relationship between promoter strength and nucleotide sequence in <jats:italic>Saccharomyces cerevisiae</jats:italic>. We infer from our analysis that the −49 to 10 sequence with respect to the Transcription Start Site represents the minimal region that can be used to predict the promoter strength. We present an online tool <jats:ext-link xmlns:xlink=""http://www.w3.org/1999/xlink"" ext-link-type=""uri"" xlink:href=""https://qpromoters.com/"">https://qpromoters.com/</jats:ext-link> that takes advantage of this fact to quickly quantify the strength of the promoters.</jats:p>",2021-04-28
